title,salary,city,job,publish_date,requirements,responsibilities,url,source
Менеджер (15 грейд) сектора развития ИТ систем на базе SAP Департамента информационных технологий филиала АО «НК «ҚТЖ» - «Дирекция магистральной сети»,,Астана,Филиал АО «НК «ҚТЖ» - «Дирекция магистральной сети»;,,,"и управление (автоматика, телемеханика и связь на ж.д. транспорте); Информатика; Информационные системы; Системы информационной безопасности, Вычислительная техника и программное обеспечение, Математическое ...",https://qyzmet.kz/jobdesc?id=20634844&src=js,qyzmet_parser
Менеджер (15 грейд) сектора разработки и внедрения ИТ систем Департамента информационных технологий филиала АО «НК «ҚТЖ» - «Дирекция магистральной сети»,,Астана,Филиал АО «НК «ҚТЖ» - «Дирекция магистральной сети»;,,,"информационной безопасности, Вычислительная техника и программное обеспечение, Математическое ... проектировании архитектуры информационных систем (ИС), автоматизированных рабочих мест (АРМ ...",https://qyzmet.kz/jobdesc?id=20634845&src=js,qyzmet_parser
"Ведущий специалист, Категория E-G-4",От 210 086 ₸,Ескельдинский район,"Государственное учреждение ""Аппарат акима Акын Саринского сельского округа""",,,мероприятий; 16. обеспечивает соблюдение технической безопасности; 17. обеспечивает соблюдение информационной безопасности; 18. обеспечивает соблюдение внутреннего трудового распорядка аппарата. 19 ...,https://qyzmet.kz/jobdesc?id=20641735&src=js,qyzmet_parser
Учитель информатики,От 250 000 ₸,"Алматы, Турксибский район","Товарищество с ограниченной ответственностью ""Финансовый лицей JOS""",,,": алгоритмическое мышление, основы программирования, цифровая грамотность, информационная безопасность ... ответственного отношения к использованию информационных технологий. Участие в мероприятиях, направленных на ...",https://qyzmet.kz/jobdesc?id=20644912&src=js,qyzmet_parser
Специалист технической поддержки,,Петропавловск,Бейкертон,,,удаленного администрирования Базовые знания информационной безопасности. Преимуществом будет: Знание ... Мы запускаем новое современное производство донатов в г. Петропавловске! Это амбициозный проект по ...,https://qyzmet.kz/redir?id=20649789,qyzmet_parser
Менеджер Департамента SAP (Усть-Каменогорск),,Астана,KAP Technology,,,"; • Знания администрировании ИС, SAP; • Знание информационной безопасности Дополнительно: Лицензии ... сопровождения и развития информационной ИС, а также по оптимизации бизнес-процессов с использованием ...",https://qyzmet.kz/jobdesc?id=20639558&src=js,qyzmet_parser
Бизнес аналитик ИТ,,Астана,Црцэ,,,Обязанности: Анализировать: потребности заказчика информационных систем и его бизнес-процессы; существующие информационные системы; информационные процессы; Проводить: анализ бизнес-процессов; сбор ...,https://qyzmet.kz/redir?id=20636258,qyzmet_parser
Инженер Технической поддержки Сетевой Безопасности (Security),,Алматы,Winncom Technologies/Уиннком Технолоджис,,,: Опыт работы в сфере информационной безопасности не менее трех лет; Английский язык на уровне ... На текущий момент в компанию требуется Инженер Технической поддержки Сетевой Безопасности ...,https://qyzmet.kz/redir?id=20635320,qyzmet_parser
"Заместитель директора департамента маркетинга цен товаров, работ и услуг",,Астана,АО «НК «QazaqGaz»,,,"внутреннего контроля, управления рисками, комплаенс, информационной безопасности ... Обязанности: Обеспечивает исполнение поручений Директора Департамента и координацию деятельности ...",https://qyzmet.kz/jobdesc?id=20635197&src=js,qyzmet_parser
"Главный специалист, Категория D-O-4",От 327 923 ₸,Туркестан,"Государственное учреждение ""Управление культуры Туркестанской области""",,,"требований информационной безопасности. 3.13.участвует в работе по проведению проверок исполнения законов о языке. 3.11.в информационной системе «E-Otinish», касающейся вопросов по развитию языков ...",https://qyzmet.kz/jobdesc?id=20641376&src=js,qyzmet_parser
Специалист по администрированию баз данных (администратор баз данных),От 330 000 ₸,"Астана, Байконурский район","Республиканское государственное предприятие на праве хозяйственного ведения ""Государственная радиочастотная служба"" Министерства искусственного интеллекта и цифрового развития Республики Казахстан",,,"; Оптимизация производительности БД и выполнения запросов к БД; Разработка политики информационной безопасности ... сбоев. Обеспечение безопасности: знание принципов безопасности баз данных, включая управление доступом ...",https://qyzmet.kz/jobdesc?id=20642290&src=js,qyzmet_parser
Системный администратор,До 140 000 RUB,Алматы,"Эксмо, издательство",,,"информационной безопасности, администрирование СКУД; планирование закупок ИТ оборудования и ПО ... Active Directory (политика безопасности, групповые политики), DNS, DHCP, WSUS, Terminal server ...",https://qyzmet.kz/redir?id=20645377,qyzmet_parser
Инженер сектора SCADA департамента АСУТП и связи,,Алматы,ТОО «Казахстанско-Китайский Трубопровод»,,,информационной безопасности комплекса технических и программных средств автоматизированной системы ... производством /информационные технологии / электроника / управление производством и другие связанные ...,https://qyzmet.kz/jobdesc?id=20636954&src=js,qyzmet_parser
Главный менеджер сектора SCADA департамента автоматизированных систем управления технологическими процессами и связи АСУТП и связи,,Алматы,ТОО «Казахстанско-Китайский Трубопровод»,,,информационной безопасности комплекса технических и программных средств автоматизированной системы ... /информационные технологии / электроника / управление производством и другие связанные специальности ...,https://qyzmet.kz/jobdesc?id=20636523&src=js,qyzmet_parser
Ведущий менеджер (Департамента экономики и корпоративных финансов),,Астана,НГК Тау-Кен Самрук,,,"Республики Казахстан в области информационной безопасности, Кодекса Республики Казахстан «О недрах ... директоров Общества; Вносит Бизнес-план в информационную систему управленческого учета АО «Самрук ...",https://qyzmet.kz/jobdesc?id=20635758&src=js,qyzmet_parser
Аудитор Управления по аудиту бизнес процессов Департамента внутреннего аудита,,Астана,Отбасы банк,,,"Обязанности: участие в работе УАБП, а также в выполнении задач и функций, возложенных на ДВА, в соответствии с Положением о ДВА; участие в разработке внутренних документов Банка, регулирующих вопросы ...",https://qyzmet.kz/redir?id=20636467,qyzmet_parser
Системный администратор,110 000 - 120 000 KZT,Степногорск,"Государственное коммунальное казенное предприятие ""Степногорская многопрофильная городская больница"" при управлении здравоохранения Акмолинской области",,,Профессиональные навыки: Администрирование систем защиты информации ИС; Администрирование систем шифрования данных; Мониторинг сетевой безопасности организации; Личные качества: Адаптивность; Условия ...,https://qyzmet.kz/jobdesc?id=20641967&src=js,qyzmet_parser
