title,salary,city,job,publish_date,requirements,responsibilities,url,source
Medical Advisor,,,,,,"Medical Advisor Andersen Занятость	Полная занятость Адрес	Казахстан, Астана РЕКЛАМА Описание вакансии  Andersen is hiring a Medical Advisor for a project focused on healthcare digital transformation, improving service quality, patient engagement, and efficiency of medical services.  The customer is a private healthcare provider operating medical facilities and delivering a wide range of multi-specialty services. The organization focuses on patient-centered care supported by modern technologies and standardized processes. It is actively investing in digital transformation, including EMR systems, workflow automation, and integrated IT solutions, with a strong emphasis on data, interoperability, and information security.  The project is focused on the modernization and digital transformation of a healthcare provider, delivering therapeutic and laboratory services. It aims to improve service quality, enhance digital capabilities, and support efficient healthcare delivery and patient engagement.  Responsibilities:  - Supporting Sales Managers by providing expert consulting in clinical and digital health domains. - Participating in client communications and negotiations with healthcare stakeholders. - Assisting in preparation of presentations and supporting presales activities for Digital Health solutions. - Analyzing client needs, identifying opportunities for digital transformation, and proposing improvements for clinical and administrative processes. - Assessing existing IT systems and recommending optimization strategies. Monitoring MedTech market trends and competitor landscapes to support business strategy. Providing internal consulting on Digital Health topics and sharing domain expertise across teams. Preparing analytical reports and maintaining data in CRM systems. Developing and leading educational programs and training materials on healthcare domains (EHR, EMR, PACS, FHIR/HL7, AI in healthcare). Ensuring teams understand clinical workflows, regulatory requirements (HIPAA, GDPR, regional standards), and best practices. Monitoring industry trends (e.g., HIMSS, HLTH) and proposing innovations, including AI-driven solutions and PoCs. Conducting workshops and webinars, creating guidelines on compliance, data governance, and security. Mentoring junior specialists and contributing to the development of the Center of Excellence (CoE).  Must-haves:  Higher medical education. Clinical practice experience for 10+ years. Excellent verbal and written communication skills. Strong analytical thinking with the ability to explain complex medical concepts to non-specialists and defend viewpoints with clear arguments. Understanding of business processes within commercial organizations. Experience working with medical equipment and Hospital Information Systems (HIS). Experience in projects or consulting within Health IT, Pharma, MedTech, or digital health startups. Strong organizational, administrative, and stakeholder management skills. Level of English – from Upper-Intermediate and above.  Nice-to-haves:  Academic degree and publications in specialized journals. Additional education in management, business, or IT. Experience working with medical equipment and medical information systems (MIS/HIS). Experience collaborating with business (IT, Pharma, MedTech) or international NGOs. International experience: internships or participation in conferences (Europe, USA, Asia, Middle East). Experience implementing quality improvement projects in the workplace. Experience collaborating with digital healthcare startups. Experience working as a Business Analyst in IT projects.  Reasons why this job would be interesting to you:  Experience in teamwork with leaders in FinTech, Healthcare, Retail, Telecom, and others. Andersen cooperates with such businesses as Samsung, Siemens, Johnson & Johnson, BNP Paribas, Ryanair, Mercedes, TUI, Verivox, Allianz, T-Systems, etc.. The opportunity to change the project and/or develop expertise in an interesting business domain. Job conditions – you can work both fully remotely and from the office or can choose a hybrid variant. Guarantee of professional, financial, and career growth! The company has introduced systems of mentoring and adaptation for each new employee. The opportunity to earn up to an additional 1,000 USD per month, depending on the level of expertise, which will be included in the annual bonus, by participating in the company's activities. Access to the corporate training portal, where the entire knowledge base of the company is collected and which is constantly updated. Bright corporate life (parties / pizza days / PlayStation / fruits / coffee / snacks / movies). Certification compensation (AWS, PMP, etc). Referral program. English courses. Private health insurance and compensation for sports activities.  Join us!  Требования Опыт	Более 6 лет Условия работы График работы	Удаленная работа Добавлено 27 дней назад Пожаловаться Отклик на HeadHunter Для связи с работодателем или просмотра контактов нажмите на кнопку",https://qyzmet.kz/redir?id=20481555,qyzmet_deep_parser
Middle Data analyst (Лаборатория продуктов),,,,,,"Middle Data analyst (Лаборатория продуктов) KMF Банк Занятость	Полная занятость Адрес	Казахстан, Алматы, проспект Назарбаева, 50 Описание вакансии  Что делать?  Анализ данных и подготовка отчетов с использованием SQL, Python (приветствуется), (Power BI, Tableau); Проведение статистического анализа и выявление значимых факторов влияния на бизнес-показатели; Подготовка дашбордов и презентаций результатов исследований руководству и коллегам; Участие в разработке методологии сбора и обработки данных;  Если у вас:  Опыт работы в роли data-аналитика от 2-х лет; Отличное знание SQL, умение писать эффективные запросы и оптимизировать работу с большими объемами данных; Опыт работы с системами аналитики и инструментами визуализации данных (Power BI, Tableau); Высокий уровень владения Microsoft Excel: продвинутые формулы, сводные таблицы. Требования Опыт	От 1 года до 3 лет Условия работы График работы	Полный день Добавлено 29 дней назад Пожаловаться Отклик на HeadHunter Для связи с работодателем или просмотра контактов нажмите на кнопку",https://qyzmet.kz/redir?id=20469177,qyzmet_deep_parser
Marketing Data Analyst/Маркетинговый аналитик,,,,,,"Marketing Data Analyst/Маркетинговый аналитик Топассистент Зарплата	от 4000 EUR Занятость	Полная занятость Адрес	Казахстан, Лимасол РЕКЛАМА Описание вакансии  Ищем талантливого Marketing Data Analyst/Маркетингового аналитика в международную компанию в сфере iGaming в офис на Кипре. Если вы хотите работать в динамичной команде профессионалов, развиваться и применять свои аналитические навыки на международном уровне — эта вакансия для вас.  Что предстоит делать:  Проводить анализ эффективности маркетинговых кампаний по различным сегментам и каналам привлечения клиентов.  Исследовать веб-активности, пользовательские метрики и поведенческие показатели.  Оценивать ROI SEO, медийной рекламы, соцсетей, партнёрских программ и блогеров.  Выявлять точки роста на основе когортного анализа, юнит-экономики и анализа конверсий.  Автоматизировать отчётность и создавать дашборды в Tableau или аналогичных BI-инструментах.  Формулировать предложения по повышению эффективности маркетинга и улучшению процессов.  Кого мы ищем:  Специалиста с опытом работы маркетинг-аналитиком или дата-аналитиком от 2 лет.  Профессионала с уверенными навыками работы в MS Excel и знанием SQL.  Специалиста с базовыми знаниями Python для автоматизации аналитических задач.  Эксперта, хорошо разбирающегося в ключевых маркетинговых метриках: ROMI, CAC, LTV и других.  Кандидата с уровнем английского языка не ниже B1.  Что предлагаем:  Работу в комфортном офисе в Лимасоле — в городе с высоким качеством жизни.  Конкурентный уровень заработной платы (обсуждается с успешным кандидатом), официальное оформление по ТК Кипра.  Поддержку дружелюбной команды профессионалов, вовлечённых в своё дело.  Медицинскую страховку.  Бесплатные завтраки и обеды в офисе.  Компенсацию 50% стоимости курсов английского языка.  Абонемент в спортзал для заботы о вашем здоровье.  Если вы готовы применять свою экспертизу в международной команде и развиваться в сфере iGaming — будем рады вашему отклику!  Требования Опыт	От 1 года до 3 лет Условия работы График работы	Полный день Добавлено 28 дней назад Пожаловаться Отклик на HeadHunter Для связи с работодателем или просмотра контактов нажмите на кнопку",https://qyzmet.kz/redir?id=20480382,qyzmet_deep_parser
Business Analyst / Product Owner,,,,,,"Business Analyst / Product Owner Meteoro Platform Занятость	Полная занятость Адрес	Казахстан, Астана Описание вакансии  Мы — команда, которая строит цифровую AI-платформу нового поколения для взаимодействия с интерактивными персонажами. Мы ищем Business Analyst, который станет связующим звеном между бизнес-целями и командой разработки на всех этапах запуска продукта — от внутреннего прототипа до публичного выхода на рынок и масштабирования. Чем предстоит заниматься  Сбор, анализ и формализация бизнес-требований от внутренних стейкхолдеров Преобразование бизнес-целей в конкретные, измеримые задачи для разработки интеллектуальных агентов и контент-конвейеров Формирование и проработка продуктовых гипотез с учётом специфики платформы premium-контента Оценка бизнес-эффекта новых функций и участие в их приоритизации в условиях сжатых сроков time-to-market Подготовка BRD, User Stories, Acceptance Criteria для фич платформы: персонализация, мультиязычность, монетизация, панель администратора Проработка пользовательских сценариев (user flows), включая взаимодействие с AI-инструментами и логику генерации контента по подписке Декомпозиция инициатив и участие в планировании спринтов совместно с Delivery Manager и Tech Lead Анализ ключевых метрик продукта: вовлечённость аудитории, конверсия, юнит-экономика Подготовка аналитических выводов и рекомендаций по улучшению качества продукта и монетизации Поддержка и актуализация проектной документации на всех фазах: MVP → ограниченный запуск → публичный запуск  Что важно для нас  3+ лет опыта в роли Business Analyst / Product Owner / Product Manager Понимание продуктового подхода и жизненного цикла digital-продукта, желательно в AI-, медиа- или entertainment-проектах Умение оценивать влияние фич на бизнес-показатели и юнит-экономику Опыт формулирования и проверки продуктовых гипотез в условиях высокой неопределённости (стартап / pre-launch) Умение структурировать сложную информацию в понятные требования для кросс-функциональной команды Data-driven мышление: умение работать с метриками роста, конверсии и стоимости привлечения Готовность работать в высоком темпе с ориентацией на результат  Будет плюсом  Опыт работы с AI-продуктами или генеративными моделями Понимание механик монетизации цифрового контента (подписки, pay-per-content) Опыт работы в распределённых командах Требования Опыт	От 3 до 6 лет Условия работы График работы	Удаленная работа Добавлено 29 дней назад Пожаловаться Отклик на HeadHunter Для связи с работодателем или просмотра контактов нажмите на кнопку",https://qyzmet.kz/redir?id=20472124,qyzmet_deep_parser
Power BI Analyst (Product Testing),,,,,,"Power BI Analyst (Product Testing) Гусева Дарья Дмитриевна Зарплата	от 128571 до 257142 RUR Занятость	Частичная занятость Адрес	Казахстан, Астана РЕКЛАМА Описание вакансии Обязанности:  — Тестирование продуктовых фич с позиции Power BI аналитика — Проверка логики решений (DAX, модели, метрики) — Выявление ошибок, неочевидных багов и “узких мест” — Оценка применимости решений в реальной работе — Тестирование новых фич Power BI и оценка их практической ценности — Формирование структурированной обратной связи (что не так, почему, как лучше) — Помощь в валидации контента и учебных сценариев на основе реального опыта  Требования:  — 3+ года практического опыта с Power BI — Опыт работы с реальными бизнес-кейсами (не только обучение) — Уверенное понимание DAX и data modeling — Регулярное использование AI-инструментов в работе (ChatGPT, Copilot и др.) — Понимание ограничений AI и умение критически оценивать его ответы — Опыт доработки и поддержки существующих решений — Умение чётко, кратко и по делу формулировать мысли — Способность давать критическую и аргументированную обратную связь  Условия:  — Part-time (2–4 часа в день / по задачам) — Удалённая работа — Оплата почасовая или за задачи — Гибкий график — Работа напрямую с фаундером  Требования Опыт	От 3 до 6 лет Условия работы График работы	Удаленная работа Добавлено 29 дней назад Пожаловаться Отклик на HeadHunter Для связи с работодателем или просмотра контактов нажмите на кнопку",https://qyzmet.kz/redir?id=20469001,qyzmet_deep_parser
Data analyst (Senior),,,,,,"Data analyst (Senior) АО ""Alatau City Bank"" Занятость	Полная занятость Адрес	Казахстан, Алматы, проспект Аль-Фараби, 36 РЕКЛАМА Описание вакансии  Обязанности:  Работа с Data owners, Data stewards. Создание процессов в рамках управления данными. Работа с data catalog, data lineage (OMD). Анализ данных. Развитие DG согласно концепции DAMA Book. Ведение/участие проектов связанных с данными. Проведение системного анализа (Colvir, W4).  Требования:  Знания SQL, ETL, BI. Data анализ. Опыт в работе в Data Governance (желательно), Data engineering. Опыт работы с хранилищем (DWH). Умение строить бизнес процессы (Подразделение: IT, Бизнес, БЭК). Системный анализ.  Условия:  Работа в офисе в Алматы.  Ежеквартальные премии.  Корпоративные предложения по фитнесу.  Бесплатная подписка на онлайн библитеку «Alpina Digital».  Приятная рабочая атмосфера в современном офисе в деловой части города.  Возможность строить карьеру в одном из крупнейших банков Казахстана.  Требования Опыт	От 1 года до 3 лет Условия работы График работы	Полный день Добавлено 1 месяц назад Пожаловаться Отклик на HeadHunter Для связи с работодателем или просмотра контактов нажмите на кнопку",https://qyzmet.kz/redir?id=20440255,qyzmet_deep_parser
Data analyst,,,,,,"Data analyst Freedom Holding Operations Занятость	Полная занятость Адрес	Казахстан, Алматы, проспект Аль-Фараби, 77/7 Описание вакансии  Задачи:  Извлечение данных из различных источников; Обработка и подготовка данных для анализа; Проведение глубокого анализа данных для выявления тенденций и инсайтов; Использование статистических методов для интерпретации данных; Разработка визуализаций и дашбордов для представления данных в понятном формате; Подготовка регулярных отчетов для заинтересованных сторон; Автоматизация отчетности и аналитических процессов для повышения эффективности; Предоставление аналитических рекомендаций для улучшения бизнес-процессов.  Мы ожидаем от кандидата:  Образование:  Степень в области информатики, статистики, экономики или смежных дисциплин.  Опыт работы:  2-3 года опыта в области бизнес-аналитики или анализа данных.  Технические навыки:  Уверенное владение SQL для создания сложных запросов и оптимизации процессов; Опыт работы с большими наборами данных; Опыт работы с инструментами визуализации данных (Power BI).  Аналитические и профессиональные навыки:  Умение применять базовые статистические методы и проводить анализ данных; Понимание бизнес-процессов и способности анализировать их для оптимизации и принятия решений; Способность представлять результаты анализа и визуализации понятным и доступным языком для заинтересованных сторон; Умение работать в команде, критическое мышление и проактивный подход к решению задач.  Что мы предлагаем:  Профессиональный коллектив; Возможность работать над проектами, приносящими пользу для тысяч людей; Неограниченный рост; Комфортный офис в центре города; Скидки на фитнес, обучение английскому языку, подарки на праздники и дни рождения; Бонусы и уникальные предложения от компаний холдинга; Спонсирование профессионального обучения; Насыщенная корпоративная жизнь с выездами на природу, праздничными мероприятиями в офисе, играми и розыгрышами подарков. Требования Опыт	От 3 до 6 лет Условия работы График работы	Полный день Добавлено 1 месяц назад Пожаловаться Отклик на HeadHunter Для связи с работодателем или просмотра контактов нажмите на кнопку",https://qyzmet.kz/redir?id=20397960,qyzmet_deep_parser
