title,salary,city,job,publish_date,requirements,responsibilities,url,source
Data Analyst,,,,,,"Data Analyst Быстрый отклик АО ""Kaspi Bank"" Занятость	Полная занятость Адрес	Казахстан, Алматы, проспект Абая, 26А Описание вакансии  Мы Kaspi.kz - крупнейшая технологическая компания в Казахстане, миссия которой - улучшать людям жизнь. Ежемесячно нашим супер приложением пользуются более 14 млн казахстанцев.  В международный проект маркетплейса требуется опытный аналитик данных, который будет проводить первичный аудит данных, анализ качества данных, проводить исследования влияния рекомендаций на продажи, расчеты, вести статистику и детальную аналитику.  Работа полностью из офиса в городе Алматы, формата удалёнки и гибрида - нет.  Чем предстоит заниматься: Работа с большими объёмами данных: обработка, анализ; Анализировать показатели наших продуктов, находить точки для роста и проблемы, предлагать способы их решения; Проведение A/B-экспериментов, анализ результатов и принятие решений на их основе. Исследование пользовательского поведения и выявление закономерностей в данных; Формирование аналитических отчётов; Участие в разработке и развитии продуктов: от бизнес-анализа и разработки до внедрения и поддержки; Сегментация клиентов и товаров; Требования: Опыт анализа и обработки данных от 1 года как аналитик данных/data miner Отличное владение Python и уверенно использование библиотеки для анализа данных Уверенные навыки написания и оптимизации SQL-запросов, умение работать с большими объёмами данных; Основы статистики; Практический опыт проведения A/B-тестирования: формулировка гипотез, интерпретация результатов, оценка статистической значимости; Базовые знания инструментов разработки и CI/CD (Git, Gitlab, Jira). Опыт в ML-задачах: от сбора данных до внедрения модели в продакшн Условия: Развитие и карьерный рост; Возможность стать частью профессиональной дружной команды Kaspi; Офис в центре города; Обучение, тренинги и курсы за счет компании; Бесплатный тренажерный зал в офисе; Языковые курсы; Электронная библиотека - Kaspi Books и доступное приложение к нему; Chill-зона - уютный дворик, workout-площадка, также удобные скамейки и качели, для полной релаксации :) Отсутствие дресс-кода. Требования Опыт	От 1 года до 3 лет Условия работы График работы	Полный день Добавлено вчера Пожаловаться Быстрый отклик Отклик на HeadHunter",https://qyzmet.kz/redir?id=20645357,qyzmet_deep_parser
Consumer & Shop Insights Analyst,,,,,,"Consumer & Shop Insights Analyst PepsiCo Central Asia (ПепсиКо Центральная Азия) Занятость	Полная занятость Адрес	Казахстан, Алматы, проспект Абая, 109В РЕКЛАМА Описание вакансии  Responsibilities:  Manage the analytical agenda for the company across CIS countries in the Snacks and Juices categories, with a special focus on Kazakhstan, Belarus, and Uzbekistan. Provide business recommendations for brand and category development based on analysis of market and internal data, as well as consumer insights. Effectively apply analytical and forecasting methods in line with business objectives; continuously improve professional skills. Efficiently manage analytical and cross-functional projects, prioritize their implementation within your area of responsibility and business goals. Build strong relationships and project communication with members of cross-country teams and colleagues from other functions; act as a business partner for top management, Marketing, Trade Marketing, and Sales. Establish effective collaboration with agencies (Nielsen, Euromonitor, GfK, etc.).  Requirements:  Higher education, preferably in economics, finance, sociology, or related to statistics/mathematics. 2–3 years of experience in an FMCG company or an agency working in the FMCG sector. Strong analytical thinking and knowledge and practical experience with a wide scope of research methodologies and techniques. Experience in analytics (markets, sales, etc.). English proficiency at upper-intermediate level or higher. Experience in working with Nielsen research agency software is an advantage Advanced user of MS Office (Excel, PowerPoint, etc.). Experience in forecasting and modeling is an advantage  Conditions:  This role is offered on a temporary basis to cover the maternity leave of a permanent employee. Working in an international company with developed corporate values and standards. Official registration in the staff of the company. Stable salary, annual salary increase based on performance. Advanced social package: voluntary medical insurance, life insurance, cellular communication compensation. Opportunity for growth within the company. Требования Опыт	От 3 до 6 лет Условия работы График работы	Полный день Добавлено 2 дня назад Пожаловаться Отклик на HeadHunter Для связи с работодателем или просмотра контактов нажмите на кнопку",https://qyzmet.kz/redir?id=20634273,qyzmet_deep_parser
BI Developer,,,,,,"BI Developer 4Finance Digital Kz Занятость	Полная занятость Адрес	Казахстан, Алматы, проспект Аль-Фараби, 17к4Б РЕКЛАМА Описание вакансии Обязанности:  - Interaction with business stakeholders to gather and analyze reporting requirements; - Development of data marts and participation in DWH architecture design and improvement; - Reporting development in Power BI; - Automation and optimization of business processes; - Writing SQL scripts of varying complexity and optimizing existing queries; - It is possible to use Python to automate and organize ETL processes; - Participation in international projects (Southeast Asia, India, Mexico); - Preparation of dashboards, metrics and KPIs to support decision-making.  Требования:  Experience and Knowledge  Graduate with a mathematics/technical background; 2+ years of experience as Analyst or BI Developer; Solid knowledge of SQL (high level); Intermediate or higher level of English (B1+); Ability to work with data-mining and business intelligence tools such as SQL, PostgreSQL; Experience with data warehouses and ETL workflows; Strong skills in data analysis and reporting; Strong skills in Excel; Desirable experience in Power BI; Desirable experience in Python; Desirable understanding of digital lending and fintech business. Условия: An opportunity to work in an international company within a dynamic, competitive, and fast-paced industry Involvement in challenging projects where your contributions will have a tangible impact A supportive and collaborative team environment with great colleagues Equipment issuance Bonus portion for achieving KPI up to two salaries Требования Опыт	От 1 года до 3 лет Условия работы График работы	Полный день Добавлено вчера Пожаловаться Отклик на HeadHunter Для связи с работодателем или просмотра контактов нажмите на кнопку",https://qyzmet.kz/redir?id=20636735,qyzmet_deep_parser
Middle/Senior Data analyst в Kaspi shop,,,,,,"Middle/Senior Data analyst в Kaspi shop Быстрый отклик АО ""Kaspi Bank"" Занятость	Полная занятость Адрес	Казахстан, Алматы, улица Наурызбай батыра, 154а РЕКЛАМА Описание вакансии   Kaspi — крупнейшая технологическая и финтех-экосистема Казахстана, объединяющая более 10 000 сотрудников. Мы создаем продукты, которыми ежедневно пользуются миллионы людей, и ищем аналитика, который поможет находить точки роста и усиливать бизнес-решения на основе данных.  Вам предстоит:  • Погрузиться в экосистему Kaspi Магазина – крупнейшего e-commerce РК;  • Проверять продуктовые гипотезы и готовить аналитику для поддержки принятия бизнес решений;  • Искать точки роста продаж, продуктов и сервисов Kaspi Магазина за счет анализа данных юридических лиц (продавцов), физических лиц (покупателей) и ассортимента (товаров, размещенных в Kaspi Магазине);  • Автоматизировать витрины данных, отчетность и расчеты бизнес-показателей;  • Разрабатывать детализированные дэшборды и data-продукты;  • Заниматься предиктивным анализом / сегментациями;  • Построение моделей для увеличения вовлеченности в продукты и сервисы Kaspi Магазина.    Что мы ожидаем: • Опыт работы аналитиком данных от 2 лет (желательно: e-commerce, fintech, telecom и др.) • Уверенные навыки работы с SQL (JOIN, GROUP BY, оконные функции) • Опыт работы с Excel (сводные таблицы, визуализация) • Опыт работы с воронками, сегментацией и событийной аналитикой — обязательно • Понимание статистики и продуктовой аналитики  Будет плюсом: • Python (анализ данных) • BI-инструменты (Power BI / Tableau / Qlik) • SAS Enterprise Guide / Miner • Опыт построения ML моделей (регрессия, деревья, бустинг, кластеризация)  В какие направления рассматриваем: • Clients Team — работа с направлениями: Подарки, Отзывы, Трафик, Поиск, Cross-border (Hepsi) • Categories Team — фокус на вертикалях: Fashion и Home & DIY  Что мы предлагаем: • Работа в одной из сильнейших продуктовых команд страны • Возможность влиять на продукт с миллионами пользователей • Профессиональный и карьерный рост • Конкурентную заработную плату • Обучение и развитие  Если хотите присоединиться к нашей команде, оставляйте отклик:)  Требования Опыт	От 1 года до 3 лет Условия работы График работы	Полный день Добавлено 5 дней назад Пожаловаться Быстрый отклик Отклик на HeadHunter",https://qyzmet.kz/redir?id=20451333,qyzmet_deep_parser
BI Analyst / Tableau Developer,,,,,,"BI Analyst / Tableau Developer Tele2/Altel Занятость	Полная занятость Адрес	Казахстан, Алматы, улица Желтоксан, 115 РЕКЛАМА Описание вакансии  Мы верим, что новое качество жизни можно нести через реализацию потенциала современных цифровых услуг. Мы первые третий год подряд по скорости и покрытию связи среди операторов Казахстана по версии Ookla. Мы также лучший работодатель страны по версии премии «HR-бренд Центральная Азия».  Мы ищем не просто разработчика дэшбордов, а человека, который будет отвечать за качество управленческой аналитики коммерческого блока.  НУЖНО УМЕТЬ И ЛЮБИТЬ:  Разрабатывать управленческие и аналитические дэшборды в Tableau для топ-менеджмента и коммерческого блока; Проектировать не просто графики, а сценарии принятия решений через данные; Выстраивать единый слой метрик и логики (что считаем, как считаем, почему так); Делать дэшборды, которыми реально пользуются, а не просто «смотрят»; Отвечать за качество данных на уровне визуализации (контроль, sanity-check, логика); Работать с Data Office: - формировать требования к витринам; - участвовать в проверке бизнес-логики; - влиять на структуру данных. Развивать единые стандарты визуализации: - UI/UX паттерны; - шаблоны; - best practices. Переводить бизнес-вопросы в аналитические решения без детального ТЗ.  НАС ИНТЕРЕСУЕТ:  3+ года в BI / аналитике / визуализации данных; Сильный опыт в Tableau (или Power BI) — не просто построение, а проектирование решений; Понимание, что дэшборд — это инструмент принятия решений, а не набор графиков; Навыки UX/UI в аналитике (композиция, иерархия, внимание пользователя); Умение структурировать метрики и бизнес-логику; Опыт работы с витринами данных и их валидацией; SQL на уровне, достаточном для проверки данных; Самостоятельность и умение работать в неопределенности.  Будет плюсом:  Опыт построения единого BI-слоя / витрин / governance; Опыт работы с топ-менеджментом; Перфекционизм к качеству данных и визуализации; Раздражение от «плохих дэшбордов».  ЗАРПЛАТА - ЭТО ЕЩЕ НЕ ВСЁ:  Гибкое начало рабочего дня; Профессиональное развитие: участие в митапах, тренингах, конференциях, демо-днях и хакатонах; Дополнительные 4 дня отпуска — итого 28 календарных дней за год; Годовой бонус по результатам достижения KPI; Корпоративная сотовая связь; Добровольная медицинская страховка со стоматологией и лекарствами с возможностью бесплатно добавить двух близких родственников; Фитнес-абонементы со скидкой и в рассрочку; Онлайн-платформа бесплатной психологической помощи; Доступ к корпоративной онлайн-библиотеке MyBook.  Теlе2 — это территория возможностей. Здесь тебя примут таким, какой ты есть, поддержат, направят и откроют множество возможностей.  Требования Опыт	От 1 года до 3 лет Условия работы График работы	Полный день Добавлено 6 дней назад Пожаловаться Отклик на HeadHunter Для связи с работодателем или просмотра контактов нажмите на кнопку",https://qyzmet.kz/redir?id=20618968,qyzmet_deep_parser
IT O+O Specialist,,,,,,"IT O+O Specialist Лореаль Казахстан Занятость	Полная занятость Адрес	Казахстан, Алматы, улица Кунаева, 77 Описание вакансии  Join Our Team  Join our dynamic IT team as IT O+O specialist and be a driving force in shaping the future of digital and omnichannel solutions at L'Oréal. In this pivotal role, you'll act as a strategic liaison between our global and zone IT teams and local business units, ensuring the seamless implementation and adoption of key IT solutions. If you possess a passion for technology, thrive in a fast-paced environment, and excel at leveraging your technical expertise and interpersonal skills to deliver impactful projects, we encourage you to apply!  Key Responsibilities:  Business Relationship Management: Forge strong partnerships: Establish and nurture strong relationships with local business teams across diverse functions (e.g. Digital Marketing, Ecommerce, Operations…). Champion business needs: Proactively engage with business stakeholders to understand their needs and translate those needs into clearly defined IT solutions. Be a trusted advisor: Serve as a strategic partner to business leadership, providing expert guidance on available IT solutions and their potential impact on achieving business objectives. Bridge the gap: Facilitate seamless communication and collaboration between local business stakeholders and global/zone IT teams, ensuring alignment on priorities, solutions and project roadmaps. Project Contribution/Coordination Collaborate on IT Projects: Actively participate in the end-to-end lifecycle of assigned digital/omnichannel IT projects, from initiation and planning to execution, monitoring and closure. Contribute to project success: Assist in developing and maintaining project plans, tracking timelines, identifying dependencies and mitigating risks. Ensure smooth implementation: Collaborate closely with global/zone IT teams to adapt and implement global solutions within the local context, addressing potential gaps and ensuring local requirements are met. Solution Adoption and Maintenance: Drive user adoption: Champion the successful adoption of new IT solutions through training, support, and communication. Become a product expert: Develop product expertise to effectively guide and support business users, ensuring seamless operation and positive user experiences, including troubleshooting and coordinating incident resolution. Continuous Improvement: Seek opportunities for growth: Proactively identify opportunities to optimize IT processes and enhance solutions, contributing to omnichannel IT best practices. Lead the way: Stay abreast of emerging technologies and industry trends in the Beauty Tech landscape.  Your Profile:  Experience: Minimum 3 years of experience as IT Project Manager, IT Business Analyst or IT Business Relationship Manager, ideally within the FMCG or a related industry. Education: Bachelor's degree in Computer Science, Information Systems, Business Administration or a related field. Skills: Business acumen: a strong understanding of business requirements, IT solutions and the interplay between them, combined with a solid grasp of digital marketing and eCommerce principles. Excellent communication and stakeholder management: adept at building strong relationships with stakeholders at all levels, including leadership, and communicating effectively across cross-functional teams. Proven Project Delivery: a track record of successfully managed complex IT projects in areas such as eCommerce, B2B Commerce, Retail, CRM or Data Privacy. Project Management Foundations: familiarity with IT project management methodologies (e.g. Waterfall, Agile). Strategic thinking and decision-making: able to align technology with strategic business objectives, providing insights and recommendations to drive initiatives forward. Strong analytical and problem-solving skills: adept at identifying, analyzing, and resolving challenges with a proactive, solution-oriented mindset, anticipating and mitigating risks effectively. Fluency in English is required Proficient in MS Office applications (MS PowerPoint, MS Excel). Technical Knowledge: Familiarity with digital landscape in IT e.g. web development, mobile applications, data management, cloud computing, data privacy, and IT security. Understanding of Enterprise Architecture principles e.g. integration layers, continues development/integrations, API. Experience with the following applications is a plus: SAP ERP, Sitecore, Salesforce Commerce Cloud, Salesforce Marketing Cloud, Microsoft Azure, OneTrust, Google Tag Manager, Google Analytics, ServiceNow, Confluence, ControlM. Требования Опыт	От 3 до 6 лет Условия работы График работы	Полный день Добавлено 6 дней назад Пожаловаться Отклик на HeadHunter Для связи с работодателем или просмотра контактов нажмите на кнопку",https://qyzmet.kz/redir?id=20619951,qyzmet_deep_parser
