title,salary,city,job,publish_date,requirements,responsibilities,url,source
"Методолог/аналитик по блоку ""Управление НСИ (MDM)"" (HR-домен)",,,,,,"Методолог/аналитик по блоку ""Управление НСИ (MDM)"" (HR-домен) Small, ТМ (Скиф Трейд, ТОО) Занятость	Полная занятость Адрес	Казахстан, Алматы, проспект Абая, 218/1 Описание вакансии SMALL — крупный ритейлер повседневных товаров и готовой еды в Казахстане.  В нашей сети сегодня:  более 160 магазинов  тысячи сотрудников  миллионы клиентов  собственное производство готовой еды  В ближайшем будущем:  служба доставки  франшиза  кратный рост числа магазинов  Сегодня мы — одна из самых динамичных ритейл-компаний Казахстана, создающая экосистему будущего.  Цель ИТ-департамента  Цель ИТ-департамента — обеспечить кратный рост бизнеса в ближайшие 3 года за счёт глубокой автоматизации и трансформации HR-процессов. Для этого мы строим совершенно новый, интегрированный ИТ-ландшафт.  Задачи  Разработка и внедрение стратегии, принципов и процессов управления мастер-данными (Master Data Management) для HR-домена компании.  Проектирование системы эталонных справочников (НСИ): организационная структура (оргдизайн), должности, компетенции, локации и другие ключевые сущности.  Определение прав и процессов управления жизненным циклом НСИ: создание, изменение, согласование, утверждение, публикация, архивация.  Выявление и формализация всех точек потребления HR-справочников в интегрированном ландшафте (1С:ЗУП, BI, WFM, e-com, портал) и проектирование архитектуры обменов данными для обеспечения консистентности.  Разработка требований к инструментарию MDM (включая возможное расширение функционала Pimcore) и организация процессов выравнивания (data cleansing) и гармонизации данных из legacy-систем.  Взаимодействие с ИБ по домену аутентификации и авторизации: группы доступа, бизнес-роли, SoD (segregation of duties).  Участие в проектах автоматизации HR-ландшафта.  Работа в рамках стратегии построения интегрированной экосистемы HR-систем с ядром на 1С:ЗУП КОРП.  Взаимодействие с бизнес-заказчиками (HR-департамент) и техническими командами (интеграции, фронтенд, DWH, e-com) для сбора требований, проектирования и внедрения ИТ-решений.  Активная работа по выводу из эксплуатации legacy-систем и миграции данных.  Участие во внедрении современных HR-практик (Performance Review, грейды, WFM, LMS, таланты) через ИТ-инструменты.  Применение возможностей искусственного интеллекта (ИИ) для автоматизации бизнес-процессов в HR-домене.  Работа в условиях динамично развивающегося бизнеса с фокусом на достижение измеримых бизнес-результатов и поддержку кратного роста компании.  Требования  Опыт работы методологом, архитектором данных или ведущим аналитиком в проектах по управлению мастер-данными (MDM, НСИ).  Глубокое понимание концепций MDM, DQ (Data Quality) и практик построения централизованных/децентрализованных систем справочников.  Опыт работы в смежных областях управления данными (PIM — управление товарной информацией, DAM) будет считаться крайне ценным преимуществом.  Умение проектировать и описывать сложные бизнес-процессы и модели данных с учетом требований разных систем-потребителей.  Отличные знания в области HR-мастер-данных: оргструктура, должности, классификаторы.  Понимание принципов интеграции данных (ESB, API, ETL, GraphQL) и описание требований к интеграционным контурам.  Системное мышление, способность видеть картину в целом и выстраивать процессы с нуля в условиях, где они ранее отсутствовали.  Навыки работы с инструментами моделирования данных (ER-диаграммы), умение четко формулировать требования как для бизнес-пользователей, так и для разработчиков.  Знание языка запросов (SQL) и умение читать программный код будет значительным преимуществом.  Готовность работать в среде с высокой степенью неопределенности и быстрым изменением приоритетов.  Понимание или готовность быстро погрузиться в бизнес-процессы управления персоналом (HR-домен).  Обязательное базовое понимание архитектуры и возможностей платформы 1С. Глубокий опыт работы с функционалом 1С:ЗУП КОРП (корпоративная версия) будет являться решающим преимуществом.  Желателен опыт или искренний интерес к работе с ИИ-инструментами (LLM, RAG, предсказательное моделирование) для их практического применения в бизнес-задачах.  Способность к быстрому самостоятельному изучению новых технологий, доменов и фреймворков.  Готовность работать в смешанных технологических стеках (1С, PHP, микросервисы, backend for frontend, HTTP-сервисы, шины данных).  Понимание принципов обмена данными в сервисной архитектуре.  Навыки работы в команде, коммуникабельность, ответственность за результат.  Понимание основ проектного подхода и управления рисками (приветствуется).  Опыт работы на крупных проектах, умение точно оценивать трудозатраты и нести ответственность за сроки будет являться ключевым преимуществом.  Требования Опыт	От 3 до 6 лет Условия работы График работы	Удаленная работа Добавлено 7 дней назад Пожаловаться Отклик на HeadHunter Для связи с работодателем или просмотра контактов нажмите на кнопку",https://qyzmet.kz/redir?id=20612739,qyzmet_deep_parser
Backend-разработчик,,,,,,"Backend-разработчик Car Id Занятость	Полная занятость Адрес	Казахстан, Алматы, улица Зеина Шашкина, 24 Описание вакансии Основные задачи  Разработка, развитие и поддержка микросервисов на Golang  Проектирование и реализация backend-сервисов для высоконагруженных систем  Оптимизация производительности приложений и запросов к базам данных  Участие в проектировании архитектуры сервисов и интеграционных решений  Анализ технических задач и декомпозиция функциональности совместно с командой  Написание чистого, поддерживаемого и масштабируемого кода  Проведение код-ревью и участие в технических обсуждениях  Участие в тестировании и повышении надежности системы  Требования:  Коммерческий опыт разработки на Golang от 1 года  Общий опыт разработки от 3 лет  Хорошее знание алгоритмов и структур данных  Уверенная работа с реляционными базами данных (PostgreSQL / MySQL)  Опыт оптимизации SQL-запросов и проектирования схем БД  Понимание паттернов проектирования и практический опыт их применения  Опыт работы с микросервисной архитектурой  Опыт разработки веб-сервисов или систем обработки данных  Умение декомпозировать сложные задачи и работать в команде  Будет преимуществом  Опыт работы с Big Data  Опыт разработки аналитических платформ или систем обработки данных  Понимание принципов распределённых систем  Опыт работы с Docker / Kubernetes  Опыт работы с очередями сообщений (Kafka, RabbitMQ)  Понимание принципов CI/CD  Мы предлагаем  Работа в команде сильных инженеров  Участие в разработке масштабируемых технологических решений  Возможность влиять на архитектуру продукта  Профессиональный рост и развитие  Конкурентную заработную плату  Требования Опыт	От 3 до 6 лет Условия работы График работы	Полный день Добавлено 14 дней назад Пожаловаться Отклик на HeadHunter Для связи с работодателем или просмотра контактов нажмите на кнопку",https://qyzmet.kz/redir?id=20565869,qyzmet_deep_parser
Backend-разработчик (Java),,,,,,"Backend-разработчик (Java) Yurt Tech Занятость	Полная занятость Адрес	Казахстан, Астана, улица Абикена Бектурова, 7 Описание вакансии  Yurt Tech — технологическая компания, разрабатывающая современные продукты и высоконагруженные системы. Мы строим масштабируемые сервисы и работаем с актуальным стеком технологий.  Задачи  Разработка и поддержка backend-сервисов Участие в проектировании архитектуры и микросервисов Оптимизация производительности и стабильности системы Работа с высоконагруженными сервисами Участие в code review и технических обсуждениях Взаимодействие с командой разработки  Требования  Опыт разработки на Java от 2 лет Уверенное знание Spring Boot и экосистемы Spring Опыт работы с микросервисной архитектурой Опыт работы с SQL и/или NoSQL базами данных Опыт работы с Kafka или RabbitMQ Опыт работы с Docker, Kubernetes Понимание CI/CD процессов Понимание принципов оптимизации и производительности  Будет плюсом  Опыт проектирования архитектуры систем Опыт работы с высоконагруженными системами Опыт менторства или code review Английский язык от уровня B2  Условия  Офис в Астане (район EXPO)- работа в офисе, удаленной работе нет Конкурентная заработная плата Работа над интересными и сложными задачами Профессиональный рост и развитие Требования Опыт	От 1 года до 3 лет Условия работы График работы	Полный день Добавлено 20 дней назад Пожаловаться Отклик на HeadHunter Для связи с работодателем или просмотра контактов нажмите на кнопку",https://qyzmet.kz/redir?id=20532663,qyzmet_deep_parser
.NET Backend-разработчик,,,,,,.NET Backend-разработчик ТОО NurSADI Зарплата	Договорная Адрес	Алматы Описание вакансии Требования и обязанности:  Строительный портал нужен разработчик с# с Алматы с оптом  Требования Опыт	От 1 до 3 лет Условия работы График работы	Неполный день Добавлено 20 дней назад Пожаловаться Отклик на jumys.kaspi.kz Для связи с работодателем или просмотра контактов нажмите на кнопку,https://qyzmet.kz/jobdesc?id=20616957&src=js,qyzmet_deep_parser
Senior Backend Разработчик (Go + PHP),,,,,,"Senior Backend Разработчик (Go + PHP) Частная компания “Automated Communication Solutions Ltd.” Зарплата	от 900000 до 1100000 KZT Занятость	Полная занятость Адрес	Казахстан, Алматы, проспект Достык, 132 Описание вакансии Senior Backend Разработчик (Go + PHP)  до 1 100 000 ₸ в месяц • Полная занятость • Алматы (гибрид / офис)  О компании  Automated Communication Solutions LTD. — быстрорастущая IT-компания из Казахстана. Мы увеличиваем эффективность коммуникаций с клиентами с помощью AI-технологий и автоматизации.  Сейчас мы активно расширяем команду и ищем сильного Senior Backend Разработчика, который готов писать качественный код, разбираться в архитектуре и влиять на продукт.  Если ты любишь решать сложные задачи, работаешь без постоянного контроля и берёшь ответственность за результат — нам по пути 🚀  🧩 Что предстоит делать  Разрабатывать backend — писать код на Go и PHP, решать ключевые задачи продукта  Участвовать в архитектуре — влиять на качество кода, выбор решений, участвовать в ревью  Поддерживать релизы — взаимодействовать с DevOps, помогать с выкаткой  Развивать микросервисы — участвовать в миграции с монолита, работать с event-driven архитектурой  Работать с существующей системой — поддерживать и улучшать текущий функционал  ✅ Что мы ждём от кандидата  Технические навыки  Коммерческий опыт backend-разработки от 4–5 лет — критически важно!  Опыт коммерческой разработки на Go от 4 лет  Опыт работы с PHP (поддержка legacy)  Понимание микросервисной архитектуры  Работа с PostgreSQL, Redis, умение писать сложные SQL-запросы  Опыт с брокерами сообщений: RabbitMQ и/или Kafka  Понимание принципов: SOLID, KISS, YAGNI  Личные качества  🧭 Самостоятельность — работа без постоянного контроля  📦 Ответственность за результат — доводить задачи до конца  💬 Умение коммуницировать в команде  🧘 Стрессоустойчивость  📈 Продуктовое мышление — понимание целей бизнеса  🎁 Мы предлагаем  🔥 Работу в быстрорастущей IT-компании с современными технологиями  💰 Стабильный доход до 1 100 000 ₸ + официальное трудоустройство  🤝 Дружелюбную атмосферу, поддержку и наставничество  📈 Реальные перспективы роста до Тимлида  🏢 Формат работы: офис (Алматы) или гибрид  ⏱️ Гибкое начало дня: с 9:00 до 10:00  📍 Адрес офиса: Алматы, проспект Достык, 132  🔧 Ключевые навыки для поиска  Go • PHP • PostgreSQL • Redis • Kafka • RabbitMQ • SOLID • Микросервисы • Backend-разработка  📩 Как откликнуться  Напишите сопроводительное письмо с краткими ответами на вопросы:  Сколько лет вашего коммерческого опыта в backend-разработке? Сколько лет пишете на Go и какой опыт с PHP?  Работали ли вы с микросервисами и брокерами сообщений (Kafka/RabbitMQ)?  Какой у вас опыт работы с PostgreSQL и Redis?  Ждём ваших откликов! 🔥  Требования Опыт	От 3 до 6 лет Условия работы График работы	Полный день Добавлено 14 дней назад Пожаловаться Отклик на HeadHunter Для связи с работодателем или просмотра контактов нажмите на кнопку",https://qyzmet.kz/redir?id=20566101,qyzmet_deep_parser
Backend-разработчик (midle/junior/стажёр),,,,,,"Backend-разработчик (midle/junior/стажёр) Таржакаев Занятость	Полная занятость Адрес	Казахстан, Астана Описание вакансии Ищем фулстак-разработчика (junior/стажёр) на проект TeamRise — это внутренняя платформа для управления клиентами, задачами и автоматизацией процессов. Проект развивается быстро, много практики, задач и возможностей получить актуальный опыт в реальном продукте.  Кому подходит роль новичкам, которые хотят наработать портфолио стажёрам, которым важен реальный продукт и техстек тем, кто хочет развиваться под руководством опытного тимлида тем, кто готов расти через практические задачи, а не учебные проекты  Требования базовые знания HTML/CSS/JS опыт работы с любым фреймворком (React/Vue/Svelte — любой подойдёт) понимание базового backend (Node.js или Python — тоже не принципиально) Git, навыки работы с репозиторием умение разбираться в коде и искать решения самостоятельно ответственность и выполнение задач в срок  Обязанности дорабатывать функционал проекта TeamRise подключать API, работать с базой данных улучшать интерфейсы, скорость загрузки и UX участвовать в обсуждении архитектуры и решении задач исправлять баги, оптимизировать код, тестировать фичи  Условия реальный опыт разработки продукта, а не учебные задачки гибкий график (можно совмещать с универом) понятные ТЗ и быстрая обратная связь возможность проявить себя и вырасти до полноценного junior+ участие в коммерческом проекте с действующими клиентами частичная занятость низкая ставка на старте (обсуждается индивидуально) работа удалённая фиксированные задачи каждую неделю  если дочитал доконца и действительно интересно то напиши в сопроводительном письме : готов к тестовому заданию Требования Опыт	От 1 года до 3 лет Условия работы График работы	Удаленная работа Добавлено 20 дней назад Пожаловаться Отклик на HeadHunter Для связи с работодателем или просмотра контактов нажмите на кнопку",https://qyzmet.kz/redir?id=20533751,qyzmet_deep_parser
