title,salary,city,job,publish_date,requirements,responsibilities,url,source
Fullstack Developer & Product Partner,,,,,,"Fullstack Developer & Product Partner Madman (Мэдмэн) Занятость	Полная занятость Адрес	Казахстан, Алматы РЕКЛАМА Описание вакансии  Мы строим B2B SaaS-продукты, которые решают реальные проблемы малого и среднего бизнеса. Нам нужен человек, который думает о продукте, а не только пишет код.  ЧТО ТЫ БУДЕШЬ ДЕЛАТЬ  — Строить продукты с нуля — от схемы до пользовательского интерфейса.  — Участвовать в продуктовых решениях: что строим, зачем, как быстро можно проверить.  — Внедрять AI-инструменты — в разработку и в продукт. Вайб-кодинг, LLM-интеграции, автоматизация рутины.  — Держать архитектуру чистой: мы быстро итерируем, но не хотим копить технический долг. Твоя задача — находить баланс.  — Предлагать, не ждать: видишь узкое место, неочевидное решение или способ сделать лучше — говори. Инициатива приветствуется и слышна.  УСЛОВИЯ  — Доля в продукте: Опцион или доля для тех, кто строит с нами долгосрочно.  — Автономия: Нет микроменеджмента. Есть цели, дедлайны и доверие.  — Скорость решений: От идеи до «делаем» — дни, не недели.  — AI-инструменты: Подписки на Cursor, Claude Pro, и всё что нужно — за счёт компании.  — Рост вместе: По мере роста продуктов — растёт роль и компенсация. Без «подожди ещё год».  — Реальный продукт: Ты видишь, как твой код влияет на бизнес клиентов — не пишешь в пустоту.  ЭТА ПОЗИЦИЯ НЕ ДЛЯ ТЕХ, КТО ХОЧЕТ  — Быть исполнителем: Ты будешь ключевой фигурой, которая формирует ТЗ и заботится, чтобы продукт был наиболее эффективен.  — Плыть по течению: Твоя задача структурировать, систематизировать, видеть риски и понимать способы их решений.  — Глубокий перфекционизм: Нужно держать баланс между структурностью и поверхностными решениями.  ЭТА ПОЗИЦИЯ ДЛЯ ТЕХ, КТО ХОЧЕТ СОЗДАВАТЬ РЕАЛЬНЫЙ ПРОЕКТ И БЫТЬ В КОМАНДЕ ТАКИХ ЖЕ ОТВЕТСТВЕННЫХ ПРОФЕССИОНАЛОВ.  Требования Опыт	От 3 до 6 лет Условия работы График работы	Удаленная работа Добавлено 16 дней назад Пожаловаться Отклик на HeadHunter Для связи с работодателем или просмотра контактов нажмите на кнопку",https://qyzmet.kz/redir?id=20555841,qyzmet_deep_parser
Fullstack-разработчик (Автоматизация бизнес-процессов),,,,,,"Fullstack-разработчик (Автоматизация бизнес-процессов) Kolesa (АО Колеса) Зарплата	от 600000 до 1100000 KZT Занятость	Полная занятость Адрес	Казахстан, Алматы, улица Шевченко, 157/4 РЕКЛАМА Описание вакансии  Kolesa Group — международная IT-компания, строим классифайды для 12,5 миллионов пользователей. Наши продукты — kolesa.kz | krisha.kz | avtoelon.uz — помогают людям и бизнесам продавать, покупать и владеть авто, недвижимостью, товарами и услугами.  Культура экспериментов, командный дух, технологии, постоянное развитие и желание достичь крутых результатов — отличительные черты Kolesa Team.  О вакансии:  Работа предстоит с Atlassian Jira Server, ScriptRunner, REST-интеграциями и множеством бизнес-идей, которые нужно превращать в работающие бизнес-процессы.  Ты будешь разрабатывать и улучшать внутренние системы и бизнес-процессы, которые помогают командам эффективнее работать, автоматизировать рутинные задачи и поддерживать стабильность операционных процессов.  Тебе предстоит:  Проектирование и разработка бизнес-процессов (Atlassian Jira Server с использованием Groovy/Java (ScriptRunner);  Поддержка и рефакторинг существующей логики, выявление узких мест и предложение улучшений;  Автоматизация с использованием скриптов, процедур и интеграций с внешними сервисами через REST API;  Анализ логов и отладка проблем в работе бизнес-процессов и автоматизации;  Поддержка документации: создание и актуализация технических описаний и пользовательских инструкций;  Взаимодействие с другими командами и заказчиками для прояснения требований и совместной работы над улучшениями.  Мы ждем от тебя:  Опыт разработки на одном из языков: Java / Python / Go / PHP / C# / Groovy; Уверенные знания SQL, понимание структуры реляционных БД; Понимание клиент-серверной архитектуры и принципов работы REST API; Опыт работы с Git: работа с ветками и базовыми операциями; Умение читать логи и разбираться в причинах ошибок; Базовые знания HTML; Умение работать с требованиями: задавать вопросы, уточнять детали и формировать понимание задачи; Понимание бизнес-целей и ориентация на результат; Готовность работать в Алматы (из офиса или гибрид с возможностью работать 2-3 дня в неделю удаленно).  Будет преимуществом:  Базовые знания JavaScript; Опыт автоматизации процессов или работы с интеграциями; Опыт работы с Jira / ScriptRunner / Groovy; Понимание BPMN или опыт описания бизнес-процессов;  Знания Linux;  Понимать, что ""под капотом"" у продуктов Atlassian.  Что приятного предлагаем:  Работу в сильной команде, где ценятся взаимопомощь и ориентация на результат;  Постоянный рост: система грейдирования, индивидуальные планы развития, менторство;  Тематические мероприятия: квизы, киновечера, Family Day, тимбилдинги;  Медицинскую страховку, оплату авиабилетов, фитнеса, образования и многое другое — твой выбор, куда использовать соцпакет;  Обучение: мы оплачиваем участие в конференциях, тренингах, мастер-классах;  Корпоративные скидки от наших партнеров;  Программа релокации для иногородних сотрудников.  #referral  Требования Опыт	От 3 до 6 лет Условия работы График работы	Полный день Добавлено 20 дней назад Пожаловаться Отклик на HeadHunter Для связи с работодателем или просмотра контактов нажмите на кнопку",https://qyzmet.kz/redir?id=20533220,qyzmet_deep_parser
FullStack - разработчик 1C-Bitrix CMS | WP | JS | PHP,,,,,,"FullStack - разработчик 1C-Bitrix CMS | WP | JS | PHP ОсОО Тру Айти Занятость	Полная занятость Адрес	Казахстан, Алматы РЕКЛАМА Описание вакансии  Нужен fullstack JS+PHP (1C-Bitrix CMS | BITRIX 24 | WP | Joomla и другие cms) - Middle / Middle+ / Senior / ... самостоятельный разработчик(подрядчик):  Удаленная через интернет постановка задач и передача результатов, трекинг времени  Можем обеспечить высокой загрузкой в интересных разнообразных проектах на долгое время  внимательный старательный надежный  Который знает ценность времени, хочет новых, разнообразных, интересных задач - проектов и хочет расти как профессионал и финансово, а главное стабильности!  Мы:  оценим по достоинству услышим поговорим на одном языке дадим много разнообразных и четкие задачи поможем и направим в развитии  Рыночная+ и всегда вовремя оплата выполненных задач (проектов) - указанная сумма не предел (основное, что будет влиять на финальную Оплату это ваш уровень кодинга, навыки, качество, количество закрытых задач и проектов) все зависит от Вас. Возможен пересмотр Оплаты два раза в год.  У нас понятные и прозрачные KPI - больше производите результата (продукта) - больше получаете - без верхнего потолка.  Результаты, которые от Вас ожидаются:  Качественное выполнение полученных и взятых в работу задач и проектов Доведение проектов до конца Отсутствие необходимости исправлять и перепроверять за Вами Качественная декомпозиция Точные оценка (Estimate) и укладывание в сроки и дедлайны Желание и умение совершенствовать свою работу Желание разрабатывать уникальные продукты  Будет плюсом (не обязательно):  Знание дополнительных языков программирования  Что мы даем:  Проекты в том числе из США, Канады, Европы, СНГ Большое число разнообразных, интересных проектов Стабильность и защищенность (всегда своевременная, прозрачная и справедливая оплата строго по договору) Забота о здоровье и комфорте полная самостоятельность и удаленка Сами формируете свой график Возможность высокого заработка ( понятные KPI - больше делаем больше получаем); Реальная перспективами роста оплаты; Возможность внедрять и использовать новые техники в проектах Человеческое отношение Постоянно улучшаемые процессы взаимодействия с подрядчиками и партнерами работа в удобной CRM с постановкой задач Поддержку идеи и теорий, а также совместное, оперативное внедрение и проверку их.  Требования:  Способность самостоятельно организовывать свой процесс и выдавать результат Точное соответствие полученным задачам Способность доводить дела до конца Умение не только писать код, но и качественно протестировать свой продукт, объяснить логику Чистый понятный структурный код Качественная адаптивная крозбраузерная верстка по всем современным требованиям и канонам Опыт работы с системами контроля версий (Subversion, Git) Знание и использование PHP 7-8 Знание JS (vue) Опыт работы с MySQL, умение составлять и оптимизировать SQL-запросы Умение разбираться в чужом коде Знание HTML/CSS/JavaScript/NodeJS/AJAX/jQuery/Vue Знания ООП Знание API Основы сетевой безопасности и знание инструментов её обеспечения Знание одного или нескольких из популярных веб-фрейморков (Laravel, Vue и других ....) Понимание современных cms (знание 1-c Bitrix и других cms) Внимательность, аккуратность Самостоятельность Логическое мышление Способность быстро менять ход работы, если в процессе наблюдения обнаруживается, что это неэффективно Желание постоянно развиваться и совершенствоваться, использовать самые передовые технологии. Непрерывное совершенствование процесса разработки, стандартов и самих себя Внимательность к деталям  Нам нужны подрядчики которые хотят делать и давать результат, а не сидеть на одном месте!  В теме заявки или во время звонка сразу укажите кодовое слово ""Attentiveness"", чтобы мы понимали что вы прочли все и вам нужно уделить особое внимание!  А также в сопроводительном письме необходимо четко указать:  - стэк технологий и навыков и оценка от 1 до 10 по каждому пункту;  - желаемый уровень ставки часа, опыт работы, и уровень кодинга Junior | Midle | Senior | ...  *напишите в сопроводительном письме, на что нам следует обратить внимание и выбрать Вас.  У нас большие планы и без дополнительных разработчиков нам не обойтись.  Если Вы уверены в своих силах и готовы присоединиться к нашей команде, ждем на собеседование.  Требования Опыт	От 1 года до 3 лет Условия работы График работы	Удаленная работа Добавлено 20 дней назад Пожаловаться Отклик на HeadHunter Для связи с работодателем или просмотра контактов нажмите на кнопку",https://qyzmet.kz/redir?id=20530066,qyzmet_deep_parser
Разработчик программного обеспечения,,,,,,"Разработчик программного обеспечения АО ""ЕНПФ"" (Единый накопительный пенсионный фонд) Зарплата	от 450 000 тг. Занятость	постоянная Адрес	г. Алматы, Медеуский район, Алматы РЕКЛАМА Требования Образование	высшее Опыт	2 года стажа Профессиональные навыки: Автоматизация процессов и поддержка существующих систем аналитики;  Личные качества: Ответственность; Условия работы График работы	полный рабочий день Условия труда: нормальные Стажировка: Не предполагается Дополнительные условия: Дополнительное медицинское страхование Обязанности  1) анализ причин отказов и нарушений в работе ИС, разработка предложений по их устранению и предупреждению, повышению качества и надежности ИС;  2) совместно с подразделениями аналитиков проводит анализ требований по заявкам подразделений на модернизацию ИС;  3) анализирует и оценивает последствия изменения одного бизнес-процесса на другой(-ие) и выносит соответствующие предложения на рассмотрение заместителя руководителя или руководителя Департамента;  4) модернизирует программные модули действующих систем и участвует в разработке новых ИС Фонда;  5) осуществляет проектирование структур баз данных и архитектуры приложений, действующих ИС, ведение концептуальной и физической моделей данных;  6) тестирует совместно с подразделениями, ответственными за доработанные бизнес-процессы;  7) проводит сбор и обработку данных для ИС и сервисов Фонда;  8) формирует сводные данные из ИС Фонда по запросам НБРК и других ведомств и организации в рамках своей компетенции;  1. Работник должен обладать:  1) навыками контроля разработки кода программного продукта на основе готовых спецификаций;  2) навыками анализа результатов выполнения проекта и эффективности инструментальных средств;  3) навыками работы с распределёнными системами управления контроля версиями.  2. Работник должен уверенно владеть:- одним из языков программирования PHP/Java/C#/Python, - одним из языков программирования JavaScript/TypeScript, - одним из фреймворков Vue.js/Angular, - языками запросов PL/SQL, SQL, - языками разметки HTML 4, CSS; - языком описания веб-сервиса WSDL; - протоколом доступа к объектам SOAP и форматами обмена данными XML/JSON  Добавлено 16 дней назад Пожаловаться Отклик на Enbek Для связи с работодателем или просмотра контактов нажмите на кнопку",https://qyzmet.kz/jobdesc?id=20563594&src=js,qyzmet_deep_parser
Senior Developer (Flutter / Laravel / React),,,,,,"Senior Developer (Flutter / Laravel / React) Айм Ивент Зарплата	от 900000 до 1000000 KZT Занятость	Полная занятость Адрес	Казахстан, Алматы, микрорайон Горный Гигант, улица Изима Искендерова, 22/1 РЕКЛАМА Описание вакансии  ВАКАНСИЯ: Fullstack Developer (Flutter / Laravel / React)  Бренд: Группа компаний I AM EVENT  Мы лидеры ивент-индустрии и аренды оборудования в Казахстане. Наш бизнес-это сложная логистика, управление сотнями ресурсов и создание технологичных событий. Мы ищем Fullstack-разработчика уровня Мiddle, который усилит нашу IT-инфраструктуру и поможет перевести бизнес-процессы в элегантные цифровые решения.  Кого мы ищем: Ты уже перерос задачи Junior, стремишься к Middle и хочешь видеть реальный вклад своего кода в бизнес. Ты не просто ""пишешь функции"", а понимаешь, как автоматизация склада или CRM-системы влияет на прибыль и сервис.  Наш стек технологий: 📱 Mobile: Flutter 🖥️ Backend: Laravel 🌐 Frontend: React JS 🤖 AI-driven: Мы активно используем и поощряем работу с Claude и другими AI-инструментами для ускорения разработки.  Что нужно делать? 🔹 Разрабатывать продукты для ивент-индустрии (web & mobile). 🔹 Интегрировать системы логистики, аренды и клиентского сервиса. 🔹 Быстро находить оптимальные технические решения. 🔹 Быть проактивным: мы ценим идеи, которые делают продукт лучше! 💡  Что мы ждем от тебя: ✅ Опыт коммерческой разработки от 1.5-2 лет. ✅ Умение работать в динамичном темпе 🏎️ ✅ Интерес к сфере Event и понимание бизнес-процессов. ✅ Желание расти до Middle+ и выше.  Что предлагаем: 💰 ЗП: 900 000-1 000 000 тенге. 🚀 Свободу в выборе инструментов и поддержку AI-ассистентов. 📈 Реально сложные и интересные задачи, а не правку кнопок. 🤝 Команду, где ценят результат и драйв!  Требования Опыт	От 1 года до 3 лет Условия работы График работы	Полный день Добавлено 20 дней назад Пожаловаться Отклик на HeadHunter Для связи с работодателем или просмотра контактов нажмите на кнопку",https://qyzmet.kz/redir?id=20533230,qyzmet_deep_parser
