title,salary,city,job,publish_date,requirements,responsibilities,url,source
Finance Operations Analyst,,,,,,"Finance Operations Analyst Mellow Занятость	Полная занятость Адрес	Казахстан, Алматы РЕКЛАМА Описание вакансии  Мы — Mellow, технологическая компания, отмеченная в рейтинге Deloitte Fast 50 MENA. Наша команда из 150+ специалистов, работающих в 21 стране, сочетает энергию и гибкость стартапа с опытом и надежностью зрелой компании.  Наша цель — сделать проектную занятость общепринятой нормой, равноправной альтернативой классическим трудовым отношениям. Для этого мы помогаем компаниям нанимать исполнителей по всему миру, платить им без проблем и делать это строго по закону каждой страны. А проектным сотрудникам — освоиться со своей ролью.  Сейчас мы в поисках Finance Operations Analyst, который уже работал с финансовыми данными и хочет расти в сторону финансовых операций, биллинга и автоматизации процессов.  Обязанности  Проверка и верификация финансовых данных перед передачей в бухгалтерию; Проведение сверок с клиентами и партнёрами, контроль корректности расчётов; Работа с данными: анализ, поиск расхождений, подготовка отчётов; Взаимодействие с внутренними командами (финансы, продукт, разработка); Участие в закрытии финансовых периодов; Поддержка логики финансовых расчётов и шаблонов;  Требования  Опыт от 1 года в финансах, финтехе, биллинге или смежной data-роли; Excel / Google Sheets — уверенный уровень: сложные формулы, сводные таблицы, работа с большими массивами данных; Power Query — базовое понимание / опыт работы; SQL — базовый уровень: понимание структуры данных, умение читать и адаптировать запросы; Понимание базовых принципов бухгалтерского учёта и финансовых потоков; Внимательность к деталям, структурное мышление; Английский — уровень не ниже B2;  Будет плюсом  Опыт работы со сверками (reconciliation); Опыт взаимодействия с платёжными системами и/или банковскими сервисами; Опыт взаимодействия с продуктовой или инженерной командой;  Условия  Гибкий график и комфортное взаимодействие в команде;  Регулярный пересмотр зарплаты — следим, чтобы оставаться в рынке;  Бюджет на обучение и развитие, включая курсы английского и греческого;  Забота о ментальном здоровье — предоставляем доступ к сервису «Ясно»;  Финансовая помощь в непредвиденных ситуациях;  Подарки на День рождения и Новый год.  Требования Опыт	От 1 года до 3 лет Условия работы График работы	Удаленная работа Добавлено 11 дней назад Пожаловаться Отклик на HeadHunter Для связи с работодателем или просмотра контактов нажмите на кнопку",https://qyzmet.kz/redir?id=20588219,qyzmet_deep_parser
System/Business Analyst,,,,,,"System/Business Analyst Andersen Занятость	Полная занятость Адрес	Казахстан, Алматы РЕКЛАМА Описание вакансии  Andersen is hiring a System/Business Analyst for a project developing mobile banking transfers, ensuring secure, reliable transactions and seamless integration with payment systems.  The customer is an established company operating within the financial domain, offering a range of consumer-oriented services. It shows consistent performance, supported by a mature operational setup, a scalable infrastructure, and a geographically distributed team. The organization is integrated into a wider international structure with diversified activities, which supports its stability and continuous evolution in a dynamic market environment.  The project is focused on developing and enhancing money transfer functionality within a mobile banking application. It covers P2P and interbank transfers, integrations with internal systems and external payment services, and ensures secure, reliable transactions with a strong emphasis on user experience and microservices architecture.  Responsibilities:  Gathering, analyzing, and formalizing business and system requirements from stakeholders. Preparing and maintaining project documentation: technical specifications, User Stories, Use Cases, and specifications. Modeling business processes (AS-IS / TO-BE) using BPMN, UML, and other notations. Describing integration interactions between systems (REST/SOAP APIs, message queues — RabbitMQ, Kafka). Participating in the design of architectural solutions and integration scenarios. Collaborating with development, QA, and product management teams to specify requirements and ensure their proper implementation. Creating tasks for developers, supporting the development process, and participating in the acceptance of deliverables. Preparing test scenarios, participating in testing and validation of implemented functionality. Analyzing data and working with databases (SQL) to verify the correctness of requirement implementation. Participating in system support: analyzing and resolving incidents, interacting with technical teams. Consulting users and internal teams on system functionality. Participating in the improvement and optimization of business processes and existing solutions. Working in an Agile team (Scrum/Kanban): participating in planning, refinement, and daily meetings. Learning new technologies and applying best practices within projects. Supporting and substituting other analysts when necessary.  Must-haves:  Experience as a System and/or Business Analyst for 3+ years. Experience in the fintech domain. Strong business and system analysis skills. Experience in gathering, analyzing, and formalizing requirements. Ability to write technical documentation (SRS). Experience working with Use Cases and User Stories. Skills in business process modeling (BPMN). Knowledge of UML and ability to create diagrams. Understanding of and experience with REST and SOAP APIs. Experience working with message brokers (RabbitMQ, Kafka). SQL knowledge at the level of writing queries. Experience participating in testing and requirements validation. Experience in preparing and maintaining project documentation. Understanding of system architecture principles. Participation in designing architectural solutions. Experience working in Agile (Scrum/Kanban). Participation in incident analysis and resolution. Ability to mentor and consult other analysts. Willingness to back up fellow analysts when needed. Strong communication skills. Ability to quickly learn new technologies and apply them in practice. Level of English – from Intermediate and above.  Reasons why this job would be interesting to you:  Experience in teamwork with leaders in FinTech, Healthcare, Retail, Telecom, and others. Andersen cooperates with such businesses as Samsung, Siemens, Johnson & Johnson, BNP Paribas, Ryanair, Mercedes, TUI, Verivox, Allianz, T-Systems, etc. The opportunity to change the project and/or develop expertise in an interesting business domain. Job conditions – you can work both fully remotely and from the office or can choose a hybrid variant. Guarantee of professional, financial, and career growth! The company has introduced systems of mentoring and adaptation for each new employee. The opportunity to earn up to an additional 1,000 USD per month, depending on the level of expertise, which will be included in the annual bonus, by participating in the company's activities. Access to the corporate training portal, where the entire knowledge base of the company is collected and which is constantly updated. Bright corporate life (parties / pizza days / PlayStation / fruits / coffee / snacks / movies). Certification compensation (AWS, PMP, etc). Referral program. English courses. Private health insurance and compensation for sports activities. Требования Опыт	От 3 до 6 лет Условия работы График работы	Удаленная работа Добавлено 13 дней назад Пожаловаться Отклик на HeadHunter Для связи с работодателем или просмотра контактов нажмите на кнопку",https://qyzmet.kz/redir?id=20579373,qyzmet_deep_parser
SCM Planning Analyst,,,,,,"SCM Planning Analyst Kt&G Global Kazakhstan (Кей-Ти-Энд-Джи Глобал Казахстан) Занятость	Полная занятость Адрес	Казахстан, Алматы РЕКЛАМА Описание вакансии KT&G Global Kazakhstan is excited to welcome a professional to join our dynamic team in Almaty! If you’re passionate about making an impact and growing your career, this opportunity is for you. Demand Planning & Forecasting Develop rolling sales/IMS forecasts and translate them into supply and inventory plans. Manage safety stock, minimize stock risks, and analyze forecast accuracy and demand patterns. Align forecasts with Sales, Marketing, and Finance. S&OP Support Prepare and support monthly S&OP cycles and submissions to Regional/HQ. Ensure alignment between operational plans and financial targets. Data Analysis & Reporting Deliver key planning dashboards and inventory KPIs. Perform root-cause analysis and ensure master data accuracy across systems. Drive reporting and planning process improvements. Systems & Process Management Operate and improve planning processes using SAP/IBP, BI tools, and Excel. Support system enhancements, data quality, and process standardization. Order, Inventory & Warehouse Coordination Manage end-to-end order fulfillment and shipment coordination. Oversee inventory lifecycle, reconciliation, and warehouse compliance (5S). Coordinate shipment instructions and transportation to ensure timely delivery to warehouses and customers. Coordinate import processes for HNB products, such as handling of excise / duty-related requirements, product certifications etc. Coordinate with customs brokers and logistics partners to ensure smooth customs clearance. Monitor and control customs clearance timelines, proactively resolving issues related to documentation discrepancies or regulatory constraints. Ensure full compliance and readiness of import documentation. Cross-Functional & Continuous Improvement Act as a key link between commercial and finance teams. Drive forecast accuracy, inventory optimization, and compliance with internal standards. What We’re Looking For Hard & Soft Skills: Strong Excel (power Query, Pivot, Power BI), Understanding of S&OP, Demand Planning, Inventory Management, Supply Chain KPIs. English Proficiency: Fluency in written and spoken English. Education: Higher education degree required. Working Conditions Full-time position. Standard working hours: 08:00–17:00. What We Offer Annual Merit Increase Performance-based Annual Bonus Health Insurance & Social Insurance Monthly Meal and Mobile Compensation Two Additional Paid Sick Leaves Days Требования Опыт	От 3 до 6 лет Условия работы График работы	Полный день Добавлено 8 дней назад Пожаловаться Отклик на HeadHunter Для связи с работодателем или просмотра контактов нажмите на кнопку",https://qyzmet.kz/redir?id=20605143,qyzmet_deep_parser
Internal Controls Analyst,,,,,,"Internal Controls Analyst ТОО ""Филип Моррис Казахстан"" Занятость	Полная занятость Адрес	Казахстан, Алматы, улица Бекена Жамакаева, 2/1 РЕКЛАМА Описание вакансии  Be a part of a revolutionary change  At PMI, we’ve chosen to do something incredible. We’re totally transforming our business and building our future on one clear purpose – to deliver a smoke-free future. With huge change, comes huge opportunity. So, wherever you join us, you’ll enjoy the freedom to dream up and deliver better, brighter solutions and the space to move your career forward in endlessly different directions.  Your day to day:   - Conduct reviews, tests, interviews, and analysis to identify process gaps vs. company policies and legal requirements; - Develop corrective actions, controls, and recommendations; - Prepare process documentation and visual workflows (diagrams, charts); - Identify opportunities for process improvement and business optimization; - Assess operational risks and propose mitigation measures; - Collaborate with relevant teams; prepare reports and presentations for management; - Design and implement analytical solutions to simplify and optimize processes; - Provide guidance to employees on controls, risk assessment, and process optimization.  Who we're looking for:   - Higher education in finance, economics, audit, or related fields; - Knowledge of internal control principles, risk management, and corporate governance; - Work experience in internal control, business processes optimization, audit, compliance, or related departments (3 years or more); - Skills in conducting audits, analyzing business processes, and identifying risks/violations; - Understanding and ability to interpret legislative requirements (tax, accounting, labor, corporate law); - Ability to design, develop, and implement control procedures, including drafting instructions, establishing policies, and documenting processes; - Strong analytical skills and problem-solving abilities in uncertain environments; - Experience with data visualization tools, such as Power BI or similar platforms, is an advantage; - Proficiency in Microsoft Office products at a confident user level; - Collaborative approach and willingness to learn and grow in a constantly changing environment; - Fluency in English, both in writing and speaking.  What we offer:  - An opportunity to pursue your ambitions and develop your skills with a global business – our staggering size and scale provides endless opportunities to progress;  - An opportunity to build an international career and for cross-functional moves;  - Extended social package: life insurance, insurance from critical illnesses, additional payment for preschool development of children, participation in the Employee Assistance Program (financial, psychological and legal consultations) for employees and family members, and much more;  Philip Morris Kazakhstan is the holder of Top Employer Kazakhstan & Global award for 10 consecutive years as well as the only Equal Pay certificate holder in Kazakhstan, which proves our commitment to highest working standards.  *Relocation support is not available for this job  Требования Опыт	От 3 до 6 лет Условия работы График работы	Полный день Добавлено 9 дней назад Пожаловаться Отклик на HeadHunter Для связи с работодателем или просмотра контактов нажмите на кнопку",https://qyzmet.kz/redir?id=20599369,qyzmet_deep_parser
BI Developer / BI Analyst,,,,,,"BI Developer / BI Analyst ЦИТ Орлеу Занятость	Полная занятость Адрес	Казахстан, город республиканского значения Астана РЕКЛАМА Описание вакансии  Описание  Ищем специалиста для разработки аналитических дашбордов и отчетности в рамках цифровой платформы. Основная задача — визуализация данных, разработка KPI и поддержка принятия управленческих решений.  Обязанности:  разработка дашбордов и отчетов в современных BI-инструментах (Superset / Metabase / Grafana/ Power BI / Tableau или аналогичные); визуализация ключевых показателей и аналитики; построение моделей данных (BI layer); разработка KPI и метрик; создание управленческой отчетности для разных уровней пользователей; настройка ролевого доступа к отчетам (RLS); оптимизация производительности отчетов; взаимодействие с бизнес-заказчиками (сбор требований); Требования: опыт работы с BI-инструментами (Apache Superset / Metabase / Grafana/ Power BI / Tableau); понимание принципов визуализации данных и построения дашбордов; знание SQL; понимание data modeling (star schema, витрины данных); опыт разработки аналитических дашбордов; понимание BI-архитектуры;  Будет плюсом:  опыт работы с большими объемами данных; опыт работы с open-source BI (Superset, Metabase, Grafana); опыт настройки Row-Level Security (RLS); опыт работы с чувствительными данными;  Мы ожидаем:  создание удобных и наглядных дашбордов; автоматизация отчетности; повышение прозрачности данных Требования Опыт	От 1 года до 3 лет Условия работы График работы	Полный день Добавлено 12 дней назад Пожаловаться Отклик на HeadHunter Для связи с работодателем или просмотра контактов нажмите на кнопку",https://qyzmet.kz/redir?id=20584390,qyzmet_deep_parser
Project Coordinator,,,,,,"Project Coordinator ТОО ""Danone Berkut"" Занятость	Полная занятость Адрес	Казахстан, село Байсерке РЕКЛАМА Описание вакансии  In this role you will:  Support project managers and plant teams in daily coordination;  Collect and update project data (timelines, status, budgets);  Prepare reports, presentations, and meeting materials;  Organize meetings, take minutes, and follow up on action items;  Communicate with cross-functional teams and external partners  We are waiting for you if you have:  Higher education (technical, economic, or management background preferred);  1+ year of experience in a similar role (assistant, coordinator, analyst, or project support);  Confident skills in Excel and PowerPoint;  Strong attention to detail and organizational skills;  Basic understanding of project management principles;  English level – Upper Intermediate;  Proactive mindset and ability to manage multiple tasks.  At Danone you will find:  An international production environment with development opportunities;  A supportive and collaborative team;  Space to learn, grow, and make an impact.  Требования Опыт	От 1 года до 3 лет Условия работы График работы	Полный день Добавлено 12 дней назад Пожаловаться Отклик на HeadHunter Для связи с работодателем или просмотра контактов нажмите на кнопку",https://qyzmet.kz/redir?id=20587872,qyzmet_deep_parser
