title,salary,city,job,publish_date,requirements,responsibilities,url,source
Директор по информационной безопасности,,Алматы,«Финансовый Холдинг «Республика»,,,анализа угроз и рисков информационной безопасности; Разработка и внедрение политики информационной ... к информационным ресурсам; Проведение аудитов информационной безопасности; Обучение сотрудников ...,https://qyzmet.kz/redir?id=20642603,qyzmet_parser
Инженер информационной безопасности (Information Security Engineer),,Алматы,Noventiq,,,Обязанности: Анализ текущей инфраструктуры информационной безопасности клиента. Участие в discovery ... безопасности. Опыт в области информационной безопасности или системной интеграции. Желателен опыт ...,https://qyzmet.kz/redir?id=20636920,qyzmet_parser
Специалист по информационной безопасности,От 380 000 ₸,Тараз,"Государственное коммунальное предприятие на праве хозяйственного ведения ""Жамбыл-Жылу"" управления энергетики и жилищно-коммунального хозяйства акимата Жамбылской области""",,,"Профессиональные навыки: Анализ и проверка безопасности архитектуры Web-сервера; Настройка политики безопасности ОС, СУБД, ППО; Настройка системы защиты от утечек конфиденциальной информации ...",https://qyzmet.kz/jobdesc?id=20643966&src=js,qyzmet_parser
Инженер информационной безопасности (SecOps),,"Астана, Бауыржана Момышулы",IT Холдинг Kazdream,,,"Задачи: Мониторинг и обеспечение безопасности сетевой инфраструктуры организации. Управление сетевыми средствами безопасности: фаерволы, IDS/IPS, фильтрация трафика и политики безопасности. Настройка ...",https://qyzmet.kz/redir?id=20634075,qyzmet_parser
Junior Information Security Specialist,200 000 - 300 000 KZT,Астана,Центр цифрового развития Национального Банка Казахстана,,,: Участвовать в мониторинге событий информационной безопасности и реагировании на инциденты; Помогать в ... цифровой трансформации финансового сектора. Мы ищем начинающего специалиста по информационной ...,https://qyzmet.kz/redir?id=20642587,qyzmet_parser
Эксперт ИБ (SOC),,Алматы,Нурбанк,,,области ИБ или ИТ; опыт работы от 3 лет в сфере информационной безопасности; опыт анализа и расследования инцидентов информационной безопасности; опыт координации работы аналитиков SOC (L1/L2 ...,https://qyzmet.kz/redir?id=20649855,qyzmet_parser
"Руководитель направления непрерывности деятельности, рисков ИТ и ИБ",,Алматы,Bereke Bank,,,"информационной безопасности; Организует работу в Управлении по идентификации, анализу, оценке, мониторингу и контролю рисков информационных технологий и рисков информационной безопасности (в том числе на ...",https://qyzmet.kz/redir?id=20645455,qyzmet_parser
Менеджер по управлению операционными IT и ИБ рисками и непрерывности деятельности,,Алматы,Дочерний Банк Казахстан-Зираат Интернешнл Банк,,,"Обязанности: разработка, внедрение и поддержание в актуальном состоянии внутренних нормативных документов по управлению рисками информационных технологий, информационной безопасности, по ...",https://qyzmet.kz/redir?id=20636390,qyzmet_parser
ИТ аудитор,,Алматы,"Страховая компания Халык, ДО Народного Банка Казахстана",,,"информационных технологий и информационной безопасности. - Сбор, систематизация и документирование ... и информационной безопасности. - Анализ материалов проверок контрольных и надзорных органов, внешних ...",https://qyzmet.kz/redir?id=20648601,qyzmet_parser
Системный администратор,200 000 - 300 000 KZT,Караганда,КФ АО Национальный центр экспертизы и сертификации,,,"копирование, архивирование и резервирование данных обеспечивать информационную и ІТ-безопасность и.т.д. Требования: знание основ информационной безопасности, способов защиты информации от ...",https://qyzmet.kz/redir?id=20636279,qyzmet_parser
IT-специалист,,Алматы,АстанаИнжПроект,,,"информационной безопасности. Требования: Опыт работы в аналогичной должности от 3 лет. Знание систем защиты ... О компании: АстанаИнжПроект — проектно-инжиниринговая компания, специализирующаяся на ...",https://qyzmet.kz/redir?id=20634149,qyzmet_parser
"Главный специалист, Категория E-R-4",От 282 693 ₸,Катон-Карагайский район,"Государственное учреждение ""Отдел предпринимательства и сельского хозяйства района Үлкен Нарын""",,,. Соблюдает требования информационной безопасности и исполняет техническую документацию по информационной безопасности. Выполняет иные поручения руководства в пределах компетенции. Соблюдать требования ...,https://qyzmet.kz/jobdesc?id=20642288&src=js,qyzmet_parser
IT Аудитор,,Алматы,Kaspi Bank,,,стандартам информационной безопасности; Подготовка ограничительных мер при предоставлении доступа в ... Обязанности: Аудит ИС и ИТ-инфраструктуры на предмет соответствия требованиям ИБ; Рассмотрение ...,https://qyzmet.kz/redir?id=20473035,qyzmet_parser
Инженер внедрения и поддержки,150 000 - 500 000 KZT,Астана,tLab Technologies,,,); - Понимание базовых принципов Информационной безопасности ; - Опыт работы от 1 года в технической поддержке ... ); - Опыт работы с решениями в области информационной безопасности; - Опыт участия в технических ...,https://qyzmet.kz/redir?id=20636752,qyzmet_parser
IT специалист,250 000 - 300 000 KZT,Туркестан,Otau Group,,,Обеспечение информационной безопасности и защиты данных Консультирование пользователей по ... Обязанности: Поддержка и администрирование компьютерной техники и сетевой инфраструктуры Установка ...,https://qyzmet.kz/redir?id=20642674,qyzmet_parser
Старший эксперт / Направление антифрод МСБ,,Алматы,Банк ЦентрКредит,,,"Знание SQL и опыт работы с базами данных Понимание принципов информационной безопасности Опыт работы ... и участие в расследовании мошеннических операций Взаимодействие с командами аналитики, безопасности ...",https://qyzmet.kz/redir?id=20640314,qyzmet_parser
Специалист технической поддержки/системный администратор,До 200 000 ₸,Караганда,Ske,,,"технологий (VLAN, VPN) и оборудования Понимание принципов информационной безопасности Ответственность ... Обязанности: Обеспечение бесперебойной работы IT-инфраструктуры компании и клиентов ...",https://qyzmet.kz/redir?id=20635393,qyzmet_parser
"Эксперт, Категория С-5",От 327 923 ₸,"Астана, Есильский район","Государственное учреждение ""Министерство сельского хозяйства Республики Казахстан""",,,. Осуществляет обеспечение информационной безопасности и обязательства по исполнению требований технической документации по информационной безопасности. 3.11. Проведение анализа по поступившим ...,https://qyzmet.kz/jobdesc?id=20641220&src=js,qyzmet_parser
Аналитик SOC L1,,Алматы,Нурбанк,,,"экранов; стремление к развитию в сфере информационной безопасности. Условия: Работу в стабильном Банке РК ... Обязанности: мониторинг событий ИБ (SIEM, EDR и др.); первичный анализ (triage); выявление ...",https://qyzmet.kz/redir?id=20649845,qyzmet_parser
Инженер сети службы информационных технологий,,Экибастуз,Транстелеком,,,"информационной безопасности; Организация на основе оперативной информации по инцидентам информационной безопасности, работ по их предотвращению; Мониторинг и обеспечение бесперебойной работы всей ...",https://qyzmet.kz/redir?id=20645450,qyzmet_parser
Главный менеджер Департамента цифровых решений,,Астана,ТОО «Казахстанские атомные электрические станции»,,,; Взаимодействие с командами разработки и подрядчиками; Соблюдение требований информационной безопасности ... информационной безопасности; Умение работать с инцидентами и анализировать причины сбоев. Будет ...,https://qyzmet.kz/jobdesc?id=20636955&src=js,qyzmet_parser
ИТ - специалист,,Астана,Торговая компания Мегаполис-Казахстан,,,"информационной безопасности; Мы ждем именно тебя, откликайся! Полная занятость Полный день ... Что мы предлагаем: Официальное трудоустройство; Конкурентная заработная плата и ежегодное повышение ...",https://qyzmet.kz/redir?id=20634010,qyzmet_parser
Инженер ЗДТУ / IT,750 000 - 850 000 KZT,Шымкент,Тесис,,,"систем, оперативное устранение неисправностей Обеспечение информационной безопасности и разделения ... Опыт работы в энергетике или на производственных объектах является преимуществом Обязанности ...",https://qyzmet.kz/redir?id=20636860,qyzmet_parser
Junior IT Engineer / Python Developer (Video Surveillance),До 400 000 ₸,Караганда,HardDev.kz,,,", Dahua, Milestone и т.д.) Опыт интеграций через API Понимание основ информационной безопасности ... Обязанности: Настройка и подключение камер видеонаблюдения (CCTV) Конфигурация рабочих станций ...",https://qyzmet.kz/redir?id=20635277,qyzmet_parser
Системный администратор отдела поддержки вычислительной и сетевой инфраструктуры г. Атырау (сектор аутстаффинга),,Атырау,ТОО «КМГ-Кумколь»,,,"требований в области информационной безопасности. Знания в области внедрения, сопровождения новых ... безопасности и пожарной безопасности; Знание Active Directory на основе Windows Server 2008–2019 ...",https://qyzmet.kz/jobdesc?id=20639916&src=js,qyzmet_parser
Главный менеджер юридического департамента,,Астана,АО «НК «QazaqGaz»,,,"законодательства, требований внутреннего контроля, управления рисками, комплаенс, информационной безопасности и конфиденциальности; выполняет иные функции, возложенные на юридический Департамент ...",https://qyzmet.kz/jobdesc?id=20635199&src=js,qyzmet_parser
"Ведущий специалист, Категория E-G-4",От 243 700 ₸,Ескельдинский район,"Государственное учреждение ""Аппарат акима Кайнарлинского сельского округа Ескельдинского района""",,,и среднему предпринимательству; 9.Обеспечивает соблюдение технической безопасности; 10.Обеспечивает соблюдение информационной безопасности; 11.По поручению акима сельского округа выполняет другие ...,https://qyzmet.kz/jobdesc?id=20641838&src=js,qyzmet_parser
"Главный специалист, Категория С-О-5",От 327 923 ₸,Костанай,"Государственное учреждение ""Костанайская областная территориальная инспекция Комитета государственной инспекции в агропромышленном комплексе Министерства сельского хозяйства Республики Казахстан""",,,"и требований по информационной безопасности. Выполняет иные обязанности, определенные руководством отдела ... и обследований, готовит отчеты, аналитические и информационные материалы. Взаимодействует с таможенными ...",https://qyzmet.kz/jobdesc?id=20642315&src=js,qyzmet_parser
"Главный специалист, Категория E-G-3",От 243 700 ₸,Есик,"Государственное учреждение ""Аппарат акима города Есик""",,,". обеспечивает соблюдение технической безопасности. Обеспечивает соблюдение информационной безопасности ... взимать с физических лиц плату за имущество, землю и транспортные средства и обеспечивает ...",https://qyzmet.kz/jobdesc?id=20643287&src=js,qyzmet_parser
Заместитель начальника ИКТ-подразделений,200 000 - 250 000 KZT,Талдыкорган,Государственное коммунальное предприятие на праве хозяйственного ведения «Талдыкорганский индустриальный колледж» государственного учреждения «Управление образования области Жетісу»,,,"информационной безопасности и защиту данных. Руководить деятельностью IT-подразделения, распределять ... информационных систем организации. Обеспечивать бесперебойное функционирование IT-инфраструктуры ...",https://qyzmet.kz/jobdesc?id=20644703&src=js,qyzmet_parser
Сетевой инженер,,Алматы,«Финансовый Холдинг «Республика»,,,"требований ИБ; Участие в разработке и внедрении политики сетевой безопасности (ACL, segmentation ... и использования сетевых сенсоров ; Стремление к постоянному развитию в области информационной ...",https://qyzmet.kz/redir?id=20642596,qyzmet_parser
IT-администратор,От 340 000 ₸,Петропавловск,Арида-Софт,,,информационной безопасности; - Настройка и контроль резервного копирования. Будет плюсом - Опыт настройки ... серверного оборудования Компании; - Настройка и сопровождение политик безопасности в домене (пароли ...,https://qyzmet.kz/redir?id=20572566,qyzmet_parser
Системный администратор,От 340 000 ₸,Петропавловск,Арида-Софт,,,"-доступа; - Базовое понимание принципов информационной безопасности; - Настройка и контроль резервного ... и сопровождение политик безопасности в домене (пароли, блокировки, ограничение доступа); - Управление ...",https://qyzmet.kz/redir?id=20464274,qyzmet_parser
Ведущий специалист по сопровождению информационных систем,,Алматы,Tele2/Altel,,,"-процессов в CRM B2B; Проводить оценку и устранение узких мест в работе системы Информационная безопасность ... Мы верим, что новое качество жизни можно нести через реализацию потенциала современных цифровых ...",https://qyzmet.kz/redir?id=20645396,qyzmet_parser
ОТ/IT Инженер,,Байсерке,Danone,,,"антивирусных программ, в рамках обеспечения информационной безопасности, на компьютерах относящихся ... информационной системы. Оказывать поддержку производства при устранении неисправностей связанных с ...",https://qyzmet.kz/redir?id=20649743,qyzmet_parser
Системный администратор (Middle/Senior System Administrator),,Астана,Азия-Софт Сервис ЛТД,,,"Компания Азия-Софт, известна как разработчик сложных информационных систем с повышенными требованиями к информационной безопасности, отказоустойчивости, быстродействию. Сотрудники являются самым ...",https://qyzmet.kz/redir?id=20643149,qyzmet_parser
Помощник/Ассистент руководителя со знанием китайского языка,До 600 000 ₸,Алматы,Asia United Steel,,,и доверенные задачи Работа с конфиденциальной информацией Обеспечение информационной безопасности в ... безопасности и конфиденциальности при передвижении Полная занятость Полный день ...,https://qyzmet.kz/redir?id=20640638,qyzmet_parser
Менеджер (15 Грейд) отдела цифровых компетенций филиала АО «НК «ҚТЖ» - «Центр диагностики пути»,,Астана,Филиал АО «НК «ҚТЖ» - «Центр диагностики пути»,,,"отдела цифровых компетенций; соблюдает требования интегрированной системы менеджмента, информационной безопасности и охраны труда при разработке и сопровождении программных решений. Квалификационные ...",https://qyzmet.kz/jobdesc?id=20641541&src=js,qyzmet_parser
Руководитель отдела IT-инфраструктуры (CIO),,Астана,DS Trading Company,,,"информационной безопасности, разграничения доступов, резервного копирования и защиты данных ... Ключевые задачи: Обеспечение бесперебойной работы IT-инфраструктуры компании: филиалы, производство ...",https://qyzmet.kz/redir?id=20635475,qyzmet_parser
Комплаенс офицер,От 650 000 ₸,Усть-Каменогорск,УКТМК,,,"Системы менеджмента противодействия коррупции, информационной безопасности и относящихся ... руководству и Президенту аналитических, информационных, справочных и других отчетов в области комплаенс с ...",https://qyzmet.kz/redir?id=20635508,qyzmet_parser
Руководитель центра разработки 1С,,Алматы,Aitas KZ,,,"информационных систем Формирование и развитие команды: постановка задач, распределение ролей ... /Специалист) Знания в области бухгалтерского учета / МСФО Опыт в DevOps или информационной ...",https://qyzmet.kz/redir?id=20634918,qyzmet_parser
Бизнес аналитик IT -Департамент эксплуатации информационных систем и поддержки пользователей,,Астана,ТОО «Центр развития цифровой экономики»,,,отделом информационной безопасности. 5. Принимать участие: во внедрении разрабатываемых решений ... Обязанности: 1. Анализировать: потребности заказчика информационных систем и его бизнес-процессы ...,https://qyzmet.kz/jobdesc?id=20636545&src=js,qyzmet_parser
Менеджер (15 грейд) сектора сопровождения ИТ систем и ИТ инфраструктуры Департамента информационных технологий филиала АО «НК «ҚТЖ» - «Дирекция магистральной сети»,,Астана,Филиал АО «НК «ҚТЖ» - «Дирекция магистральной сети»;,,,"; Информационные системы; Системы информационной безопасности, Вычислительная техника и программное обеспечение ... Должностные обязанности: Выполняет сопровождение функционирования ИТ систем и ИТ инфраструктуры ...",https://qyzmet.kz/jobdesc?id=20634834&src=js,qyzmet_parser
