title,salary,city,job,publish_date,requirements,responsibilities,url,source
Fullstack Javascript/Typescript Developer,,,,,,"Fullstack Javascript/Typescript Developer Smart Business Consulting Group Занятость	Полная занятость Адрес	Казахстан, город республиканского значения Астана РЕКЛАМА Описание вакансии  Формат работы: Удаленная работа (с редкими встречами), гибкий график, возможна работа из любой точки мира.  Задачи: Разработка и развитие веб-приложений (frontend и backend) Проектирование архитектуры сервисов и модулей Интеграция с внешними API (платежи, CRM, маркетплейсы и др.) Работа с базами данных, включая проектирование и оптимизацию запросов Поддержка и доработка существующих решений Участие в обсуждении и выборе технологий Оптимизация производительности и масштабируемости Обеспечение безопасности приложений Настройка CI/CD и деплой приложений Написание технической документации Быстрое прототипирование нового функционала  Требования:  Основные: Опыт коммерческой разработки приветствуется Умение работать как с frontend, так и с backend Понимание принципов построения масштабируемых систем Опыт работы с REST API или GraphQL Уверенные знания Git  Опыт работы с Linux  Docker  Frontend: HTML5, CSS3, адаптивная верстка JavaScript (ES6+), TypeScript Опыт работы с фреймворками React, Vue или Angular (предпочтительно React) Понимание принципов SPA и SSR Работа с UI-библиотеками (например MUI, Ant Design) Опыт оптимизации frontend-производительности  Backend: Опыт разработки на одном или нескольких языках: Node.js, Python, PHP, Java или Go Опыт работы с фреймворками: Express, NestJS, Django, Laravel, Spring Проектирование и разработка API Работа с механизмами авторизации (JWT, OAuth)  Базы данных: Реляционные базы данных (PostgreSQL, MySQL) NoSQL базы данных (MongoDB, Redis) Оптимизация запросов, индексы  Будет плюсом: Опыт разработки маркетплейсов или сложных платформ Работа с микросервисной архитектурой Знание WebSockets и real-time систем Опыт работы с очередями (RabbitMQ, Kafka) Понимание принципов DDD и SOLID Опыт написания тестов (unit, integration) Знание TypeScript Опыт работы с AI API или ML сервисами  Redis, Kafka  Опыт работы с облачными платформами (AWS, GCP, Azure будет плюсом)  CI/CD (GitHub Actions, GitLab CI)  Настройка серверов и деплой приложений  Личные качества: Самостоятельность и ответственность Умение работать без жесткого контроля Системное мышление Быстрая обучаемость Инициативность и проактивность Навыки оценки сроков и приоритизации задач  Мы ищем человека, который: Может закрывать задачи под ключ Не боится брать ответственность за результат Понимает проект как продукт, а не только код Предлагает решения, а не просто выполняет техническое задание  Условия: Удаленная работа Гибкий график Конкурентная заработная плата (обсуждается) Работа над интересными и сложными проектами Минимум бюрократии Требования Опыт	От 1 года до 3 лет Условия работы График работы	Удаленная работа Добавлено 27 дней назад Пожаловаться Отклик на HeadHunter Для связи с работодателем или просмотра контактов нажмите на кнопку",https://qyzmet.kz/redir?id=20480309,qyzmet_deep_parser
Mobile Developer (Swift / iOS),,,,,,"Mobile Developer (Swift / iOS) Agile Soft Занятость	Полная занятость Адрес	Казахстан, Алматы, микрорайон Самал-2 РЕКЛАМА Описание вакансии  Mobile Developer (Swift / iOS)  Проект: долгосрочный, финтех  Компания: AgileSoft (аутстафф)  Ищем iOS-разработчика с опытом разработки на Swift для участия в международном финтех-проекте. Акцент на качество, безопасность и производительность.  Обязанности:  — Разработка и поддержка iOS-приложения на Swift  — Интеграция с API и внешними сервисами  — Обеспечение безопасности, стабильности и масштабируемости  — Взаимодействие с QA, UI/UX и backend-командой  — Поддержка и оптимизация существующего кода  Требования:  — Уверенные знания Swift и iOS SDK  — Опыт коммерческой разработки от 3 лет  — Понимание архитектур MVC, MVVM, Clean  — Умение работать с push-уведомлениями, Keychain, JWT  — Знание инструментов Xcode, Git, CI/CD  — Английский — на уровне чтения документации  Будет плюсом:  — Опыт с SwiftUI  — Работа в финтех-продуктах  — Владение английским на уровне B2 и выше  Требования Опыт	От 3 до 6 лет Условия работы График работы	Удаленная работа Добавлено 24 дня назад Пожаловаться Отклик на HeadHunter Для связи с работодателем или просмотра контактов нажмите на кнопку",https://qyzmet.kz/redir?id=20502764,qyzmet_deep_parser
Продакт-менеджер / Бизнес-аналитик (IT),,,,,,"Продакт-менеджер / Бизнес-аналитик (IT) Центр устойчивого развития столицы Зарплата	от 300000 KZT Занятость	Полная занятость Адрес	Казахстан, Астана, улица Алихана Бокейхана, 2 РЕКЛАМА Описание вакансии Обязанности:  -Ведение проекта по развитию и сопровождению ИТ-системы -Организация и проведение встреч с заказчиком (сбор, уточнение и согласование требований) -Построение и поддержание регулярной коммуникации с заказчиком -Анализ и описание бизнес-процессов (AS-IS / TO-BE) -Формирование требований: ТЗ, user stories, постановка задач в разработку -Координация работы команды разработки (backend, frontend, mobile) -Планирование задач, контроль сроков и приоритетов (backlog management) -Ведение протоколов встреч и контроль исполнения решений -Участие в тестировании и приемке функционала -Наполнение системы контентом и настройка бизнес-логики -Сбор обратной связи и формирование предложений по развитию продукта  Требования:  -Желателен опыт работы продакт-менеджером, бизнес-аналитиком или project-менеджером в ИТ от 2 лет -Понимание жизненного цикла разработки ПО -Опыт работы с заказчиками (выявление и формализация требований) -Навыки описания бизнес-процессов и подготовки ТЗ -Опыт постановки задач разработчикам и контроля их выполнения -Навыки проведения встреч и деловой коммуникации -Опыт работы с Jira / Bitrix24 / аналогичными системами -Системное мышление и умение структурировать информацию -Умение работать в условиях многозадачности  Условия:  -Работа в проекте по развитию цифровых сервисов и ИТ-систем -Возможность влиять на продукт и принимать решения -Команда разработки (backend, frontend, mobile) -Гибкий формат работы (офис / гибрид ) -Конкурентная заработная плата (по результатам собеседования) -Возможность профессионального роста и участия в масштабных проектах  Требования Опыт	От 1 года до 3 лет Условия работы График работы	Полный день Добавлено 27 дней назад Пожаловаться Отклик на HeadHunter Для связи с работодателем или просмотра контактов нажмите на кнопку",https://qyzmet.kz/redir?id=20481047,qyzmet_deep_parser
1. QA Automation Engineer (Banking / Mobile / API),,,,,,"1. QA Automation Engineer (Banking / Mobile / API) Agile Soft Занятость	Полная занятость Адрес	Казахстан, Алматы, микрорайон Самал-2 Описание вакансии  Мы ищем QA Automation Engineer для участия в проектах в сфере банкинга и финтеха. Нам нужен специалист, который умеет выстраивать и развивать автоматизацию тестирования, уверенно работает с API, понимает клиент-серверную архитектуру и имеет опыт в web/mobile testing.  В зависимости от проекта задачи могут быть связаны с мобильным банкингом, backend-сервисами, интеграциями и автоматизацией регресса.  Чем предстоит заниматься  Разрабатывать и поддерживать автотесты для API, web и mobile. Проводить функциональное, интеграционное и регрессионное тестирование. Развивать framework автоматизации тестирования. Тестировать backend-сервисы, REST API и интеграционные сценарии. Анализировать результаты тестов, заводить и сопровождать дефекты. Подготавливать тестовую документацию и тестовые сценарии. Взаимодействовать с разработчиками, аналитиками и DevOps-инженерами. Интегрировать автотесты в CI/CD-процессы. Участвовать в повышении качества процессов тестирования в команде.  Наши ожидания  Опыт работы в QA Automation от 2 лет. Знание одного из языков программирования: Java / Kotlin / Python. Опыт автоматизации тестирования API и UI. Практический опыт работы с инструментами: Selenium / Appium / RestAssured / Postman / Playwright. Понимание принципов тест-дизайна и SDLC/STLC. Опыт тестирования REST API. Знание SQL на рабочем уровне. Опыт работы с Git, Jira, Confluence. Понимание HTTP, JSON, клиент-серверного взаимодействия и интеграций. Умение разбираться в логах и воспроизводить сложные дефекты.  Будет плюсом  Опыт в проектах banking / fintech / payments. Опыт тестирования мобильных приложений. Знание BDD. Опыт работы с CI/CD. Практика работы в интеграционных проектах.  Мы предлагаем  Участие в крупных и интересных проектах в финтехе. Сильную профессиональную команду. Конкурентный уровень дохода. Возможность профессионального роста. Формат работы в зависимости от проекта: удаленно / гибрид / офис.  Ключевые навыки: QA Automation, Java, Kotlin, Python, Selenium, Appium, RestAssured, Postman, Playwright, API Testing, Mobile Testing, SQL, Jira, Git, Banking, Fintech  Требования Опыт	От 3 до 6 лет Условия работы График работы	Удаленная работа Добавлено 24 дня назад Пожаловаться Отклик на HeadHunter Для связи с работодателем или просмотра контактов нажмите на кнопку",https://qyzmet.kz/redir?id=20502767,qyzmet_deep_parser
DevOps Engineer,,,,,,"DevOps Engineer Genesis Group AG Занятость	Полная занятость Адрес	Казахстан, Алматы Описание вакансии 🌍 We’re Hiring: Senior Data Scientist (mathematical statistics focus) 📍 Location: Remote 💡 About Us  Yesim is an international product IT company operating in the fast-growing global eSIM and digital connectivity market. We are building a scalable, data-driven business with a clear focus on long-term value creation.  If you are excited by complex datasets, behavioral patterns, forecasting systems, and building analytical infrastructure from the ground up — this opportunity is built for you.  ✨ About the Role  We are looking for a Mid/Senior in-house DevOps Engineer to take full ownership of our infrastructure, developer environments, and CI/CD pipelines. You will work closely with the CTO, CDO and Backend/Frontend Tech Leads, participate in architectural decisions, and establish technical standards from the ground up.  📝 Responsibilities  Data Analysis & Pattern Discovery  Maintain and evolve AWS and Hetzner infrastructure: server provisioning, network rules, resource monitoring Manage SSH tunnels and port-forwarding daemons for secure database access and log retrieval across environments Build and maintain CI/CD pipelines (GitHub Actions / GitLab CI) for backend, frontend, and VoIP services Design and operate database backup systems (MySQL, ClickHouse) on Hetzner: scheduling, rotation, and integrity verification Deploy and maintain staging environments on Hetzner using Docker: multi-stack isolation, production schema replication Create and maintain a unified Docker-based local development environment for the entire backend team Expand SLA monitoring: build dashboards and alerts tailored to different stakeholder groups (developers, customers, management) Write and maintain infrastructure documentation, runbooks, and recovery procedures Contribute to ISO 27001 readiness: access control, server access management, DDoS mitigation 📩 Requirements  3+ years of experience as a DevOps / Infrastructure Engineer  Strong Linux skills (Debian/Ubuntu): bash scripting, systemd, cron, user management  Solid knowledge of Nginx, SSL/TLS, Let's Encrypt configuration  Hands-on Docker and Docker Compose: Dockerfile authoring, compose stacks, networking, volumes  Practical AWS experience: EC2, S3, VPC, Security Groups, IAM, CloudWatch  Hetzner experience: dedicated servers or Cloud VPS, setup from scratch  SSH tunnel management: port forwarding, reverse tunnels, key management  CI/CD pipeline experience: GitHub Actions or GitLab CI  Backup and recovery: mysqldump / ClickHouse backup, verification, rotation  Monitoring and alerting: Prometheus, Grafana, Alertmanager or equivalents  Technical English: able to read documentation independently  Nice to Have  Experience with ClickHouse or other columnar databases  Familiarity with PHP/Laravel stack (for effective team collaboration)  Basic Python or Ansible for automation  Understanding of ISO 27001 or SOC 2 requirements  Background in telecom or SaaS environments  🌍 Languages  Russian - С2  English - B2 or higher  🎁 What We Offer  Full infrastructure ownership from day one – minimal bureaucracy  Direct collaboration with CTO, CDO and Backend/Frontend Tech Leads  Opportunity to build processes from scratch: environments, standards, monitoring  Involvement in strategic projects: ISO 27001, infrastructure scaling  Competitive compensation, discussed individually  Fully remote format — work from anywhere with flexible structure  Global product environment — operate in an international, fast-scaling tech company  Dynamic growth stage — high responsibility, fast decisions, no corporate bureaucracy  If you’re ready to design predictive systems, uncover deep behavioral patterns, and influence high-level business decisions — we’d love to hear from you.  Требования Опыт	От 3 до 6 лет Условия работы График работы	Удаленная работа Добавлено 25 дней назад Пожаловаться Отклик на HeadHunter Для связи с работодателем или просмотра контактов нажмите на кнопку",https://qyzmet.kz/redir?id=20494878,qyzmet_deep_parser
Разработчик программного обеспечения,,,,,,"Разработчик программного обеспечения Explosion Solutions Зарплата	от 700000 до 700000 KZT Занятость	Полная занятость Адрес	Казахстан, Караганда, проспект Республики, 7 Описание вакансии  ​​​  Требования:  Технические требования Full Stack (React / Node.js) Frontend: React 18+, хуки, жизненный цикл компонентов. Управление состоянием: Redux Toolkit или Zustand. TypeScript, HTML5, CSS3. Работа с REST API / GraphQL. Сборка: Vite или Webpack. React Native: React Native CLI и/или Expo. Навигация через React Navigation. Работа с нативными модулями iOS / Android. Push-уведомления через Firebase Cloud Messaging. Публикация в App Store и Google Play. Backend: Node.js: event loop, асинхронная модель. Фреймворки: NestJS (основной), Express или Fastify. Архитектура NestJS: модули, контроллеры, сервисы, guards, interceptors. Аутентификация: JWT, OAuth2. Проектирование REST API. Базы данных: PostgreSQL или MySQL: проектирование схем, сложные запросы, индексация, миграции. MongoDB — желательно. ORM: Prisma или TypeORM (для NestJS). Кэширование: Redis: кэширование запросов, сессий, очереди (BullMQ). Стратегии: cache-aside, write-through, TTL, инвалидация. HTTP-кэширование, CDN. Инфраструктура: Git, Docker, базовый Linux / bash, Nginx. CI/CD: GitHub Actions или GitLab CI. Тестирование: Jest / Vitest, React Testing Library. Опыт: от 3 лет коммерческой разработки Уровень: Middle / Senior  Условия: социальный пакет офис на юго-востоке пятидневка. с 9-00ч до 18-00ч. Требования Опыт	От 3 до 6 лет Условия работы График работы	Полный день Добавлено 26 дней назад Пожаловаться Отклик на HeadHunter Для связи с работодателем или просмотра контактов нажмите на кнопку",https://qyzmet.kz/redir?id=20488623,qyzmet_deep_parser
Manual QA инженер (Middle),,,,,,"Manual QA инженер (Middle) A1 Capital Зарплата	от 250000 KZT Занятость	Полная занятость Адрес	Казахстан, Астана, Есильский район, улица Турара Рыскулова, 5/2 Описание вакансии Что предстоит делать:  Тестировать B2B-продукты (web + Telegram/WhatsApp боты) Проводить функциональное, регрессионное и smoke тестирование Проверять интеграции с CRM (YClients, Altegio и др.) Валидировать бизнес-логику и сценарии пользователей Работать с баг-трекингом (описание, приоритизация, воспроизведение) Участвовать в планировании задач и уточнении требований Писать тест-кейсы и чек-листы Взаимодействовать с разработчиками и аналитиками  Наш стек  Backend: ASP.NET Core, PostgreSQL, Redis Интеграции: Telegram Bot API, WhatsApp API Очереди и фоновые задачи: Hangfire, Kafka Логи и мониторинг: OpenTelemetry, Jaeger, Seq AI: GPT, LLM  Что мы ожидаем  Опыт ручного тестирования от 1 года Понимание клиент-серверной архитектуры Умение тестировать API (Postman / Swagger) Навык написания тест-кейсов и баг-репортов Внимательность к деталям и системное мышление Понимание жизненного цикла разработки (SDLC)   Будет плюсом: Опыт тестирования Telegram / WhatsApp ботов Базовые знания SQL Опыт работы с логами и мониторингом Понимание CI/CD  О компании Flowsell.me — SaaS-сервис в сегменте B2B: интегрируем мессенджеры с CRM и AI-ассистентами. Мы за:  Минимум бюрократии Свободу слова и уважение к команде Влияние на продукт Новый офис в тихом районе Астаны Требования Опыт	От 1 года до 3 лет Условия работы График работы	Полный день Добавлено 21 день назад Пожаловаться Отклик на HeadHunter Для связи с работодателем или просмотра контактов нажмите на кнопку",https://qyzmet.kz/redir?id=20525540,qyzmet_deep_parser
