title,salary,city,job,publish_date,requirements,responsibilities,url,source
Аналитик данных (Product / Data Analyst) ОФ IQanat,,,,,,"Аналитик данных (Product / Data Analyst) ОФ IQanat Холдинг ""BI Group"" Занятость	Полная занятость Адрес	Казахстан, Астана, улица Достык, 2 Описание вакансии  Требования к кандидату: Аналитик данных (с элементами системного и бизнес-анализа) Опыт и профиль:  Желателен опыт работы в аналитике с совмещением нескольких ролей: data-аналитика, бизнес-аналитика и системного аналитика. Важна способность работать на стыке данных, бизнес-процессов и IT-решений.  Технические навыки:  1. SQL: -Общее понимание принципов работы реляционных баз данных. -Понимание структуры таблиц, связей и базовых запросов. -На текущем этапе работа напрямую с БД не требуется, однако важно теоретическое понимание и готовность развиваться в этом направлении.  2. Python:  -Уверенное владение Python. -Опыт работы с библиотеками: Pandas, NumPy, Matplotlib. -Умение читать и писать код, понимание логики алгоритмов и обработки данных.  3. Excel: -Продвинутый уровень владения. -Использование сложных формул, сводных таблиц, анализ и подготовка данных.  4. Power BI: -Умение строить базовые визуализации и отчеты. -Понимание принципов построения дашбордов и логики работы инструмента.  Дополнительные технические навыки -Работа с Git (базовые операции, понимание системы контроля версий). -HTML + CSS на уровне чтения и понимания структуры кода.  Soft skills -Системное мышление -Понимание принципов разработки программного обеспечения. -Базовое понимание работы баз данных и архитектуры клиент-серверных приложений. -Аналитический склад ума и способность быстро разбираться в сложных бизнес-процессах. -Умение находить нестандартные решения и предлагать новые подходы к анализу данных и оптимизации процессов. -Коммуникации -Умение вести деловую переписку. -Навыки проведения рабочих обсуждений и согласований. -Самостоятельность -Способность работать автономно. -Умение самостоятельно находить решения и доводить задачи до результата.  Требования Опыт	От 3 до 6 лет Условия работы График работы	Гибкий график Добавлено 18 дней назад Пожаловаться Отклик на HeadHunter Для связи с работодателем или просмотра контактов нажмите на кнопку",https://qyzmet.kz/redir?id=20546198,qyzmet_deep_parser
"Data Analyst (Junior/middle), Департамент по взысканию проблемных кредитов",,,,,,"Data Analyst (Junior/middle), Департамент по взысканию проблемных кредитов АО ""Alatau City Bank"" Занятость	Полная занятость Адрес	Казахстан, Алматы РЕКЛАМА Описание вакансии  Обязанности:  Сбор и консолидация данных; Подготовка различных видов финансовых и управленческих отчетов; Формирование и анализ отчетности по эффективности деятельности подразделения; Составлять SQL- запросы и работать с БД; Визуализация данных в Power BI.  Требования:  Высшее образование (экономическая, техническая, финансовая); Опыт работы с большими данными и в банковской сфере; Продвинутый Excel, Power BI ,SQL; Развитые аналитические способности, опыт в разработке отчетов; Умение составлять SQL-запросы и работать с БД.  Условия:  Работа в офисе в Алматы; Ежеквартальные премии; Корпоративные предложения по фитнесу; Корпоративные скидки на онлайн обучение в Skyeng для вас и ваших близких; Бесплатная подписка на онлайн библитеку «Alpina Digital»;  Программа психологической поддержки совместно с Sezim;  Бесплатная подписка на библиотеку электронных курсов «LERNA.KZ», где собраны сотни электронных курсов от известных онлайн-школ SkillFactory, GeekBrains и Skillbox; Приятная рабочая атмосфера в современном офисе в деловой части города; Возможность строить карьеру в одном из крупнейших банков Казахстана. Требования Опыт	От 1 года до 3 лет Условия работы График работы	Полный день Добавлено 20 дней назад Пожаловаться Отклик на HeadHunter Для связи с работодателем или просмотра контактов нажмите на кнопку",https://qyzmet.kz/redir?id=20530048,qyzmet_deep_parser
Marketing analyst,,,,,,"Marketing analyst Genesis Group AG Занятость	Полная занятость Адрес	Казахстан, Алматы Описание вакансии  🌍 We’re Hiring: Marketing Analyst 📍 Location: Remote  💡 About Us Yesim is an international product IT company in the global eSIM market, scaling a data-driven digital connectivity product used by customers around the world. We are scaling fast and have a robust data infrastructure and a BI team that has built extensive PowerBI dashboards covering our financial and product metrics. What we are missing is the ""connective tissue"", someone who lives inside that data to tell the story of our growth, challenge our assumptions, and bridge the gap between raw numbers and marketing execution. We don't need someone to just build more dashboards; we need someone to interpret them and tell us where to spend our next $100k.  ✨ About the Role As our Marketing Analyst, you will collaborate closely with the analysts, engineers and marketers. You will focus on the travel eSIM market, a space where attribution is notoriously messy (web-to-app transitions, seasonality, and regional organic ""halos""). Your mission is to find the signal in the noise. You’ll investigate why certain regions are spiking, why others are lagging, and how our offline efforts are actually impacting our bottom line.  📝 Responsibilities  Performance ""Detective"" Work: Regularly audit our marketing funnel. If organic sales spike 30% while Google spend is flat, you’re the one who finds out if it’s a tracking error, a competitor exiting the market, or a viral trend.  Infrastructure Liaison: You will define the requirements for our BI team. You tell them what metrics matter for the CMO’s decision-making, and they build the pipes.  Attribution Strategy: Own the ""messy"" parts of our data. Work with MMPs (Adjust/AppsFlyer) and advertising platforms (Google, Meta etc) to refine how we track users moving from web searches to app installs.  Budget Optimization: Provide regular data-backed insights on budget reallocation. You’ll help us move away from ""last-click"" thinking toward a more holistic view of CAC and LTV.  Hypothesis & Experimentation: Design and analyze tests for new channels (Influencers, OOH) and product changes, ensuring we are making decisions based on significance, not just ""gut feeling.""  📩 Requirements  Experience: 2–4 years in a high-velocity B2C environment. We highly value backgrounds in iGaming, Utility Apps, or Travel-Tech—industries where tracking is hard and competition is fierce.  The Toolkit: You are a SQL power user. You don't need to be a Python expert, but you must be able to manipulate data independently. You should be very comfortable navigating PowerBI (or similar) and MMPs and know the modern advertising landscape.  Pragmatic Math: You understand statistics and incrementality, but you aren't an academic. You know that a ""good enough"" insight today is better than a perfect one next month.  Mindset: You are naturally curious. When you see a data anomaly, you can't rest until you've found the root cause.  🌍 Languages  Russian — Native or fluent  English — Professional working proficiency  🎁 What We Offer  Remote-first culture with a high degree of autonomy.  A chance to shape the analytical framework of a company competing with the biggest players in the travel-tech space.  Direct impact: Your analysis will directly influence our global marketing spend and strategy every single week.  If you enjoy finding meaning in messy data, challenging assumptions, and directly shaping growth strategy — we’d love to hear from you.  Требования Опыт	От 3 до 6 лет Условия работы График работы	Удаленная работа Добавлено 20 дней назад Пожаловаться Отклик на HeadHunter Для связи с работодателем или просмотра контактов нажмите на кнопку",https://qyzmet.kz/redir?id=20534776,qyzmet_deep_parser
Product Analyst (Event Analytics),,,,,,"Product Analyst (Event Analytics) Genesis Group AG Занятость	Полная занятость Адрес	Казахстан, Алматы Описание вакансии  💡About Us  Yesim is a fast-growing global leader in the eSIM industry, on a mission to revolutionize global connectivity. Our product empowers travelers and digital nomads with seamless, affordable, and instant internet access — without the hassle of traditional SIM cards.  We’re building a world-class team of product and data experts to redefine the user experience in telecom and beyond.  ✨ About the Role  We’re looking for a sharp and self-driven Product Analyst who will own and maintain our comprehensive event architecture for both WEB and APP, manage the hierarchy of product metrics, and help the team make informed decisions based on data.  📝 Responsibilities  • Monitor key product metrics and investigate anomalies.  • Support feature releases: document tracking requirements, measure performance, and follow up on outcomes.  • Conduct and analyze A/B experiments.  • Help the product and development teams discover optimal solutions.  📩 Requirements  • Expertise in Google Analytics (all versions), including scopes, custom reports, and API usage.  • Advanced proficiency in Google Tag Manager: event setup, enhanced ecommerce, cross-domain, AMP tracking.  • Strong SQL skills (BigQuery, MySQL, Clickhouse).  • Proven experience designing and analyzing A/B tests.  • Hands-on experience with Amplitude.  • Experience with Firebase and building A/B tests.  • Ability to extract insights from raw data.  • Experience creating and maintaining a complete event model, including pre-conversion actions (scrolls, clicks, micro-goals).  • Understanding the impact of pre-conversion behavior on conversion, retargeting, and personalization.  • Analytical mindset and ability to identify patterns and growth areas independently.  🌟Nice to Have  • Basic JavaScript knowledge for client-side tracking logic.  • Basic Python knowledge (pandas/numpy) for data processing and scripting.  • Comfort working without visual BI tools (Power BI is used only when needed).  🎁 What We Offer  • Fully remote work environment.  • Opportunity to work with live product data.  • Rapidly growing product and team.  • Freedom to test and launch new hypotheses.  • Dynamic collaboration across product and engineering teams.  Apply now — join Yesim!  Требования Опыт	От 3 до 6 лет Условия работы График работы	Удаленная работа Добавлено 20 дней назад Пожаловаться Отклик на HeadHunter Для связи с работодателем или просмотра контактов нажмите на кнопку",https://qyzmet.kz/redir?id=20534743,qyzmet_deep_parser
Family Office and VC Investment Analyst / Associate,,,,,,"Family Office and VC Investment Analyst / Associate Орлова Оксана Юрьевна Занятость	Полная занятость Адрес	Казахстан, Алматы Описание вакансии  We are looking for an Investment Analyst / Associate to join our investment team and support investment activities across venture and traditional businesses within a Family Office structure.  The role is primarily focused on portfolio company analysis and monitoring, including performance assessment, preparation of management-level materials, and support of value creation initiatives.  In addition, the position involves analysis of new investment opportunities, including initial screening, due diligence, financial modelling, and preparation of investment materials for senior management.  The role is analytical and execution-oriented, with a strong emphasis on investment analysis and high-quality management presentations, rather than standalone deal ownership. You will work closely with senior investment professionals and management teams across multiple sectors.  In this role, you will support the senior staff with the followingresponsibilities:  Monitor portfolio companies, ensure data integrity, and prepare internal analytical reports for senior management Preparation and consolidation of monthly, quarterly, and annual management reporting (Monitoring and analysis of key financial performance indicators, as well as monitoring financial risks) Financial modelling, calculating various deal structures and investment returns Processing and evaluating investment proposals Drafting and presenting investment recommendation documents (analytical reports, investment memorandums) Market research and development of investable sub-sector themes Supporting due diligence for prospective investments, including financial and commercial analysis Supporting portfolio companies throughout the investment period  Requirements  At least 3–5 years of work experience in Finance / Audit / Portfolio Management / M&A. BIG4, Valuation consulting firm, Private Equity, Internal Corporate Finance Department or a financial company active in investment management Advanced knowledge of MS Office (Excel, Power Point Presentations, etc.) Knowledge and practical application of valuation methodology and techniques: DCF, market approach, cost approach Good understanding of financial statements and interconnections between them, knowledge of financial accounting, good understanding of IFRS Highly developed analytical, quantitative, and valuation skills, and a solid foundation in accounting Strong project management and organizational skills, with the ability to manage multiple projects simultaneously and pay strong attention to detail Excellent numerical and analytical skills, with great attention to detail  Other Requirements  Strong written & verbal communication skills (English and Russian)  Personal Attributes  Strong interest in private markets, with a clear understanding that the role is primarily focused on portfolio company monitoring and analysis, alongside evaluation of new investment opportunities, including venture and growth-stage companies Analytical and structured mindset, with the ability to assess business performance, value drivers, and investment risks, and to support company evaluation and investment decision-making A positive work ethic and self-motivated, a team-player A high-energy level coupled with a strong desire to learn and succeed  License: N/A, CFA / ACCA (or equivalent) preferred Location: Remote Salary: Competitive  Требования Опыт	От 3 до 6 лет Условия работы График работы	Удаленная работа Добавлено 19 дней назад Пожаловаться Отклик на HeadHunter Для связи с работодателем или просмотра контактов нажмите на кнопку",https://qyzmet.kz/redir?id=20537677,qyzmet_deep_parser
Financial Analyst (maternity cover),,,,,,"Financial Analyst (maternity cover) ТОО ""МЕТРО Кэш энд Керри"" Занятость	Полная занятость Адрес	Казахстан, Алма-Ата, улица Саина Описание вакансии Responsibilities: Perform period-end closing tasks and conduct the preparation and analysis of monthly financial statements, which include balance sheets, income statements, and cash flow statements. Participate in budgeting and forecasting activities, providing insights and analysis to support financial planning. Conduct variance analysis to compare actual financial performance against budget and forecast. Contribute to the development and improvement of financial processes and procedures. Assist in special projects and ad-hoc financial analysis as assigned by management. Requirements: Experience in FMCG is a plus Bachelor’s degree in Finance, Accounting, Economics, or related field Deep knowledge of International Financial Reporting Standards (IFRS) and experience in their application. Proficient in Microsoft Excel Ability to work under pressure, meet deadlines, and maintain quality standards. Excellent analytical skills with the ability to interpret financial data and trends. English proficiency: at least intermediate level  Temporary role for 1-1,5 years  Требования Опыт	От 1 года до 3 лет Условия работы График работы	Полный день Добавлено 16 дней назад Пожаловаться Отклик на HeadHunter Для связи с работодателем или просмотра контактов нажмите на кнопку",https://qyzmet.kz/redir?id=20557799,qyzmet_deep_parser
Client Operations & Solutions Specialist,,,,,,"Client Operations & Solutions Specialist Outsource Pro Зарплата	от 500 до 2000 USD Занятость	Полная занятость Адрес	Казахстан, Алматы, улица Николая Чаплина, 71/66 Описание вакансии  Client Operations & Solutions Specialist  Location: On-site | Full-time | Almaty (Evening shift) Department: Client Operations  Who We Are  At GMY Consulting Group, we go beyond outsourcing — we are a people-first, purpose-driven company.  We support U.S.-based businesses across industries like e-commerce, healthcare, insurance, creative media, and tech with tailored services such as:  - Amazon PPC & e-commerce support - Bookkeeping & data analytics - Medical billing & insurance claims - Customer service & virtual assistance - Graphic & video design — and much more  Our global team blends innovation, reliability, and creativity to deliver meaningful results and build strong, long-term partnerships.  About the Role  We're looking for proactive, motivated individuals to join our Client Operations team. In this role, you'll support U.S.-based clients by helping with key operational and communication tasks.  As a Client Operations & Solutions Specialist, you will:  - Accurately manage data entry and administrative tasks - Communicate with clients via apps, email, and phone - Ensure smooth daily operations and high customer satisfaction - Learn and use new tools with confidence and efficiency  No prior experience is required — we offer full paid training!  Career Tracks You Can Grow Into  Once you master the basics, you can grow into one of the following professional tracks — based on your interests and strengths:  Medical Biller  Review medical records, apply ICD/CPT codes, submit insurance claims, and follow up on denials.  Insurance Claims Adjuster  Process claims, investigate discrepancies, work with carriers, and resolve disputes.  Data Analyst  Compile and analyze data, build dashboards, and generate insights to drive business performance.  Personal Assistant (Virtual Executive Support)  Manage calendars, arrange travel, coordinate meetings, and support U.S.-based executives.  Amazon PPC Specialist  Create and optimize advertising campaigns, manage budgets, and track performance metrics for e-commerce clients.  We’re Looking for Someone Who Is:  ✅ Eager to learn and grow in a global business environment ✅ Detail-oriented, organized, and dependable ✅ A team player who thrives on ownership and initiative ✅ Fluent in English (spoken and written) ✅ Comfortable with MS Excel and online tools ✅ Quick to adapt and loves solving problems  Why Join GMY Consulting Group?  Gain real-world business experience across industries Clear career development paths Supportive, friendly, and collaborative culture Merit-based promotions and long-term opportunities  Work Schedule  Full-time | On-site | Evening shift (Almaty time): 17:00 – 01:00 (March–November) 18:00 – 02:00 (November–March)  What We Offer  Paid training from day one Competitive salary + performance bonuses Paid taxi ride home Open to university students International experience in B2B industries  Apply now with your resume in English. No experience? No problem — we’ll teach you everything you need to succeed.  Ключевые навыки (Key Skills)  * English — C1 (Advanced) * MS Excel * Business communication * Client-focused mindset * Willingness to learn  Требования Опыт	Нет опыта Условия работы График работы	Полный день Добавлено 15 дней назад Пожаловаться Отклик на HeadHunter Для связи с работодателем или просмотра контактов нажмите на кнопку",https://qyzmet.kz/redir?id=20558415,qyzmet_deep_parser
Digital Marketing Manager,,,,,,"Digital Marketing Manager 1С International Занятость	Полная занятость Адрес	Казахстан, Астана, Есильский район Описание вакансии  1Ci provides powerful and flexible products and technologies for business process automation to over 1 million companies worldwide. Our flexible and scalable ERP solutions help businesses from various industries grow and effectively meet customers' needs.  ROLE DESCRIPTION  1. Running and optimizing campaigns in Linkedin, Google Ads, Tiktok, etc: setting up ad copies, tracking results, segmenting audience, testing, monitoring results.  2. Working with AI tools to perform AMB and personalized campaigns in LinkedIn, using Sales Manager to gather audience profiles, prospect lists, operating with data bases.  3. Performing CRM-marketing: aligning leads statuses and progress with promo campaigns, analyzing conversion and promo channels effectiveness, collecting data for campaigns optimization.  4. Setting up integrations: Campaign channels, GetResponse and landing pages to Zapier, Zapier to CRM/WhatsApp Business API, CRM leads to Maximized conversions in GAds (closely collaborating with a web analyst and web developer)  5. Managing lead validation chatbots: collaborating with service provider, tracking workflow, initiating debugs, etc.  6. Preparing regular campaign reports: weekly, monthly, leading quarter digital activities journal.  YOUR PROFILE  Bachelor's Degree 2+ years experience in global digital marketing (B2B as preferred), deep knowledge of GAds, GA4, Linkedin, Tiktok, and FB ad accounts. Desire to try new segments, technical tools, audience approach methods.  WE VALUE  Excellent communication skills, both verbal and written, A team player who is able to prioritize work independently Ability to think critically and analyze data English - working proficiency Требования Опыт	От 1 года до 3 лет Условия работы График работы	Удаленная работа Добавлено 15 дней назад Пожаловаться Отклик на HeadHunter Для связи с работодателем или просмотра контактов нажмите на кнопку",https://qyzmet.kz/redir?id=20565353,qyzmet_deep_parser
