title,salary,city,job,publish_date,requirements,responsibilities,url,source
Middle Fullstack Developer,,,,,,"Middle Fullstack Developer Match me Зарплата	от 600000 до 900000 KZT Занятость	Полная занятость Адрес	Казахстан, Астана, проспект Туран, 42 Описание вакансии  Наш клиент - аутсорсинговая IT-компания. Работаем сейчас над мобильными приложениями для клиентов. Текущий проект: мобильное приложение для покупки и управления недвижимостью. Продукт интегрируется с CRM/ERP, работает с реальными транзакциями и персональными данными.  Команда расширется, и сейчас мы ищем fullstack разработчика с опытом в мобильной разработке.  Задачи:  Разработка frontend + backend (модули, домен, границы ответственности)  Проектирование REST API (версионирование, идемпотентность, пагинация)  Интеграции с CRM/ERP и внешними сервисами (API, вебхуки, события)  Аутентификация и авторизация (JWT/OAuth2, RBAC)  Нагрузочные ожидания, SLA, логирование, мониторинг  CI/CD, dev/test/prod, релизный процесс  UAT, внедрение, разбор инцидентов  Работа под руководством сеньора  Требования:  Опыт мобильной разработки от 2х лет  TypeScript / JavaScript  Git: ветвление, осмысленные коммиты, pull request, разрешение конфликтов.  Понимание асинхронности: Promise, async/await, event loop  Умение читать чужой код и встраиваться в существующую кодовую базу.  Умение получать и давать code review конструктивно.  Frontend  Уверенная работа с React Native: хуки, управление состоянием (Redux / Zustand / React Query или аналоги), переиспользуемые компоненты.  Понимание жизненного цикла компонентов, базовая оптимизация.  Умение реализовывать компоненты по макетам Figma без потери деталей.  Backend  PHP Laravel или Python  Реализация REST API: роутинг, валидация, обработка ошибок, коды ответов.  Базовое понимание аутентификации: JWT, сессии, защита эндпоинтов.  Умение работать с существующей архитектурой модулей  PostgreSQL / MySQL: написание запросов, джойны, базовое понимание индексов, работа с ORM (Prisma / TypeORM / Sequelize).  Redis: базовое использование как кэш или хранилище сессий.  Docker и docker-compose: запустить, настроить, отладить локально.  Понимание CI/CD пайплайнов  Условия:  График работы 5/2 с 9:00 до 18:00 Оклад 600 - 900 тысяч тенге на руки Годовая премия + премии на день рождения Обеды за счет компании Бонусы за проекты Только офис, другие форматы не предусмотрены Требования Опыт	От 1 года до 3 лет Условия работы График работы	Полный день Добавлено 13 дней назад Пожаловаться Отклик на HeadHunter Для связи с работодателем или просмотра контактов нажмите на кнопку",https://qyzmet.kz/redir?id=20576804,qyzmet_deep_parser
Middle Backend Developer (NodeJS),,,,,,"Middle Backend Developer (NodeJS) HJ Platform (Hero’s Journey) Зарплата	от 700000 до 1200000 KZT Занятость	Полная занятость Адрес	Казахстан, Алматы, проспект Аль-Фараби, 120/48 Описание вакансии  Компания Hero’s Journey - это фит-тек стартап, который изобрел новый формат фитнес-клубов, где клиенты тренируются в 2.5 раза регулярнее и гораздо эффективнее, чем в традиционных фитнес-залах. Для этого мы используем итеративно-продуктовый стартап-подход, применяя технологии, геймификацию и Data Science, чтобы непрерывно улучшать продукт.  Главная ценность Hero’s Journey – команда профессионалов. Мы нанимаем людей, опираясь на потенциал, личностные качества и нацеленность на достижение результата. Индивидуально оцениваем вклад каждого сотрудника в достижение общих целей. Мы убеждены, что каждый является автором своих жизненных результатов. Каждый сотрудник нашей компании — это уникальный опыт и знания, которые мы ценим. В нашу команду ищем Middle Backend Developer (NodeJS)  Владение / наличие следующих навыков и знаний определят Ваш квалификационный уровень:  Опыт коммерческой разработки от 2 лет на Node.js. Уверенные знания и опыт работы с GraphQL (Apollo Server/Client). Опыт работы с REST API, WebSockets, Socket.io. Опыт работы с реляционными и/или NoSQL базами данных (например MongoDB). Уверенное владение JavaScript/TypeScript. Опыт работы с системами контроля версий (Git). Умение работать в команде и самостоятельно разбираться в коде.  Будет плюсом:  Опыт с React.js на уровне понимания фронтенда и компонентов. Понимание работы функциональных компонентов (ФЦ) и хуков. Опыт работы с CI/CD. Знание английского языка на уровне чтения технической документации.  Обязанности:  Разработка и поддержка серверной части веб-приложений на Node.js. Проектирование и реализация API на GraphQL. Интеграция с базами данных (PostgreSQL, MongoDB и др.). Работа с аутентификацией, авторизацией, безопасностью API. Написание чистого, поддерживаемого и тестируемого кода. Участие в проектировании архитектуры системы.  Технологии, с которыми работаем:  Node.js (Express) GraphQL (Apollo Server, TypeGraphQL) PostgreSQL / MongoDB Redis Docker / GitHub Actions / AWS Требования Опыт	От 3 до 6 лет Условия работы График работы	Полный день Добавлено 13 дней назад Пожаловаться Отклик на HeadHunter Для связи с работодателем или просмотра контактов нажмите на кнопку",https://qyzmet.kz/redir?id=20580895,qyzmet_deep_parser
Frontend-разработчик,,,,,,"Frontend-разработчик Somnium Зарплата	от 250000 до 400000 KZT Занятость	Полная занятость Адрес	Казахстан, Астана, проспект Туран, 42 Описание вакансии  О нас  SOMNIUM разрабатывает собственные программные продукты для автоматизации бизнеса в Казахстане. Мы уже выпустили систему электронного документооборота и сейчас активно строим платформу автоматизации HR-процессов. Это не аутсорс — мы делаем свой продукт, которым пользуются реальные компании.  Чем предстоит заниматься  Разрабатывать и поддерживать интерфейсы на React Работать с REST API и интегрировать данные во фронтенд Участвовать в код-ревью и обсуждении архитектурных решений Постепенно брать на себя самостоятельные задачи под менторством старших разработчиков  Наш стек  React, Vite, Zustand, ReduxToolkit, HTML5, CSS3, Node.js, Git, REST API  Что важно для нас  Базовое понимание React и JavaScript — не на уровне теории, а на уровне практики Умение читать техническую документацию Готовность разбираться в чужом коде и задавать вопросы Ответственность: если взял задачу — доводишь до конца  Будет плюсом  Опыт работы с Flutter Понимание принципов оптимизации страниц Пет-проекты или учебные работы на GitHub  Что мы предлагаем  Зарплата: 250 000 – 400 000 ₸ — обсуждается по итогам интервью, исходя из ваших реальных навыков Работа в офисе, Астана Команда опытных frontend-разработчиков, которые введут в курс дела и будут рядом Онбординг: вас не бросят сразу в омут — первые задачи курируем совместно Продукт с реальными пользователями, а не внутренние инструменты «для галочки» Требования Опыт	От 1 года до 3 лет Условия работы График работы	Полный день Добавлено 12 дней назад Пожаловаться Отклик на HeadHunter Для связи с работодателем или просмотра контактов нажмите на кнопку",https://qyzmet.kz/redir?id=20584123,qyzmet_deep_parser
Shopify App Developer,,,,,,"Shopify App Developer Genesis Group AG Занятость	Полная занятость Адрес	Казахстан, Алматы Описание вакансии  🌍 We’re Hiring: Shopify App Developer 📍 Location: Remote  💡 About Us Yesim is a global eSIM and telecom SaaS company serving B2C and B2B customers with data and voice eSIM services worldwide.  Our technical team of ~20 includes backend, frontend, QA, VoIP, and DevOps engineers. Infrastructure runs on AWS and Hetzner.  We are scaling our backend team and looking for a Senior PHP Developer / Tech Lead who can take ownership of critical product stacks, drive code quality, and lead by example.  ✨ About the Role  We are looking for an experienced Shopify App Developer to build a public Shopify application that allows merchants (partners) to sell Yesim eSIM plans through their Shopify stores. The backend API infrastructure already exists and is maintained by our in-house team – this role is focused exclusively on the Shopify-side implementation.  The app must be published in the Shopify App Store.  📝 Responsibilities OAuth & App Scaffold: Shopify OAuth 2.0 integration, app registration, callback handling, secure token storage Admin UI: Embedded admin interface using Shopify App Bridge and Polaris – settings page (API key input, markup configuration, templates), sync button with progress indicator, sync/error logs, partner balance display Plan Synchronization: Fetch eSIM plans from our API, apply partner markups, create/update/archive Shopify products with variants, metafields (days, data volume, ISO codes), images, and country-based collections using tags. Must support catalogs of up to 5,000 plans via Shopify Bulk Operations API  Order Processing: Subscribe to orders/paid webhook, verify HMAC signature, call our B2B Core API to deduct partner balance and retrieve QR code / ICCID / plan_id, trigger eSIM activation via our API, deliver QR code and installation instructions to the customer (via order metafield and/or email)  Reliability: Idempotent webhook processing (no duplicate charges or activations), retry logic for transient API errors, comprehensive error logging  App Store Submission: Prepare and submit the application for Shopify App Store review, address reviewer feedback, ensure compliance with all Shopify policies (privacy policy, terms of use, correct scopes, clean install/uninstall)  Testing & Documentation: Cover critical paths (OAuth, sync, webhooks, activation flow), prepare regression checklist, provide deployment instructions  📩Requirements  Proven experience building and publishing public Shopify apps on the Shopify App Store (not just private/custom store apps)  Strong proficiency in Node.js and React (Shopify Polaris / App Bridge)  ➕Nice to Have  Experience with eSIM, telecom, or digital goods delivery Familiarity with B2B/marketplace app patterns Experience with Shopify App Store review process and common rejection reasons PHPl knowledge (for understanding our backend API documentation) Hands-on experience with Shopify Admin API (GraphQL), including Bulk Operations API Experience with Shopify webhooks (subscription, HMAC verification, idempotent processing) Understanding of OAuth 2.0 flows in the Shopify context Experience with metafields, collections, and product management via API Ability to work independently  🎁 What We Offer  Full ownership of a product stack from day one Direct collaboration with CDO Participation in AI engineering culture (Hermes, Argos, Iris) Structured delivery process with clear metrics Opportunity to define engineering standards in a growing company Требования Опыт	От 3 до 6 лет Условия работы График работы	Удаленная работа Добавлено 12 дней назад Пожаловаться Отклик на HeadHunter Для связи с работодателем или просмотра контактов нажмите на кнопку",https://qyzmet.kz/redir?id=20581875,qyzmet_deep_parser
Full Stack Test Engineer Trainee,,,,,,"Full Stack Test Engineer Trainee Andersen Занятость	Полная занятость Адрес	Казахстан, Астана РЕКЛАМА Описание вакансии  International company Andersen, one of the leaders in the outsource production market, is recruiting for Full-stack QA traineeship with further employment in Kazakhstan (in the office: Almaty, or Astana remote).  Andersen Company is interested in the rapid professional development of employees and improvement of their skills, is ready to invest funds and time. Therefore, our competitive advantage is considered to be rapid growth, in terms of salaries, among other things.  Under the guidance of Andersen specialists, you will learn modern testing tools and master automation, expanding your skills across all levels of the product. A traineeship at Andersen is a confident start toward a highly demanded profession that will help you unlock your potential as a full‑stack engineer.  Requirements:  Intermediate or higher level of English (verbal communication);  good knowledge of testing theory;  understanding of SQL;  understanding of WEB / Mobile apps;  work experience is not required;  will be a plus: technical background, any experience in programming, completed courses in testing area;  will be a plus: Intermediate or higher level of German;  will be a plus: basic knowledge of programming languages.  Conditions:  practice on a training project under the guidance of experienced tutors;  control of the trainee's knowledge mastery and feedback;  office-based format of training, or remote for Astana residents;  corporate English language courses at the office or online;  access to the corporate internal training programme (own educational platform);  participation in the company's vibrant corporate life.  An Andersen trainee can confidently count on:  high professionalism of mentors;  careful and attentive attitude during training;  assistance and support during the training process and when entering a commercial project afterwards;  guaranteed employment upon successful completion of training.  Andersen is a great opportunity to start and grow in IT!  Требования Опыт	Нет опыта Условия работы График работы	Полный день Добавлено 18 дней назад Пожаловаться Отклик на HeadHunter Для связи с работодателем или просмотра контактов нажмите на кнопку",https://qyzmet.kz/redir?id=20546309,qyzmet_deep_parser
Developer (Full‑Stack / Cloud Focus),,,,,,"Developer (Full‑Stack / Cloud Focus) АЙКЬЮВИА Солюшнс Казахстан Занятость	Полная занятость Адрес	Казахстан, Алматы, улица Байзакова, 280 РЕКЛАМА Описание вакансии  Job Overview  We are expanding our technology capabilities across Kazakhstan and looking for a skilled Developer to join our growing regional team. In this role, you will design, develop, and deliver modern software solutions used across the Eurasia and global organization.  You will work with the latest cloud technologies (Azure, Databricks), modern programming languages, and collaborate closely with global engineering teams. This is a great opportunity to contribute to impactful, large‑scale projects, while working remotely from anywhere in Kazakhstan.  This position focuses on hands‑on development, full‑stack work, and high standards of software quality—no user support or helpdesk responsibilities.  What You Will Do (Essential Functions)  Design and develop software products and business process solutions based on functional and technical requirements. Contribute across the full application stack: front‑end, back‑end, cloud, databases, CI/CD, and more. Participate in the migration of regional systems to global Azure‑based components. Analyze and resolve complex code issues, optimize performance, and write clean, maintainable code. Define and apply advanced software testing standards and conduct comprehensive testing activities. Perform code reviews, refactor legacy modules, and optimize queries (SQL and cloud‑based). Lead medium‑scale development initiatives within the team. Support onboarding of new engineers and contribute to knowledge‑sharing activities.  What We’re Looking For (Qualifications & Requirements)  Education  Bachelor’s degree in Computer Science, Software Engineering, or equivalent technical background.  Technical Skills – Must Have  Programming: Python (primary language) Scala (Spark-level) Experience with any of the following is an advantage: Java, Angular, C# Cloud & Big Data: Microsoft Azure Azure Databricks (clusters, jobs, SQL warehouses, environments, cost monitoring) CI/CD & DevOps: GitLab, CI/CD pipelines Databricks jobs & notebook deployments Docker (incl. creating custom runtime images) Containers: Docker Kubernetes Databases: MS SQL or equivalent experience with relational databases  Other Requirements  English proficiency is mandatory – this role interacts daily with global teams. 3–5 years of hands‑on commercial software development experience. Practical (not only theoretical) experience with Azure + Databricks in previous roles.  What We Offer  Opportunity to join a fast‑growing Kazakhstan hub supporting global initiatives. Work with modern cloud technologies and scalable data platforms. Full flexibility with a home‑based role, open to candidates from any region in Kazakhstan. Collaborative environment with access to global expertise, training, and technical mentorship. Competitive compensation aligned with the local market.  About the Team  Our development team supports production across the CIS and Eurasia region and is now fully transitioning to global Azure‑based components. You will join a technically strong team with an international footprint, working on impactful digital solutions used worldwide.  IQVIA is a leading global provider of clinical research services, commercial insights and healthcare intelligence to the life sciences and healthcare industries. We create intelligent connections to accelerate the development and commercialization of innovative medical treatments to help improve patient outcomes and population health worldwide.  IQVIA is committed to integrity in our hiring process and maintains a zero tolerance policy for candidate fraud. All information and credentials submitted in your application must be truthful and complete. Any false statements, misrepresentations, or material omissions during the recruitment process will result in immediate disqualification of your application, or termination of employment if discovered later, in accordance with applicable law. We appreciate your honesty and professionalism.  Требования Опыт	От 3 до 6 лет Условия работы График работы	Удаленная работа Добавлено 20 дней назад Пожаловаться Отклик на HeadHunter Для связи с работодателем или просмотра контактов нажмите на кнопку",https://qyzmet.kz/redir?id=20533876,qyzmet_deep_parser
