title,salary,city,job,publish_date,requirements,responsibilities,url,source
Backend-разработчик,,,,,,"Backend-разработчик ТОО ""Business Applications Solutions"" Занятость	Полная занятость Адрес	Казахстан, Алматы, проспект Аль-Фараби, 19к1Б Описание вакансии  Мы — IT-компания, работающая на рынке Казахстана с 2009 года. Специализируемся на внедрении и сопровождении информационных систем, помогая бизнесу автоматизировать процессы и повышать эффективность.  За более чем 16 лет мы реализовали проекты для компаний из разных отраслей и зарекомендовали себя как надежный технологический партнёр. Наши решения включают системы управления бизнесом, электронный документооборот, CRM и аналитические платформы.  Наша главная ценность — команда экспертов, которые создают современные решения и помогают клиентам успешно проходить цифровую трансформацию. Мы поддерживаем развитие сотрудников и создаём среду для профессионального роста.    Обязанности: Разработка и поддержка back-end приложений (Node.js, TypeScript) Проектирование масштабируемой архитектуры и написание чистого, поддерживаемого кода Разработка и интеграция RESTful API Работа с базами данных (PostgreSQL), кэшированием (Redis) и очередями (RabbitMQ) Оптимизация производительности приложений Интеграция с front-end сервисами Покрытие кода тестами Участие во всех этапах разработки: проектирование, разработка, тестирование, поддержка Взаимодействие с командой (frontend, дизайнеры, аналитики) Ведение технической документации  Требования: Высшее техническое образование Опыт работы backend-разработчиком от 3 лет (Node.js) Уверенное знание Node.js и TypeScript Опыт разработки микросервисной архитектуры и высоконагруженных систем Опыт работы с REST API Опыт работы с PostgreSQL, Redis, RabbitMQ Опыт работы с Git Понимание принципов разработки масштабируемых систем Опыт работы в Agile-командах  Условия:  -официальное трудоустройство  - стабильная проектная загрузка  - уютный офис в БЦ «Нурлы-Тау»  Командная среда и бенефиты:  Комфортная рабочая среда и поддержка команды: оборудованная кухня, кофемашины и зона отдыха. Компания регулярно организует командные обеды и угощения, поздравляет сотрудников с Днём рождения и праздниками.  Дополнительно предоставляются корпоративная связь и абонемент 1Fit после испытательного срока.  Если вам близка работа с современными IT-решениями и вы хотите участвовать в проектах, которые меняют бизнес-процессы компаний - отправляйте отклик. Будем рады обсудить возможности сотрудничества.  Требования Опыт	От 1 года до 3 лет Условия работы График работы	Полный день Добавлено 7 дней назад Пожаловаться Отклик на HeadHunter Для связи с работодателем или просмотра контактов нажмите на кнопку",https://qyzmet.kz/redir?id=20609935,qyzmet_deep_parser
Backend-разработчик,,,,,,"Backend-разработчик Galamat Company Занятость	Полная занятость Адрес	Казахстан, Астана, проспект Мангилик Ел, 42 Описание вакансии  Galamat — один из ведущих девелоперов Казахстана с более чем 20-летним опытом. Компания активно развивает внутренние цифровые продукты и усиливает IT-направление.  Мы ищем бэкенд-разработчика, который будет отвечать за серверную логику, API и работу с данными в рамках внутренних сервисов компании.  Чем предстоит заниматься:  Разработка и развитие серверной логики приложений Проектирование, разработка и поддержка REST API Работа с существующим бэкендом на PHP (анализ, доработка, оптимизация) Интеграция с внутренними и внешними сервисами Участие в развитии микросервисной архитектуры Работа с базами данных (проектирование, оптимизация запросов) Взаимодействие с frontend- и DevOps-командами Участие в обсуждении архитектурных решений  Кого мы ищем:  Опыт разработки от 2 лет Уверенное знание backend-разработки (PHP, Node.js / Python / Java — один или несколько стеков) Опыт работы с REST API Понимание архитектуры серверных приложений Опыт работы с базами данных (SQL) Опыт интеграции с внешними сервисами Умение писать чистый, поддерживаемый код Понимание взаимодействия с frontend (будет плюсом)  Что мы предлагаем:  Официальное трудоустройство по ТК РК График 5/2, 09:00–18:00 Комфортный современный офис в центре левого берега (пр. Мангилик Ел, 42) Сильный IT-отдел и техническая экспертиза внутри команды Стабильная компания без задержек зарплаты Конкурентный доход с возможностью роста в зависимости от результатов работы Быстрый и понятный карьерный рост Рост вместе с компанией и участие в масштабировании ключевых процессов Долгосрочные проекты и развитие внутренних продуктов Требования Опыт	От 1 года до 3 лет Условия работы График работы	Полный день Добавлено 8 дней назад Пожаловаться Отклик на HeadHunter Для связи с работодателем или просмотра контактов нажмите на кнопку",https://qyzmet.kz/redir?id=20605353,qyzmet_deep_parser
Middle Backend Developer,,,,,,"Middle Backend Developer MP Solutions Занятость	Полная занятость Адрес	Казахстан, Алматы, улица Байзакова, 280 Описание вакансии  Mercury Innovations — технологическое подразделение Mercury Solutions, отвечающее за разработку цифровых продуктов и платформ для бизнеса и потребителей.  Мы в поиске Middle Backend Developer — специалиста, который будет участвовать в разработке и развитии backend-сервисов, работать с API, базами данных и интеграциями, а также обеспечивать стабильность и производительность системы  AINA – это платформа для управления коммерческой недвижимостью и сервисов для посетителей Цифровая платформа, объединяющая арендаторов, резидентов и администрацию торговых и офисных объектов в одном окне.  Чем предстоит заниматься:  Участие в проектировании и развитии backend сервисов в рамках существующей архитектуры платформы; Разработка и поддержка backend сервисов; Интеграция с внешними системами (поставщики, платёжные шлюзы, логистика); Участие в оптимизации производительности backend сервисов; Написание чистого, поддерживаемого кода и участие код-ревью; Участие в планировании и оценке задач, взаимодействие с командой разработки; Работа с базами данных и кэшами (написание запросов, оптимизация); Работа с логами, мониторингом и обработкой ошибок на уровне сервиса; Разработка новых и поддержка текущих функциональных модулей на Laravel; Реализация API по требованим, включая документацию и версионирование; Работа с асинхронной обработкой задач через RabbitMQ а рамках существующих решений; Оптимизация SQL-запросов и структуры PostgreSQL баз данных; Использование Redis для кэширования и очередей; Обеспечение тестируемости и покрытия кода unit и feature-тестами; Участие в CI/CD процессах; Участие в code review.  Мы от вас ожидаем:  Уверенное знание PHP 8, Laravel (10–12 версии); Опыт разработки RESTful API и понимание принципов SOLID; Уверенное знание PostgreSQL, понимание индексации, транзакций, изоляции и оптимизации запросов; Опыт работы с Redis (кэширование, pub/sub, очереди); RabbitMQ: очереди, топики, ретраи, dead-letter; Понимание принципов микросерисной архитектуры. Понимание принципов чистой архитектуры; Опыт написания и запуска автотестов (PHPUnit, Pest); Базовое понимание CI/CD процессов (GitLab CI или GitHub Actions; Опыт работы в Agile (Scrum/Kanban) команде; Способность разрабатывать и поддерживать backend сервисы в рамках существующей архитектуры; Умение решать технические задачи самостоятельно; Навык оценки задач и взаимодействия с командой; Навык отладки и профилирования backend-приложений; Навык написания чистого, тестируемого и поддерживаемого кода.  Что вы получите, работая с нами:  Материальная помощь к отпуску в размере должностного оклада (после 1 года работы) согласно положению об отпусках и социальной поддержке;  Медицинская страховка для работника (после окончания испытательного срока).  Этапы отбора:  1. Телефонное интервью с рекрутером; 2. Техническое собеседование с лидом; 3. Финальное собеседование с HR + PM.  Присоединяйтесь к нашей команде и вместе мы создадим будущее, полное инноваций и достижений!  Требования Опыт	От 3 до 6 лет Условия работы График работы	Полный день Добавлено 9 дней назад Пожаловаться Отклик на HeadHunter Для связи с работодателем или просмотра контактов нажмите на кнопку",https://qyzmet.kz/redir?id=20598007,qyzmet_deep_parser
Backend Developer (Senior),,,,,,"Backend Developer (Senior) Алма Телекоммуникейшнс Казахстан (almaPLUS) Занятость	Полная занятость Адрес	Казахстан, Алматы, улица Айтиева, 23 РЕКЛАМА Описание вакансии  Мы ищем сильного backend-разработчика, который умеет работать не только с «идеальными» проектами, но и с реальными системами: legacy, интеграции, нагрузка, production-инциденты.  У вас будет ключевая роль в развитии backend-сервисов и постепенной трансформации архитектуры.  Чем предстоит заниматься: Поддержка и развитие backend-систем на PHP / Laravel Работа с legacy-кодом: аккуратные изменения без поломки текущей логики Разработка и доработка бизнес-логики Исправление багов и стабилизация системы Оптимизация производительности (запросы, очереди, фоновые задачи) Работа с базами данных (MySQL / PostgreSQL) Интеграции с внешними сервисами (REST API, webhooks) Использование Redis (кэш, очереди, блокировки) Разбор и устранение production-инцидентов Подготовка системы к постепенному рефакторингу Интеграция старых и новых сервисов Использование AI-инструментов с обязательной проверкой качества Требования: Опыт backend-разработки от 3–5 лет Уверенные знания PHP и Laravel Опыт работы с legacy-проектами Работа с MySQL или PostgreSQL Опыт работы с Redis и очередями Опыт интеграций (API, webhooks) Умение разбирать и устранять ошибки в production Условия:  Современный офис в центре города с кофе-аппаратами, двумя столовыми и зоной отдыха (Wi-Fi, настольный футбол для разрядки)  Стабильный доход и официальное оформление по ТК РК  Скидку 50% на услуги компании  Карьерные перспективы и рост внутри компании  Современные рабочие инструменты и команду профессионалов  Корпоративные мероприятия: тимбилдинги, конкурсы, викторины, спортивные и интеллектуальные активности  График 5/2, с 09:00 до 18:00  Если тебе ближе не «идеальные проекты», а реальные задачи — тебе к нам! Откликайся!  Требования Опыт	От 3 до 6 лет Условия работы График работы	Полный день Добавлено 8 дней назад Пожаловаться Отклик на HeadHunter Для связи с работодателем или просмотра контактов нажмите на кнопку",https://qyzmet.kz/redir?id=20606848,qyzmet_deep_parser
Backend Go Developer,,,,,,"Backend Go Developer Транслайн Интернэшнл Зарплата	от 600000 KZT Занятость	Полная занятость Адрес	Казахстан, Алматы, улица Манаса, 32А Описание вакансии  Стек:  Go (Golang), gRPC, REST PostgreSQL, PgBouncer Kafka (в KRaft-режиме) Envoy Gateway, Traefik/nginx Redis, OpenTelemetry, Prometheus  Задачи:  Разработка и оптимизация микросервисов на Go. Реализация бизнес-логики и событийного взаимодействия через Kafka. Интеграция с IAM-сервисом и Envoy Gateway. Работа с PostgreSQL через connection pooler (PgBouncer).. Поддержка монито.-ринга и трассировки через OpenTelemetry. Участие в проектировании архитектуры и CI/CD pipeline’ов.  Требования:  Опыт коммерческой разработки на Go от 2 лет. Понимание микросервисной архитектуры, gRPC, REST. Уверенная работа с PostgreSQL и очередями (Kafka, NATS, RabbitMQ). Опыт с Docker, Git, CI/CD. Будет плюсом: опыт работы с Envoy, OpenTelemetry, Kubernetes.  Условия:  Официальное оформление по ТК РК. График работы: 5/2 с 09.00-18.00 в офисе, удаленку мы не рассматриваем. ЗП обсуждается. Офис находится: ул. Манаса 32 А, БЦ ""САТ"". Требования Опыт	От 3 до 6 лет Условия работы График работы	Полный день Добавлено 8 дней назад Пожаловаться Отклик на HeadHunter Для связи с работодателем или просмотра контактов нажмите на кнопку",https://qyzmet.kz/redir?id=20599870,qyzmet_deep_parser
Backend GO Developer,,,,,,"Backend GO Developer PingOcean (ПингОушен) Зарплата	от 600000 KZT Занятость	Полная занятость Адрес	Казахстан, Алматы, проспект Достык, 240 Описание вакансии  Компания PingOcean занимается разработкой программных решений в области выявления несанкционированного трафика на сетях связи, и решений, связанных с тестированием качества голосовых маршрутов.  Мы предлагаем:  Карьерный рост  Развитие в области новых технологий в коллективе фанатичных профи  Дружная команда  Офис в верхней части города  Требования  Опыт работы с Git;  Опыт написания кода на golang; Аналитическое мышление;  Знание PostgreSQL;  Опыт работы с Linux;  ci/cd;  REST API.  Какие задачи предстоит решать:  Оптимизировать работу сервисов и запросов;  Разрабатывать новые функции API, алгоритмы, процессы, системы;  Развивать административную часть проекта;  Условия:  Испытательный период: 1-2 месяца;  График: 5/2, с 07:30 до 16:30;  Переменная часть вознаграждения (бонусы);  Оформление по ТК РК;  Дружный коллектив талантливых специалистов своего дела.  При отклике на вакансию просим отправлять ссылки на github со своими прошлыми работами.  Требования Опыт	От 1 года до 3 лет Условия работы График работы	Полный день Добавлено 7 дней назад Пожаловаться Отклик на HeadHunter Для связи с работодателем или просмотра контактов нажмите на кнопку",https://qyzmet.kz/redir?id=20610239,qyzmet_deep_parser
"Ведущий Backend разработчик (Java, Go)",,,,,,"Ведущий Backend разработчик (Java, Go) Центр электронных финансов Зарплата	от 900000 до 1200000 KZT Занятость	Полная занятость Адрес	Казахстан, Астана, улица Чингиза Айтматова, 52 Описание вакансии Ведущий Backend разработчик (ДЦ Е-Мф) Обязанности: проектирование, разработка и поддержка микросервисов на Java и Go; моделирование, настройка и отладка автоматизированных workflow (триггеры, действия, условия, ветвления);  разработка эффективных backend решений (REST, SQL, SOAP, OpenAPI);  понимание различных хранилищ данных и их назначения (Postgres, redis, oracle, cassandra, kafka, rabbit).  Требования: образование высшее профессиональное в сфере информационных технологий; владение Java 21 и выше, Spring Boot, структуры данных, ООП не менее 5 лет; опыт разработки микросервисов не менее 5 лет, с декомпозицией монолита, межсервисным взаимодействием (gRPC, REST) и оркестрацией (Kubernetes); опыт работы с Kubernetes, Helm, service mesh (Istio / Linkerd). Условия: Испытательный срок 3 месяца; Рабочий день с 8:30 до 18:00, обеденный перерыв с 13:00 до 14:30; Отпуск 30 к.д.; Работа в большой, инновационной компании; Возможность карьерного и профессионального роста; Работа в дружном молодом коллективе; Стабильная заработная плата; Обучение, тренинги, курсы за счет средств компании; Официальное трудоустройство согласно ТК РК. Требования Опыт	От 3 до 6 лет Условия работы График работы	Полный день Добавлено 9 дней назад Пожаловаться Отклик на HeadHunter Для связи с работодателем или просмотра контактов нажмите на кнопку",https://qyzmet.kz/redir?id=20599318,qyzmet_deep_parser
