job_id,job_title,skills,experience_level,education_level,label,source,is_custom
3f6b07a5,QA инженер (Middle),"sql, postgresql, git",От 1 года до 3 лет,Not Specified,QA Engineer,hh_parser_final_dataset.csv,no
131253f2,Manual QA Engineer,"sql, git",От 3 до 6 лет,Not Specified,QA Engineer,hh_parser_final_dataset.csv,no
d57c1523,"QA Engineer (onsite, Almaty)","sql, ci/cd",От 3 до 6 лет,Not Specified,QA Engineer,hh_parser_final_dataset.csv,no
b755eb3c,Manual QA Engineer (Junior),git,От 1 года до 3 лет,Not Specified,QA Engineer,hh_parser_final_dataset.csv,no
ece5c65f,QA Engineer (Middle),"python, typescript, react, fastapi, sql, postgresql, docker, ci/cd, git",От 3 до 6 лет,Not Specified,QA Engineer,hh_parser_final_dataset.csv,no
5b0ab852,Инженер-тестировщик (QA engineer),linux,От 1 года до 3 лет,Высшее образование,QA Engineer,hh_parser_final_dataset.csv,no
29b2ee02,QA Engineer Junior (Mobile),mysql,От 1 года до 3 лет,Not Specified,QA Engineer,hh_parser_final_dataset.csv,no
07b455f5,Программист-тестировщик (QA Engineer),"python, java, javascript",От 1 года до 3 лет,Not Specified,QA Engineer,hh_parser_final_dataset.csv,no
ac967f3c,QA Automation Engineer (JavaScript),"javascript, cypress, jest",От 1 года до 3 лет,Not Specified,QA Engineer,hh_parser_final_dataset.csv,no
cc52da37,1. QA Automation Engineer (Banking / Mobile / API),"python, java, sql, ci/cd, git",От 3 до 6 лет,Not Specified,QA Engineer,hh_parser_final_dataset.csv,no
3a5ff862,QA инженер Middle/Middle+,"python, sql, postgresql, ci/cd",От 3 до 6 лет,Not Specified,QA Engineer,hh_parser_final_dataset.csv,no
c4855ec7,Manual QA инженер (Офис),"java, javascript, sql, html, css",От 3 до 6 лет,Not Specified,QA Engineer,hh_parser_final_dataset.csv,no
5f6eb415,Manual QA инженер (Middle),".net, sql, postgresql, redis, kafka, ci/cd",От 1 года до 3 лет,Not Specified,QA Engineer,hh_parser_final_dataset.csv,no
a7e4c8c4,Manual QA Engineer / Quality Assurance / Тестировщик,"sql, kafka, ci/cd",От 3 до 6 лет,Not Specified,QA Engineer,hh_parser_final_dataset.csv,no
cdcd8972,Automation QA Senior Engineer,"java, ci/cd",От 3 до 6 лет,Not Specified,QA Engineer,hh_parser_final_dataset.csv,no
6e17bbb3,Automation QA Middle Engineer,"python, javascript, sql, ci/cd",От 3 до 6 лет,Not Specified,QA Engineer,hh_parser_final_dataset.csv,no
9ecb5dca,Middle QA Engineer,"sql, docker, ci/cd, git, linux, figma",От 1 года до 3 лет,Not Specified,QA Engineer,hh_parser_final_dataset.csv,no
730f7390,QA Engineer (Middle+),"kubernetes, ci/cd, cypress",От 3 до 6 лет,Not Specified,QA Engineer,hh_parser_final_dataset.csv,no
65ae36e3,QA Automation Engineer (Mobile),"javascript, sql, git",От 1 года до 3 лет,Not Specified,QA Engineer,hh_parser_final_dataset.csv,no
9b8777f2,QA Engineer,"java, ci/cd, git",От 3 до 6 лет,Not Specified,QA Engineer,hh_parser_final_dataset.csv,no
4699cf99,QA Engineer,"python, java, javascript",От 1 года до 3 лет,Not Specified,QA Engineer,hh_parser_final_dataset.csv,no
bd29d1e1,Senior QA Test Automation Engineer,"java, sql, ci/cd",От 1 года до 3 лет,Not Specified,QA Engineer,hh_parser_final_dataset.csv,no
c8712fa4,Backend Developer (Kotlin) in Kazakhstan,"java, spring, sql, postgresql, redis, kafka, docker, kubernetes, ci/cd, git",От 3 до 6 лет,Not Specified,Mobile Developer,hh_parser_final_dataset.csv,no
e9b62f37,Mobile Developer (Flutter) + UI/UX (Senior),"ci/cd, ui/ux",От 3 до 6 лет,Not Specified,Mobile Developer,hh_parser_final_dataset.csv,no
ea010571,Python Developer,"python, go, sql, docker, kubernetes, ci/cd",От 3 до 6 лет,Not Specified,Backend Developer,hh_parser_final_dataset.csv,no
dc345b2d,Java Developer in Almaty,"java, spring, sql, postgresql, mysql, redis, kafka, rabbitmq, docker, kubernetes, ci/cd, git, linux",От 1 года до 3 лет,Not Specified,Backend Developer,hh_parser_final_dataset.csv,no
978bb5d3,Frontend-разработчик (Senior) Freedom AI Labs,"javascript, typescript, react, docker, kubernetes, ci/cd, css, tailwind",От 3 до 6 лет,Not Specified,Frontend Developer,hh_parser_final_dataset.csv,no
62fbbb22,Mobile Developer (React Native),"typescript, react, ci/cd, git",От 3 до 6 лет,Not Specified,Mobile Developer,hh_parser_final_dataset.csv,no
b22fb50d,Senior Developer (Flutter / Laravel / React),"javascript, react",От 1 года до 3 лет,Not Specified,Mobile Developer,hh_parser_final_dataset.csv,no
d116a513,Junior Frontend Developer (Angular),"javascript, typescript, angular, git, css, sass, tailwind",От 1 года до 3 лет,Not Specified,Frontend Developer,hh_parser_final_dataset.csv,no
0e14ed6c,Senior Fullstack Developer (Java / React),"java, javascript, react, spring, postgresql, redis, docker, ci/cd, figma",От 3 до 6 лет,Высшее образование,Frontend Developer,hh_parser_final_dataset.csv,no
c28581f7,Программист Mobile Developer,"javascript, react, ci/cd, git",От 1 года до 3 лет,Not Specified,Mobile Developer,hh_parser_final_dataset.csv,no
cbe9ce42,Mobile Developer (Swift / iOS),"ci/cd, git, ui/ux",От 3 до 6 лет,Not Specified,Mobile Developer,hh_parser_final_dataset.csv,no
675def8a,Mobile Developer (Kotlin / Android),"ci/cd, git, figma, ui/ux",От 3 до 6 лет,Not Specified,Mobile Developer,hh_parser_final_dataset.csv,no
dd5ff9fa,Android-разработчик,"java, ci/cd, git",От 1 года до 3 лет,Not Specified,Mobile Developer,hh_parser_final_dataset.csv,no
5856b6cc,Kotlin Developer,"java, spring, sql, postgresql, redis, kafka, docker, kubernetes, ci/cd, git",От 3 до 6 лет,Not Specified,Mobile Developer,hh_parser_final_dataset.csv,no
01ad7c48,Middle React Native Developer,"javascript, typescript, react, ci/cd",От 3 до 6 лет,Not Specified,Frontend Developer,hh_parser_final_dataset.csv,no
b4cc2f2e,Full-Stack Engineer (JavaScript/PHP),"javascript, php, sql, ci/cd",От 3 до 6 лет,Not Specified,Full Stack Developer,hh_parser_final_dataset.csv,no
f3e9fe26,React Native Senior Developer,"java, react, ci/cd, html, css, jest",От 3 до 6 лет,Not Specified,Frontend Developer,hh_parser_final_dataset.csv,no
2e9529f8,Data Engineer,"python, fastapi, sql",От 3 до 6 лет,Not Specified,Data Engineer,hh_parser_final_dataset.csv,no
0f67c7c9,Data Engineer,"postgresql, mysql, mongodb, kafka",От 3 до 6 лет,Not Specified,Data Engineer,hh_parser_final_dataset.csv,no
fd7d9e7b,Data Engineer,"python, go, sql, redis, kafka",От 1 года до 3 лет,Not Specified,Data Engineer,hh_parser_final_dataset.csv,no
0805344b,QA Automation Engineer (Kotlin\Java),"java, ci/cd, git",От 1 года до 3 лет,Not Specified,QA Engineer,hh_parser_final_dataset.csv,no
49c83690,MLOps/DevOps Specialist,"python, docker, kubernetes, ci/cd, linux, bash, ansible, terraform, ml, data science",От 1 года до 3 лет,Not Specified,Data Scientist,hh_parser_final_dataset.csv,no
13d77330,Senior Data Engineer,"sql, mysql, kafka, kubernetes",От 3 до 6 лет,Not Specified,Data Engineer,hh_parser_final_dataset.csv,no
7efa7e9f,Data engineer,"sql, kafka",От 3 до 6 лет,Not Specified,Data Engineer,hh_parser_final_dataset.csv,no
9d38f7bb,Главный Data Engineer,sql,От 1 года до 3 лет,Not Specified,Data Engineer,hh_parser_final_dataset.csv,no
84c6b726,Эксперт data engineer,"sql, kafka",От 3 до 6 лет,Not Specified,Data Engineer,hh_parser_final_dataset.csv,no
4d752904,DevOps Engineer,"docker, kubernetes, ci/cd, linux, ansible, terraform",От 3 до 6 лет,Not Specified,DevOps Engineer,hh_parser_final_dataset.csv,no
496083d6,Senior AI / ML Engineer (Applied AI Systems Lead),"python, fastapi, sql, docker, kubernetes, ml, pandas",От 3 до 6 лет,Not Specified,Data Scientist,hh_parser_final_dataset.csv,no
39747052,Data Engineer,"python, sql, postgresql",От 1 года до 3 лет,Not Specified,Data Engineer,hh_parser_final_dataset.csv,no
616ee735,Middle Data Engineer,"python, fastapi, sql, postgresql, docker, ci/cd, git, pandas",От 1 года до 3 лет,Высшее образование,Data Engineer,hh_parser_final_dataset.csv,no
9eecace8,Data Engineer / BI Engineer,"python, sql, postgresql, kafka, rabbitmq",От 1 года до 3 лет,Not Specified,Data Engineer,hh_parser_final_dataset.csv,no
bf970cd5,Manager / Data Engineer / Analyst,sql,От 1 года до 3 лет,Not Specified,Data Engineer,hh_parser_final_dataset.csv,no
5bb8127f,Data Engineer (DWH),"sql, postgresql",От 3 до 6 лет,Not Specified,Data Engineer,hh_parser_final_dataset.csv,no
d84470aa,Старший разработчик ETL процессов ( Data Engineer),"python, sql, postgresql",От 3 до 6 лет,Not Specified,Data Engineer,hh_parser_final_dataset.csv,no
7fb060ea,Middle QA Engineer,"python, java, javascript, mongodb, ci/cd, data science, cypress",От 1 года до 3 лет,Not Specified,QA Engineer,hh_parser_final_dataset.csv,no
309d67ae,Test Automation Engineer | SDET | Middle+ | Python,"python, kubernetes, ci/cd",От 3 до 6 лет,Not Specified,Backend Developer,hh_parser_final_dataset.csv,no
1342c9e7,AI Engineer (Backend / Python),"python, fastapi, django, postgresql, redis, docker, numpy, scikit-learn",От 3 до 6 лет,Not Specified,Backend Developer,hh_parser_final_dataset.csv,no
6f17642b,Senior ML Engineer (LLM / RAG),"python, fastapi, sql, elasticsearch, docker, ci/cd, ml",От 3 до 6 лет,Not Specified,Data Scientist,hh_parser_final_dataset.csv,no
e2681071,Middle Data Engineer (Lakehouse / Big Data),"python, sql, postgresql",От 3 до 6 лет,Not Specified,Data Engineer,hh_parser_final_dataset.csv,no
0ca2defd,Middle Data Engineer (Отдел развития и внедрения AI),"python, sql, postgresql, kafka, ml, data science, pandas",От 3 до 6 лет,Not Specified,Data Engineer,hh_parser_final_dataset.csv,no
6ee95fa4,Middle Data Engineer,"sql, postgresql",От 1 года до 3 лет,Not Specified,Data Engineer,hh_parser_final_dataset.csv,no
e67cc8a1,Data Engineer,"python, fastapi, sql, docker",От 1 года до 3 лет,Not Specified,Data Engineer,hh_parser_final_dataset.csv,no
f0faf3ab,Middle Data Engineer,"sql, postgresql",От 1 года до 3 лет,Not Specified,Data Engineer,hh_parser_final_dataset.csv,no
4c5ccb93,Data Engineer (Insurance / Finance),"python, sql, postgresql, kafka",От 3 до 6 лет,Not Specified,Data Engineer,hh_parser_final_dataset.csv,no
0e25a08f,Junior DevOps Engineer (Azure),"python, javascript, typescript, php, sql, postgresql, mysql, mongodb, redis, docker, kubernetes, ci/cd, git, bash, ansible, terraform, html",От 1 года до 3 лет,Not Specified,DevOps Engineer,hh_parser_final_dataset.csv,no
d5986432,Senior Machine Learning Engineer,"python, fastapi, sql, postgresql, redis, docker, kubernetes, ci/cd, git, machine learning, ml, data science",От 3 до 6 лет,Not Specified,Data Scientist,hh_parser_final_dataset.csv,no
2779d410,Senior Backend Engineer (Laravel / Event-Driven / High Load),"php, mysql, redis, kafka, docker",От 3 до 6 лет,Not Specified,Backend Developer,hh_parser_final_dataset.csv,no
4d1b8519,Data Engineer (Analytics),"python, sql, postgresql, mysql, pandas, numpy",От 3 до 6 лет,Not Specified,Data Engineer,hh_parser_final_dataset.csv,no
e1e72238,Data engineer (Middle),"python, sql, postgresql, redis, kafka, docker, git, linux, ml",От 1 года до 3 лет,Not Specified,Data Engineer,hh_parser_final_dataset.csv,no
71d0c18f,Senior Data Engineer (Greenplum),"sql, kafka, ml",Более 6 лет,Not Specified,Data Engineer,hh_parser_final_dataset.csv,no
b0ef59ba,Data Engineer,"python, sql, rabbitmq, docker, k8s, git, pandas",От 3 до 6 лет,Not Specified,Data Engineer,hh_parser_final_dataset.csv,no
0dab665f,Data Engineer в Направление системного анализа,sql,От 3 до 6 лет,Not Specified,Data Engineer,hh_parser_final_dataset.csv,no
27059c39,DevOps Engineer,"python, php, mysql, docker, ci/cd, linux, bash, ansible",От 3 до 6 лет,Not Specified,DevOps Engineer,hh_parser_final_dataset.csv,no
d7e67dd1,Senior Data Engineer,"sql, ml",Более 6 лет,Not Specified,Data Engineer,hh_parser_final_dataset.csv,no
27646e5a,Middle ML engineer,"python, fastapi, postgresql, redis, kafka, docker, ml, pytorch",От 3 до 6 лет,Not Specified,Data Scientist,hh_parser_final_dataset.csv,no
f517c4be,Analytics Data Engineer (DWH / BI Platform) Middle+ / Senior,"sql, kafka",От 3 до 6 лет,Not Specified,Data Engineer,hh_parser_final_dataset.csv,no
c7222934,Data Scientist,"python, fastapi, sql, docker, git, ml, data science, pandas, numpy, scikit-learn, pytorch, tensorflow",От 3 до 6 лет,Высшее образование,Data Scientist,hh_parser_final_dataset.csv,no
7397591e,Data Engineer,"python, sql, postgresql, ml, pandas",От 3 до 6 лет,Not Specified,Data Engineer,hh_parser_final_dataset.csv,no
94f420fe,DevOps Engineer/L2,"mysql, mongodb, redis, kafka, rabbitmq, kubernetes, ci/cd, linux",Более 6 лет,Not Specified,DevOps Engineer,hh_parser_final_dataset.csv,no
0afaf6fd,Middle Machine Learning Engineer – Financial Applications,"python, machine learning, data science, scikit-learn, pytorch",От 3 до 6 лет,Not Specified,Data Scientist,hh_parser_final_dataset.csv,no
971ad92f,Full-Stack Developer (Middle),"java, javascript, go, vue, spring, sql, postgresql, mysql, docker, ci/cd, git",От 3 до 6 лет,Not Specified,Full Stack Developer,hh_parser_final_dataset.csv,no
59afd369,Full-Stack Developer (Python / TypeScript),"python, typescript, react, fastapi, sql, postgresql, redis, kafka, docker, kubernetes, ci/cd, ml, tailwind",От 3 до 6 лет,Not Specified,Full Stack Developer,hh_parser_final_dataset.csv,no
dfe405c1,General/Full-Stack QA - specialist,"javascript, docker, ci/cd, figma",От 3 до 6 лет,Not Specified,Full Stack Developer,hh_parser_final_dataset.csv,no
9d5cec1b,Full-stack разработчик (Middle),"python, fastapi, django, git",От 1 года до 3 лет,Not Specified,Full Stack Developer,hh_parser_final_dataset.csv,no
aa54bc31,Full Stack developer (Back - Node/ Front - React),"javascript, react, express, postgresql, kafka",От 3 до 6 лет,Not Specified,Full Stack Developer,hh_parser_final_dataset.csv,no
627127bb,Видеограф / Motion-дизайнер (Full-stack контент-мейкер),figma,От 1 года до 3 лет,Not Specified,Full Stack Developer,hh_parser_final_dataset.csv,no
6746a43e,Fullstack PHP-разработчик,"javascript, php, vue, nuxt, sql, mysql, redis, elasticsearch, git",От 1 года до 3 лет,Not Specified,Backend Developer,hh_parser_final_dataset.csv,no
f9293e30,Senior Frontend Developer в Kaspi Delivery Team (в офисе),"javascript, typescript, react, vue, nuxt, docker, ci/cd, cypress, jest",Более 6 лет,Not Specified,Frontend Developer,hh_parser_final_dataset.csv,no
ea8aa05a,Frontend-разработчик,"javascript, typescript, react, angular, git, ui/ux",От 3 до 6 лет,Not Specified,Frontend Developer,hh_parser_final_dataset.csv,no
75ab1144,Full-Stack Инженер,"javascript, typescript, react, express, sql, postgresql, mysql, docker, ci/cd, git",От 3 до 6 лет,Not Specified,Full Stack Developer,hh_parser_final_dataset.csv,no
9b658695,Full Stack разработчик (Python / FastAPI + React),"python, react, fastapi, sql, postgresql, redis, kafka, rabbitmq, docker, ci/cd",От 1 года до 3 лет,Not Specified,Full Stack Developer,hh_parser_final_dataset.csv,no
a4ad12ed,Fullstack-разработчик (Java),"java, react, vue",От 1 года до 3 лет,Not Specified,Backend Developer,hh_parser_final_dataset.csv,no
fb8224c7,"Разработчик (флуттер), Отдел по проекту QazaqGaz","postgresql, mysql, git",Более 6 лет,Not Specified,QA Engineer,hh_parser_final_dataset.csv,no
637d9282,Fullstack разработчик (Java/Kotlin + Angular),"java, typescript, react, angular, spring, postgresql, redis, docker, kubernetes",От 3 до 6 лет,Not Specified,Mobile Developer,hh_parser_final_dataset.csv,no
287a8e22,"Frontend developer (React, middle+/senior)","javascript, typescript, react, ci/cd",От 3 до 6 лет,Not Specified,Frontend Developer,hh_parser_final_dataset.csv,no
4f759121,Middle Backend Developer (NodeJS),"javascript, typescript, react, express, postgresql, mongodb, redis, docker, ci/cd, git, data science",От 3 до 6 лет,Not Specified,Backend Developer,hh_parser_final_dataset.csv,no
cc62536f,Frontend-разработчик,"javascript, react, git",От 1 года до 3 лет,Not Specified,Frontend Developer,hh_parser_final_dataset.csv,no
86badaae,Full Stack Test Engineer Trainee,sql,От 1 года до 3 лет,Not Specified,Full Stack Developer,hh_parser_final_dataset.csv,no
f3b8f10b,Senior Full Stack Developer / Product Engineer,"python, javascript, typescript, php, react, vue, postgresql, mysql",От 3 до 6 лет,Not Specified,Full Stack Developer,hh_parser_final_dataset.csv,no
c82fc7c2,"Tech Lead / Full Stack Lead (MedusaJS, Node.js, React)","javascript, react, express, postgresql, redis, kafka, rabbitmq, ci/cd",От 3 до 6 лет,Not Specified,Full Stack Developer,hh_parser_final_dataset.csv,no
472d661e,Senior Full-stack Developer,"javascript, typescript, go, react, sql, kafka, docker, kubernetes, ci/cd",От 1 года до 3 лет,Not Specified,Full Stack Developer,hh_parser_final_dataset.csv,no
b3876122,Middle/Senior Full-Stack Developer (C# / JS),"javascript, .net, vue",От 1 года до 3 лет,Not Specified,Full Stack Developer,hh_parser_final_dataset.csv,no
f944f2d9,"Full stack разработчик веб приложений, сайтов и мобильных приложений","javascript, html, css",От 3 до 6 лет,Not Specified,Full Stack Developer,hh_parser_final_dataset.csv,no
9ff248b8,"Tech Lead / Lead JavaScript AR Developer (A‑Frame / Three.js, React, Next.js, Node.js, Go)","javascript, go, react, docker, ci/cd, git, html, css",От 1 года до 3 лет,Not Specified,Frontend Developer,hh_parser_final_dataset.csv,no
fcb9d5fd,Senior Typescript/Node JS разработчик,"javascript, typescript, react, express, postgresql, docker, html, css, tailwind",Более 6 лет,Not Specified,Backend Developer,hh_parser_final_dataset.csv,no
70c1077a,Backend-разработчик (midle/junior/стажёр),"python, javascript, react, vue, git, html, css",От 1 года до 3 лет,Not Specified,Backend Developer,hh_parser_final_dataset.csv,no
2c22f7cd,Support / DevOps Engineer,"python, javascript, typescript, react, express, sql, postgresql, docker, git, linux, bash",От 1 года до 3 лет,Not Specified,DevOps Engineer,hh_parser_final_dataset.csv,no
e88919a7,FullStack - разработчик 1C-Bitrix CMS | WP | JS | PHP,"javascript, php, vue, sql, mysql, git, html, css",От 1 года до 3 лет,Not Specified,Backend Developer,hh_parser_final_dataset.csv,no
faf9aba0,Senior Developer (Flutter / Laravel / React),"javascript, react",От 1 года до 3 лет,Not Specified,Mobile Developer,hh_parser_final_dataset.csv,no
d65c949c,Full-Stack Developer,"javascript, typescript, react",От 1 года до 3 лет,Not Specified,Full Stack Developer,hh_parser_final_dataset.csv,no
0be6b697,Middle Full-Stack Developer Web Platform,"javascript, typescript, react, vue, express, postgresql, mongodb, docker, ci/cd, git",От 3 до 6 лет,Not Specified,Full Stack Developer,hh_parser_final_dataset.csv,no
865d71e1,"Full-stack разработчик (AI / ChatGPT, мобильное приложение)","python, javascript",От 1 года до 3 лет,Not Specified,Full Stack Developer,hh_parser_final_dataset.csv,no
0ca1f6fc,Full-Stack JS developer (Ментор),"javascript, react, sql, git, html, css",От 1 года до 3 лет,Студент,Full Stack Developer,hh_parser_final_dataset.csv,no
b5e51c47,"Fullstack-разработчик (PostgreSQL, Java , Vue.js)","java, javascript, typescript, vue, spring, postgresql, css, sass, ui/ux",От 3 до 6 лет,Not Specified,Frontend Developer,hh_parser_final_dataset.csv,no
ee5e1a25,Fullstack Javascript/Typescript Developer,"python, java, javascript, typescript, go, php, react, angular, vue, express, django, spring, postgresql, mysql, mongodb, redis, kafka, rabbitmq, docker, ci/cd, git, linux, ml",От 1 года до 3 лет,Not Specified,Backend Developer,hh_parser_final_dataset.csv,no
9c1f7095,Ведущий инженер (Python backend developer) сектор аутстаффинг,"python, javascript, php, vue, fastapi, django, sql, postgresql, mysql, kafka",Без опыта,Not Specified,Backend Developer,hh_parser_final_dataset.csv,no
6645470c,Middle Fullstack / Backend Developer (AI-Native Architect),"python, javascript, postgresql, redis, docker, ci/cd",От 3 до 6 лет,Not Specified,Backend Developer,hh_parser_final_dataset.csv,no
94ccdb58,"AI-first Full Stack Developer (Node.js, React, PostgreSQL)","javascript, typescript, react, postgresql, docker",Более 6 лет,Not Specified,Full Stack Developer,hh_parser_final_dataset.csv,no
8fd80edc,"Full-Stack developer | React, Next.js, Node.js, Python","python, javascript, react",От 3 до 6 лет,Not Specified,Full Stack Developer,hh_parser_final_dataset.csv,no
c6e0bf7a,Senior Fullstack-разработчик (Go + React Native),"java, go, golang, react, sql, postgresql, redis, kafka, rabbitmq, docker, ci/cd, tailwind, jest",От 3 до 6 лет,Not Specified,Frontend Developer,hh_parser_final_dataset.csv,no
19462e07,Middle Frontend Developer (React native),"javascript, typescript, react, express, postgresql, mongodb, redis, docker, git, data science",От 1 года до 3 лет,Not Specified,Frontend Developer,hh_parser_final_dataset.csv,no
e569e48e,React Native Senior Developer,"java, react, ci/cd, html, css, jest",От 3 до 6 лет,Not Specified,Frontend Developer,hh_parser_final_dataset.csv,no
1b31365e,Senior / Lead Full-Stack Developer (Python/Django/FastAPI + Vue/PrimeVue),"python, javascript, react, vue, fastapi, django, postgresql, docker, ci/cd, linux",Более 6 лет,Not Specified,Full Stack Developer,hh_parser_final_dataset.csv,no
0bdab445,Tech Lead / System Architect (Golang| Distributed Systems & IoT),"go, golang, postgresql, ci/cd, linux",От 3 до 6 лет,Not Specified,Backend Developer,hh_parser_final_dataset.csv,no
7cafe161,React/NodeJS разработчик - Программист Junior/Middle,"javascript, react, sql, git",От 3 до 6 лет,Not Specified,Frontend Developer,hh_parser_final_dataset.csv,no
440a1527,Ведущий Full Stack Разработчик,"javascript, typescript, react, sql, kubernetes, git, linux",От 3 до 6 лет,Not Specified,Full Stack Developer,hh_parser_final_dataset.csv,no
779c91e2,Full stack разработчик,"javascript, typescript, php, react, vue, git, css",От 3 до 6 лет,Not Specified,Full Stack Developer,hh_parser_final_dataset.csv,no
684e2b27,Full-Stack WEB-разработчик,"javascript, php, react, sql, git, html, css, figma",Более 6 лет,Not Specified,Full Stack Developer,hh_parser_final_dataset.csv,no
831c8f73,Data Scientist,"python, sql, docker, machine learning, data science, pandas, numpy, scikit-learn, pytorch, tensorflow",От 3 до 6 лет,Not Specified,Data Scientist,hh_parser_final_dataset.csv,no
fcbdf97f,Data Scientist,"python, ml, data science, pandas, numpy, scikit-learn, pytorch, tensorflow",От 3 до 6 лет,Not Specified,Data Scientist,hh_parser_final_dataset.csv,no
8c6c94a3,Middle Data Scientist,"python, sql, machine learning, ml",От 3 до 6 лет,Высшее образование,Data Scientist,hh_parser_final_dataset.csv,no
b5aa9279,Middle Data Scientist (Отдел развития и внедрения AI),"python, sql, postgresql, git, ml, data science, pandas, numpy, scikit-learn",От 1 года до 3 лет,Not Specified,Data Scientist,hh_parser_final_dataset.csv,no
abacd20d,Data Scientist,"python, java, golang, sql, postgresql, linux, ml, data science, pandas, numpy, scikit-learn, pytorch",Более 6 лет,Not Specified,Data Scientist,hh_parser_final_dataset.csv,no
f75a9e6b,Senior Data Scientist,"python, sql, ci/cd",От 3 до 6 лет,Высшее образование,Data Scientist,hh_parser_final_dataset.csv,no
5bd3cef0,"Senior Data Scientist, Отдел развития и внедрения AI","python, sql, postgresql, git, machine learning, ml, data science, pandas, numpy, scikit-learn",От 3 до 6 лет,Not Specified,Data Scientist,hh_parser_final_dataset.csv,no
e16833ed,Lead Data Scientist,"python, sql, ml, data science, pandas, numpy, scikit-learn",От 3 до 6 лет,Высшее образование,Data Scientist,hh_parser_final_dataset.csv,no
d2b0cefa,ML-инженер/Data Scientist,"python, sql, machine learning, ml, pandas, numpy, scikit-learn",От 3 до 6 лет,Высшее образование,Data Scientist,hh_parser_final_dataset.csv,no
88aedb52,Data Analyst,"python, sql, ci/cd, git, ml",От 1 года до 3 лет,Not Specified,Data Analyst,hh_parser_final_dataset.csv,no
d6b40b30,Middle/Senior Data analyst в Kaspi shop,"python, sql, ml",От 1 года до 3 лет,Not Specified,Data Analyst,hh_parser_final_dataset.csv,no
f6aaebd2,Junior Data Analyst,sql,От 1 года до 3 лет,Not Specified,Data Analyst,hh_parser_final_dataset.csv,no
d4e82ee8,Senior Data Analyst,"python, sql, ci/cd",От 1 года до 3 лет,Высшее образование,Data Analyst,hh_parser_final_dataset.csv,no
