job_id,job_title,skills,experience_level,education_level,label,source,is_custom
b3debdaf,Mobile Developer,"мобильный разработчик, react native, swift, ios, rest api, flutter, mobile",Без опыта,Высшее техническое образование,Mobile Developer,hh_parser_custom_jobs.csv,yes
8b3f2dd3,Mobile Developer,"android, react native, ios, мобильные приложения, мобильный разработчик, rest api, flutter",Без опыта,Высшее образование,Mobile Developer,hh_parser_custom_jobs.csv,yes
eb2b3bf7,Mobile Developer,"react native, mobile, kotlin, flutter, ui/ux, мобильные приложения, мобильный разработчик",Опыт работы от 3 до 6 лет,Высшее образование,Mobile Developer,hh_parser_custom_jobs.csv,yes
02745904,Mobile Developer,"ios, kotlin, мобильный разработчик, ui/ux, мобильные приложения",Опыт работы от 3 до 6 лет,Среднее специальное образование,Mobile Developer,hh_parser_custom_jobs.csv,yes
ab094126,Mobile Developer,"swift, react native, android, ios, ui/ux, flutter, мобильные приложения",Опыт более 6 лет,Студент,Mobile Developer,hh_parser_custom_jobs.csv,yes
704f6601,Mobile Developer,"kotlin, rest api, flutter, мобильные приложения, ui/ux",Опыт работы от 1 до 3 лет,Студент,Mobile Developer,hh_parser_custom_jobs.csv,yes
206ed658,Mobile Developer,"rest api, мобильные приложения, react native, android, mobile, swift, мобильный разработчик, flutter",Опыт работы от 3 до 6 лет,Высшее образование,Mobile Developer,hh_parser_custom_jobs.csv,yes
1b7d9b45,Mobile Developer,"swift, rest api, mobile, react native, мобильные приложения",Опыт более 6 лет,Высшее техническое образование,Mobile Developer,hh_parser_custom_jobs.csv,yes
733f9f9f,Mobile Developer,"kotlin, мобильные приложения, rest api, android, swift, мобильный разработчик, react native",Опыт работы от 3 до 6 лет,Среднее специальное образование,Mobile Developer,hh_parser_custom_jobs.csv,yes
9e983e59,Mobile Developer,"ui/ux, mobile, rest api, flutter, ios, react native",Опыт более 6 лет,Высшее техническое образование,Mobile Developer,hh_parser_custom_jobs.csv,yes
d3235b35,Mobile Developer,"flutter, kotlin, мобильный разработчик, мобильные приложения, swift, ios, mobile",Без опыта,Высшее техническое образование,Mobile Developer,hh_parser_custom_jobs.csv,yes
f6a3f57a,Mobile Developer,"swift, мобильные приложения, ui/ux, flutter, react native, мобильный разработчик, kotlin",Опыт работы от 3 до 6 лет,Среднее специальное образование,Mobile Developer,hh_parser_custom_jobs.csv,yes
36d6933d,Mobile Developer,"flutter, ios, ui/ux, rest api, мобильный разработчик, react native",Опыт работы от 1 до 3 лет,Не имеет значения,Mobile Developer,hh_parser_custom_jobs.csv,yes
0c84378f,Mobile Developer,"swift, ui/ux, мобильные приложения, mobile",Опыт работы от 1 до 3 лет,Высшее образование,Mobile Developer,hh_parser_custom_jobs.csv,yes
a6ff6dca,Mobile Developer,"swift, ui/ux, мобильный разработчик, kotlin",Без опыта,Высшее образование,Mobile Developer,hh_parser_custom_jobs.csv,yes
b557a47f,Mobile Developer,"мобильные приложения, mobile, react native, kotlin, rest api, ios, мобильный разработчик",Опыт работы от 3 до 6 лет,Не имеет значения,Mobile Developer,hh_parser_custom_jobs.csv,yes
0c6d455d,Mobile Developer,"ui/ux, мобильный разработчик, react native, ios, мобильные приложения, kotlin, mobile",Опыт работы от 3 до 6 лет,Высшее образование,Mobile Developer,hh_parser_custom_jobs.csv,yes
9205cef9,Mobile Developer,"мобильные приложения, ios, react native, kotlin, swift, mobile, flutter",Опыт более 6 лет,Высшее техническое образование,Mobile Developer,hh_parser_custom_jobs.csv,yes
4c89b5cb,Mobile Developer,"rest api, kotlin, мобильные приложения, flutter, android, react native, ui/ux, mobile",Опыт более 6 лет,Высшее техническое образование,Mobile Developer,hh_parser_custom_jobs.csv,yes
8f010e87,Mobile Developer,"rest api, ios, android, мобильный разработчик, ui/ux, react native, kotlin, flutter",Опыт работы от 3 до 6 лет,Студент,Mobile Developer,hh_parser_custom_jobs.csv,yes
a38579ac,Mobile Developer,"мобильный разработчик, rest api, мобильные приложения, flutter, ui/ux, kotlin, ios, react native",Опыт более 6 лет,Высшее образование,Mobile Developer,hh_parser_custom_jobs.csv,yes
eebd4010,Mobile Developer,"android, мобильные приложения, mobile, flutter, react native, swift, ui/ux",Без опыта,Студент,Mobile Developer,hh_parser_custom_jobs.csv,yes
34d8b4ac,Mobile Developer,"ios, kotlin, mobile, react native, android, мобильные приложения",Опыт работы от 3 до 6 лет,Среднее специальное образование,Mobile Developer,hh_parser_custom_jobs.csv,yes
b3cfdfd9,Mobile Developer,"мобильный разработчик, swift, kotlin, ios",Опыт работы от 1 до 3 лет,Высшее техническое образование,Mobile Developer,hh_parser_custom_jobs.csv,yes
eb0aa88b,Mobile Developer,"react native, мобильный разработчик, мобильные приложения, mobile",Без опыта,Не имеет значения,Mobile Developer,hh_parser_custom_jobs.csv,yes
862805b6,Mobile Developer,"мобильные приложения, mobile, ui/ux, react native, мобильный разработчик, flutter",Опыт работы от 3 до 6 лет,Студент,Mobile Developer,hh_parser_custom_jobs.csv,yes
b3440738,Mobile Developer,"android, ui/ux, мобильный разработчик, flutter, kotlin",Без опыта,Высшее образование,Mobile Developer,hh_parser_custom_jobs.csv,yes
f163a96c,Mobile Developer,"мобильный разработчик, ios, swift, kotlin, android, mobile",Опыт работы от 1 до 3 лет,Высшее образование,Mobile Developer,hh_parser_custom_jobs.csv,yes
8105e34b,Mobile Developer,"mobile, react native, ios, android, flutter",Опыт работы от 1 до 3 лет,Среднее специальное образование,Mobile Developer,hh_parser_custom_jobs.csv,yes
7cc877ba,Mobile Developer,"flutter, swift, react native, android",Опыт работы от 1 до 3 лет,Студент,Mobile Developer,hh_parser_custom_jobs.csv,yes
1baa46d4,Mobile Developer,"мобильный разработчик, react native, rest api, ui/ux, ios",Опыт работы от 1 до 3 лет,Не имеет значения,Mobile Developer,hh_parser_custom_jobs.csv,yes
70dcb6bb,Mobile Developer,"android, rest api, flutter, react native",Опыт работы от 3 до 6 лет,Высшее образование,Mobile Developer,hh_parser_custom_jobs.csv,yes
471945e3,Mobile Developer,"ios, swift, мобильный разработчик, kotlin, rest api, react native, flutter, mobile",Без опыта,Не имеет значения,Mobile Developer,hh_parser_custom_jobs.csv,yes
a18a0af5,Mobile Developer,"kotlin, ui/ux, swift, react native, android",Опыт работы от 1 до 3 лет,Студент,Mobile Developer,hh_parser_custom_jobs.csv,yes
16ac6453,Mobile Developer,"android, swift, react native, kotlin, flutter, мобильные приложения, ui/ux, mobile",Без опыта,Не имеет значения,Mobile Developer,hh_parser_custom_jobs.csv,yes
e1a19682,Mobile Developer,"react native, swift, flutter, rest api",Опыт работы от 1 до 3 лет,Студент,Mobile Developer,hh_parser_custom_jobs.csv,yes
e24de60e,Mobile Developer,"react native, android, mobile, flutter, мобильный разработчик, swift",Опыт работы от 1 до 3 лет,Студент,Mobile Developer,hh_parser_custom_jobs.csv,yes
0db02884,Mobile Developer,"react native, rest api, swift, мобильные приложения, mobile, flutter, мобильный разработчик",Опыт более 6 лет,Среднее специальное образование,Mobile Developer,hh_parser_custom_jobs.csv,yes
f7cfd188,Mobile Developer,"мобильные приложения, ios, android, rest api, мобильный разработчик",Опыт работы от 1 до 3 лет,Высшее образование,Mobile Developer,hh_parser_custom_jobs.csv,yes
e9596a10,Mobile Developer,"react native, mobile, мобильные приложения, мобильный разработчик, ui/ux, flutter, kotlin",Опыт работы от 3 до 6 лет,Среднее специальное образование,Mobile Developer,hh_parser_custom_jobs.csv,yes
1d768263,Mobile Developer,"swift, mobile, android, ios, flutter, ui/ux, kotlin",Опыт работы от 3 до 6 лет,Высшее образование,Mobile Developer,hh_parser_custom_jobs.csv,yes
be495de1,Mobile Developer,"ios, swift, mobile, react native, rest api, мобильный разработчик, flutter",Опыт работы от 1 до 3 лет,Высшее образование,Mobile Developer,hh_parser_custom_jobs.csv,yes
d3ec2fc2,Mobile Developer,"мобильные приложения, mobile, ios, мобильный разработчик",Без опыта,Среднее специальное образование,Mobile Developer,hh_parser_custom_jobs.csv,yes
dab23617,Frontend Developer,"html, javascript, typescript, spa, css, webpack, ui/ux, angular",Опыт работы от 1 до 3 лет,Высшее техническое образование,Frontend Developer,hh_parser_custom_jobs.csv,yes
3c5d308c,Frontend Developer,"angular, webpack, spa, sass, vue",Опыт работы от 3 до 6 лет,Студент,Frontend Developer,hh_parser_custom_jobs.csv,yes
d8dd46f7,Frontend Developer,"webpack, spa, vue, react, фронтенд, ui/ux, javascript, figma",Опыт более 6 лет,Высшее техническое образование,Frontend Developer,hh_parser_custom_jobs.csv,yes
082d771c,Frontend Developer,"react, javascript, html, spa, vue, webpack, ui/ux",Опыт более 6 лет,Высшее образование,Frontend Developer,hh_parser_custom_jobs.csv,yes
f8fb02b9,Frontend Developer,"frontend, spa, css, html, react",Опыт работы от 3 до 6 лет,Высшее образование,Frontend Developer,hh_parser_custom_jobs.csv,yes
aa424625,Frontend Developer,"spa, фронтенд, ui/ux, angular, sass, javascript, vue, css",Без опыта,Высшее образование,Frontend Developer,hh_parser_custom_jobs.csv,yes
3ed25dfd,Frontend Developer,"javascript, фронтенд, angular, react, figma, html, webpack",Опыт работы от 1 до 3 лет,Не имеет значения,Frontend Developer,hh_parser_custom_jobs.csv,yes
0bfe46e7,Frontend Developer,"ui/ux, webpack, javascript, sass, react",Опыт более 6 лет,Среднее специальное образование,Frontend Developer,hh_parser_custom_jobs.csv,yes
b0f623e1,Frontend Developer,"sass, javascript, angular, frontend, react",Опыт работы от 1 до 3 лет,Не имеет значения,Frontend Developer,hh_parser_custom_jobs.csv,yes
f3437095,Frontend Developer,"vue, sass, typescript, react, css, spa, javascript, figma",Без опыта,Не имеет значения,Frontend Developer,hh_parser_custom_jobs.csv,yes
b9a89388,Frontend Developer,"angular, ui/ux, react, typescript, spa",Опыт более 6 лет,Студент,Frontend Developer,hh_parser_custom_jobs.csv,yes
e08dc93b,Frontend Developer,"spa, html, figma, sass, ui/ux",Опыт более 6 лет,Студент,Frontend Developer,hh_parser_custom_jobs.csv,yes
afd92ea1,Frontend Developer,"react, angular, фронтенд, ui/ux, vue, spa",Без опыта,Высшее техническое образование,Frontend Developer,hh_parser_custom_jobs.csv,yes
27dcc8f3,Frontend Developer,"frontend, javascript, sass, ui/ux, webpack, css, react",Опыт работы от 1 до 3 лет,Не имеет значения,Frontend Developer,hh_parser_custom_jobs.csv,yes
08f526e5,Frontend Developer,"webpack, sass, ui/ux, html, spa, frontend",Опыт более 6 лет,Не имеет значения,Frontend Developer,hh_parser_custom_jobs.csv,yes
653e64f9,Frontend Developer,"фронтенд, figma, webpack, typescript, react, html, javascript",Опыт более 6 лет,Высшее техническое образование,Frontend Developer,hh_parser_custom_jobs.csv,yes
b8fa2573,Frontend Developer,"html, css, figma, angular, react",Без опыта,Высшее техническое образование,Frontend Developer,hh_parser_custom_jobs.csv,yes
220795fd,Frontend Developer,"spa, javascript, react, angular",Опыт работы от 3 до 6 лет,Высшее техническое образование,Frontend Developer,hh_parser_custom_jobs.csv,yes
6b8e4140,Frontend Developer,"vue, figma, frontend, react, css, typescript, angular, html",Опыт работы от 3 до 6 лет,Студент,Frontend Developer,hh_parser_custom_jobs.csv,yes
0ee9bda5,Frontend Developer,"фронтенд, figma, react, spa, vue, css, frontend, ui/ux",Опыт более 6 лет,Среднее специальное образование,Frontend Developer,hh_parser_custom_jobs.csv,yes
93465226,Frontend Developer,"webpack, sass, angular, ui/ux, фронтенд, spa, vue",Опыт работы от 1 до 3 лет,Студент,Frontend Developer,hh_parser_custom_jobs.csv,yes
1d82d493,Frontend Developer,"фронтенд, html, frontend, sass, figma, vue, angular",Без опыта,Среднее специальное образование,Frontend Developer,hh_parser_custom_jobs.csv,yes
32bb613e,Frontend Developer,"ui/ux, javascript, angular, css, фронтенд, vue, react",Без опыта,Высшее техническое образование,Frontend Developer,hh_parser_custom_jobs.csv,yes
99728409,Frontend Developer,"css, typescript, фронтенд, webpack, angular, sass, javascript, html",Опыт работы от 3 до 6 лет,Высшее техническое образование,Frontend Developer,hh_parser_custom_jobs.csv,yes
d4b23be0,Frontend Developer,"ui/ux, spa, html, css",Опыт работы от 3 до 6 лет,Студент,Frontend Developer,hh_parser_custom_jobs.csv,yes
ffb7bd3a,Frontend Developer,"react, spa, angular, html",Опыт работы от 3 до 6 лет,Студент,Frontend Developer,hh_parser_custom_jobs.csv,yes
08be3acc,Frontend Developer,"фронтенд, javascript, angular, sass, css, typescript",Без опыта,Студент,Frontend Developer,hh_parser_custom_jobs.csv,yes
ef7077ca,Frontend Developer,"angular, css, webpack, frontend, typescript, figma, фронтенд",Опыт работы от 1 до 3 лет,Среднее специальное образование,Frontend Developer,hh_parser_custom_jobs.csv,yes
3d542766,Frontend Developer,"html, figma, spa, angular, vue, react, typescript",Опыт работы от 1 до 3 лет,Высшее образование,Frontend Developer,hh_parser_custom_jobs.csv,yes
6225039e,Frontend Developer,"webpack, react, angular, vue, typescript",Опыт более 6 лет,Не имеет значения,Frontend Developer,hh_parser_custom_jobs.csv,yes
6cd9c9c0,Frontend Developer,"react, ui/ux, frontend, angular, vue",Без опыта,Не имеет значения,Frontend Developer,hh_parser_custom_jobs.csv,yes
bacf27de,Frontend Developer,"css, frontend, html, фронтенд, vue",Опыт работы от 1 до 3 лет,Среднее специальное образование,Frontend Developer,hh_parser_custom_jobs.csv,yes
0dc7e57a,Frontend Developer,"фронтенд, frontend, webpack, figma, typescript, css",Опыт работы от 1 до 3 лет,Высшее техническое образование,Frontend Developer,hh_parser_custom_jobs.csv,yes
3edf635d,Frontend Developer,"sass, фронтенд, frontend, react, ui/ux, javascript, typescript, figma",Опыт работы от 3 до 6 лет,Высшее техническое образование,Frontend Developer,hh_parser_custom_jobs.csv,yes
bc1cb304,Frontend Developer,"spa, frontend, html, css",Без опыта,Не имеет значения,Frontend Developer,hh_parser_custom_jobs.csv,yes
100cd464,Frontend Developer,"css, angular, spa, react",Без опыта,Высшее техническое образование,Frontend Developer,hh_parser_custom_jobs.csv,yes
dd87758d,Frontend Developer,"spa, vue, ui/ux, typescript, sass, css, angular",Опыт работы от 3 до 6 лет,Студент,Frontend Developer,hh_parser_custom_jobs.csv,yes
ce4987ae,Frontend Developer,"фронтенд, angular, javascript, vue, css, sass, spa",Опыт работы от 1 до 3 лет,Высшее техническое образование,Frontend Developer,hh_parser_custom_jobs.csv,yes
2dc12424,Frontend Developer,"javascript, angular, react, typescript, frontend",Опыт более 6 лет,Высшее образование,Frontend Developer,hh_parser_custom_jobs.csv,yes
a792a3ba,Frontend Developer,"css, фронтенд, spa, html, typescript, javascript, angular, vue",Без опыта,Высшее техническое образование,Frontend Developer,hh_parser_custom_jobs.csv,yes
3256097a,Frontend Developer,"spa, css, typescript, html",Опыт работы от 1 до 3 лет,Высшее образование,Frontend Developer,hh_parser_custom_jobs.csv,yes
a37d7d7e,Frontend Developer,"webpack, angular, vue, html, css",Опыт работы от 3 до 6 лет,Не имеет значения,Frontend Developer,hh_parser_custom_jobs.csv,yes
ab58b5ec,Frontend Developer,"фронтенд, vue, figma, angular",Опыт работы от 1 до 3 лет,Студент,Frontend Developer,hh_parser_custom_jobs.csv,yes
47f59618,Frontend Developer,"vue, css, frontend, react",Опыт более 6 лет,Среднее специальное образование,Frontend Developer,hh_parser_custom_jobs.csv,yes
6a6d01f3,Frontend Developer,"typescript, webpack, angular, react, sass, html, spa",Опыт работы от 1 до 3 лет,Высшее образование,Frontend Developer,hh_parser_custom_jobs.csv,yes
00f92995,Frontend Developer,"sass, css, ui/ux, angular, webpack, vue, spa",Опыт работы от 3 до 6 лет,Не имеет значения,Frontend Developer,hh_parser_custom_jobs.csv,yes
9cd52e92,Frontend Developer,"angular, typescript, фронтенд, figma, vue, react",Без опыта,Высшее техническое образование,Frontend Developer,hh_parser_custom_jobs.csv,yes
8f8a5b83,Frontend Developer,"webpack, html, frontend, spa, фронтенд",Опыт работы от 3 до 6 лет,Студент,Frontend Developer,hh_parser_custom_jobs.csv,yes
3386d75a,Frontend Developer,"react, фронтенд, frontend, webpack, html, typescript",Без опыта,Не имеет значения,Frontend Developer,hh_parser_custom_jobs.csv,yes
6f839c6b,Frontend Developer,"figma, javascript, фронтенд, angular",Опыт работы от 1 до 3 лет,Высшее образование,Frontend Developer,hh_parser_custom_jobs.csv,yes
058b75cc,Frontend Developer,"angular, figma, html, sass, javascript, react, vue, ui/ux",Опыт работы от 1 до 3 лет,Высшее техническое образование,Frontend Developer,hh_parser_custom_jobs.csv,yes
6bbe1e75,Frontend Developer,"typescript, react, ui/ux, vue, figma, css, javascript",Опыт работы от 3 до 6 лет,Среднее специальное образование,Frontend Developer,hh_parser_custom_jobs.csv,yes
ad1154d2,Frontend Developer,"vue, frontend, react, javascript",Опыт более 6 лет,Не имеет значения,Frontend Developer,hh_parser_custom_jobs.csv,yes
1eb5ee4a,Frontend Developer,"angular, css, html, webpack",Опыт работы от 3 до 6 лет,Среднее специальное образование,Frontend Developer,hh_parser_custom_jobs.csv,yes
046d4707,Frontend Developer,"webpack, frontend, figma, javascript, vue",Опыт более 6 лет,Высшее образование,Frontend Developer,hh_parser_custom_jobs.csv,yes
4882dfb4,Frontend Developer,"react, vue, typescript, javascript, webpack",Без опыта,Высшее техническое образование,Frontend Developer,hh_parser_custom_jobs.csv,yes
88ea4620,Frontend Developer,"figma, фронтенд, javascript, frontend, vue",Опыт работы от 1 до 3 лет,Не имеет значения,Frontend Developer,hh_parser_custom_jobs.csv,yes
1eaa9b52,Frontend Developer,"webpack, react, css, figma, javascript, фронтенд, frontend, ui/ux",Опыт работы от 3 до 6 лет,Высшее образование,Frontend Developer,hh_parser_custom_jobs.csv,yes
432ad16e,Frontend Developer,"typescript, javascript, css, html, react, vue, ui/ux",Опыт работы от 3 до 6 лет,Студент,Frontend Developer,hh_parser_custom_jobs.csv,yes
167c891d,Frontend Developer,"css, sass, vue, figma, javascript, spa, react",Без опыта,Не имеет значения,Frontend Developer,hh_parser_custom_jobs.csv,yes
14fb27aa,Middle Data Engineer (Lakehouse / Big Data),"python, sql, postgresql",Более 6 лет,Not Specified,Data Engineer,hh_parser_final_dataset.csv,no
46dcdc75,Data analyst (Senior),sql,Без опыта,Not Specified,Data Analyst,hh_parser_final_dataset.csv,no
aaab5c89,Senior Data Software Engineer (Big Data Engineer),"python, java, sql, kafka, ml",От 3 до 6 лет,Not Specified,Data Engineer,hh_parser_final_dataset.csv,no
301dce0f,ML-инженер,"python, sql, ml, data science, pandas, numpy",Без опыта,Not Specified,Data Scientist,hh_parser_final_dataset.csv,no
fabf1938,ML-инженер/Data Scientist,"python, sql, machine learning, ml, pandas, numpy, scikit-learn",Более 6 лет,Высшее образование,Data Scientist,hh_parser_final_dataset.csv,no
3d91d8d3,Data Analyst (Junior) в Департамент кредитных рисков,"python, sql, pandas",От 1 года до 3 лет,Not Specified,Data Analyst,hh_parser_final_dataset.csv,no
91835ce8,Data Engineer (Analytics),"python, sql, postgresql, mysql, pandas, numpy",Более 6 лет,Not Specified,Data Engineer,hh_parser_final_dataset.csv,no
edcefe7f,Data Analyst (Аналитик данных),"python, sql, ml",Без опыта,Not Specified,Data Analyst,hh_parser_final_dataset.csv,no
7324d82a,Аналитик данных,"python, sql, pandas, numpy",Без опыта,Среднее образование,Data Analyst,hh_parser_final_dataset.csv,no
47b80eee,Backend-разработчик,"golang, sql, postgresql, mysql, kafka, rabbitmq, docker, kubernetes, ci/cd",Без опыта,Not Specified,Backend Developer,hh_parser_final_dataset.csv,no
0cd3323f,Middle Machine Learning Engineer – Financial Applications,"python, machine learning, data science, scikit-learn, pytorch",Без опыта,Not Specified,Data Scientist,hh_parser_final_dataset.csv,no
7cecf7a7,Аналитик данных / Marketing Data Analyst — международная онлайн-школа K-12,"python, sql",От 1 года до 3 лет,Not Specified,Data Analyst,hh_parser_final_dataset.csv,no
a689a18d,Data Analyst,"python, sql, ci/cd, git, ml",От 1 года до 3 лет,Not Specified,Data Analyst,hh_parser_final_dataset.csv,no
963e71d3,Data Scientist,"python, ml, data science, pandas, numpy, scikit-learn, pytorch, tensorflow",От 1 года до 3 лет,Not Specified,Data Scientist,hh_parser_final_dataset.csv,no
52f1dfdc,DevOps Engineer,"python, php, mysql, docker, ci/cd, linux, bash, ansible",Более 6 лет,Not Specified,DevOps Engineer,hh_parser_final_dataset.csv,no
b3bb2a08,Middle Data Scientist,"python, sql, machine learning, ml",От 3 до 6 лет,Высшее образование,Data Scientist,hh_parser_final_dataset.csv,no
2b7ad7f6,"Senior Data Scientist, Отдел развития и внедрения AI","python, sql, postgresql, git, machine learning, ml, data science, pandas, numpy, scikit-learn",От 1 года до 3 лет,Not Specified,Data Scientist,hh_parser_final_dataset.csv,no
b7a25895,Middle Data Scientist (Отдел развития и внедрения AI),"python, sql, postgresql, git, ml, data science, pandas, numpy, scikit-learn",От 1 года до 3 лет,Not Specified,Data Scientist,hh_parser_final_dataset.csv,no
