title,salary,city,job,publish_date,requirements,responsibilities,schedule,experience,employment,url
Специалист поддержки игроков со знанием английского языка,,,Pixel Talent,,"Свободное владение английским языком (уровень C1 Advanced); Грамотный письменный русский язык; Техническая подготовка на уровне продвинутого пользователя ПК и мобильных устройств; Желание и готовность учиться и повышать свою квалификацию, в том числе на курсах, оплачиваемых компанией; Большой игровой опыт, любовь к играм; Высокий уровень самодисциплины и ответственности; Наличие современного ПК, мобильного устройства на Android, стабильного интернет-соединения. У тебя будет возможность проявить свои навыки, выполнив тестовое задание. Предлагаем: Удалённый формат работы; График работы: с воскресенья по четверг, с 06:00 до 15:00 по кипрскому времени (включая 1 час на перерыв) График на период онбординга: с воскресенья по четверг, с 11:00 до 20:00 по кипрскому времени (включая 1 час на обед); Частичная занятость в праздничные дни; Фиксированная почасовая оплата по результатам собеседования и тестового задания; Сотрудничество на условиях контракта (договор оказания услуг).","Обработка обращений пользователей — ответы на вопросы по игре, решение технических и платёжных проблем, работа с жалобами; Работа с отзывами в Google Play и App Store; Модерация игровых чатов и социальных сетей; Мониторинг работоспособности игры (в Grafana и других инструментах); Оповещение разработчиков о возникающих неполадках; Участие в тестировании обновлений игры и игрового Портала, тесное взаимодействие с QA; Сбор фидбека от игроков. Наши ожидания: Свободное владение английским языком (уровень C1 Advanced); Грамотный письменный русский язык; Техническая подготовка на уровне продвинутого пользователя ПК и мобильных устройств; Желание и готовность учиться и повышать свою квалификацию, в том числе на курсах, оплачиваемых компанией; Большой игровой опыт, любовь к играм; Высокий уровень самодисциплины и ответственности; Наличие современного ПК, мобильного устройства на Android, стабильного интернет-соединения. У тебя будет возможность проявить свои навыки, выполнив тестовое задание. Предлагаем: Удалённый формат работы; График работы: с воскресенья по четверг, с 06:00 до 15:00 по кипрскому времени (включая 1 час на перерыв) График на период онбординга: с воскресенья по четверг, с 11:00 до 20:00 по кипрскому времени (включая 1 час на обед); Частичная занятость в праздничные дни; Фиксированная почасовая оплата по результатам собеседования и тестового задания; Сотрудничество на условиях контракта (договор оказания услуг).",,не требуется,,https://almaty.hh.kz/vacancy/131927753
UI/UX Designer (Fintech / Crypto / Web + Mobile),от 3 000 $ за месяц,Алматы,"WTS Co.,Ltd",,"Привет! Мы ищем UI/UX-дизайнера в команду WTP Technology. Не просто «нарисуй экраны», а человека, который думает, строит и предлагает и получает удовольствие от того, что его работа реально влияет на продукт. Кто мы такие? Мы — международный финтех-сервис, предлагающий современные платёжные решения с поддержкой криптовалюты и мультивалютных пополнений. Наш продукт создан на каждый день — от обычных онлайн-покупок до повседневных трат офлайн в путешествиях и по всему миру. Мы помогаем пользователям из 170+ стран легко и быстро платить. Это инструмент, с которым человек платит легко и без боли: за кофе в Барселоне, подписку в Штатах, отель в Таиланде или просто в магазине у дома. Кого мы ищем Нам нужен дизайнер, который думает как продакт: понимает пользователя, работает с метриками и осознаёт, что красивый интерфейс — это тот, который приносит ценность пользователю и влияет на бизнес-результаты. Задачи Проектировать UX-флоу: onboarding, KYC, выпуск карт, пополнение счёта — продумывать каждый шаг пользователя Создавать интерфейсы для Web, Telegram Mini App, iOS и Android Анализировать пользовательское поведение, находить точки drop-off и устранять их Участвовать в growth-инициативах и A/B-тестах, напрямую влиять на конверсию и LTV Работать в связке с продактом, разработкой и аналитикой — без бюрократии и долгих согласований Мониторить тренды в финтехе и мобильных интерфейсах, предлагать инициативы Требования 5+ лет опыта в UI/UX дизайне Figma — уверенно, без оговорок Сильное продуктовое мышление, умение работать с задачами, а не только с экранами Понимание пользовательского поведения и UX-паттернов Опыт работы с аналитикой: метрики, воронки, поведенческие данные Хорошая насмотренность — понимание, что делает дизайн качественным Английский от Intermediate (читать документацию, общаться с командой) Будет плюсом Опыт в финтехе или крипто-проектах Работа с Telegram Mini Apps Знание iOS Human Interface Guidelines и Android Material Design Базовое понимание фронтенда — что реально реализуемо в разработке Отслеживание трендов финтех-индустрии Тестовое задание Мы не верим в многочасовые испытания и бесконечные этапы. Тестовое — компактное и по делу. Вы получите реальную продуктовую задачу из нашей области, по которой нужно будет предложить UX-решение и обосновать его. Мы оцениваем мышление, структуру подачи и умение думать про пользователя — а не количество экранов. Задание оплачивается и занимает не более 3–4 часов. Условия Зарплата: от $3 000 + бонусы в месяц в зависимости от уровня и скиллов кандидата + бонусы за результат Формат: удалённо или офис в Алматы — на ваш выбор. Команда: дружная, без лишней бюрократии, с прямым влиянием на продукт Проекты: реальные финтех-продукты с живыми пользователями из 170+ стран Рост: возможность влиять на продуктовые решения и видеть результат своей работы Если что-то откликнулось — отправляй резюме и пару слов о себе. Можно без официоза. WTP Technology",,,более 6 лет,,https://almaty.hh.kz/vacancy/132530806
Разработчик мобильного приложения,от 300 000 до 600 000 ₸ за месяц,Алматы,High Tech Academy,,"О нас High Tech Academy - международная школа с аккредитацией CIS в Алматы. В структуру школы входит Budokan.kz -спортивный и арт-центр, один из крупнейших фитнес-клубов города с форматом «всё включено»: более 10 направлений, бассейн, тренажёрный зал, бойцовский клуб, скалолазание, детские группы и многое другое. Мы активно развиваемся в digital-направлении и ищем разработчика для создания мобильного приложения Budokan. Обязанности — Разработать мобильное приложение (iOS + Android) для членов клуба Budokan — Обеспечить интеграцию и синхронизацию данных с системой управления клубом ClubIS LLC (база клиентов, абонементы, посещаемость, расписание) — Реализовать личный кабинет: расписание занятий, запись на тренировки, история посещений — Интегрировать онлайн-оплату абонементов, заморозку и продление карты — Настроить push-уведомления: напоминания о тренировках, новости, акции — Реализовать раздел для детских групп с отдельным профилем ребёнка — Разработать административную панель для управления расписанием, тренерами и клиентами — Обеспечить поддержку и доработки после запуска Требования — Опыт мобильной разработки от 2 лет — Flutter, React Native или нативный iOS/Android — Работа с REST API, Firebase или аналогами — Опыт интеграции платёжных систем — Портфолио с реализованными приложениями — Самостоятельность, соблюдение сроков Будет плюсом — Опыт в fitness-tech / sports-tech проектах — Знание казахстанских платёжных шлюзов (Kaspi Pay, Forte, Halyk) — Навыки UI/UX или опыт работы с Figma — Опыт интеграции с CRM или 1С — Опыт работы с ClubIS или аналогичными системами управления фитнес-клубом Условия — Полный рабочий день, пятидневка — Официальное трудоустройство по ТК РК — Корпоративное питание (Завтрак, обед и полдник) — Бесплатный абонемент в Budokan: бассейн, тренажёрный зал, групповые занятия и все направления клуба — Работа в офисе школы High Tech Academy — Адрес: Алматы, Медеуский район, мкр. Кок-Тобе, ул. Сагадата Нурмагамбетова 150",,,1–3 года,,https://almaty.hh.kz/vacancy/132468026
QA Engineer,,Алматы,ТОО IT Space Apps,,"Опыт ручного тестирования API используя инструменты Postman/Insomnia/Swagger и т.д. Опыт работы в продуктовой команде; Понимание процессов разработки и тестирования (SDLC, STLC), подходов и практик Agile, Kanban, Scrum, etc.; Опыт работы с баг-трекинговыми системами (Jira, YouTrack, etc.); Знание SQL на уровне простых запросов, умение работать с СУБД PostgreSQL; Анализ логов Умение работать с TestFlight, AppTester, XCode; Работа с инструментами мониторинга HTTP/HTTPS трафика (Charles, Fiddler, etc.).","Проведение ручного функционального, smoke и регрессионного тестирования WEB и мобильных приложений; Создание, актуализация и сопровождение тестовой документации (чек-листы, тест-кейсы, тест-планы) Анализ требований, спецификаций и участие в планировании спринтов - выявление потенциальных рисков и точек отказа ещё на стадии проектирования; Тестирование API (REST/GraphQL); Анализ и воспроизведение багов, сбор логов, трассировок и другой технической информации; Мониторинг исправления дефектов в баг-трекинговой системе Jira; Взаимодействие с разработчиками, аналитиками и DevOps-инженерами для обеспечения высокого качества продукта на всех этапах; Участие в ретроспективах и QA-груммингах, предоставление предложений по улучшению процессов тестирования и разработки.",,1–3 года,,https://almaty.hh.kz/vacancy/132750601
Flutter-разработчик (Mobile) / GeOnline,,Астана,ТОО БІЛІМ CONSULTING,,"О компании GeOnline — образовательная EdTech-платформа для подготовки к ЕНТ. У нас активное мобильное приложение, которое собирает все необходимое для ученика в одном месте Задачи Разработка мобильного приложения на Flutter (iOS + Android) Реализация геймификации Улучшение существующего функционала Интеграция с backend (REST API) Участие в проектировании архитектуры приложения Оптимизация производительности и стабильности Подготовка и публикация приложения в App Store и Google Play Требования Опыт коммерческой разработки на Flutter от 2 лет Уверенное владение Dart и Flutter SDK Опыт разработки и поддержки мобильных приложений (iOS + Android) Понимание архитектур (MVVM / Clean Architecture / BLoC / Provider) Опыт работы с REST API, JSON Уверенное владение Git Опыт публикации приложений в App Store и Google Play Будет плюсом Опыт работы с Firebase (Auth, FCM и др.) Опыт реализации push-уведомлений Опыт работы с платежными системами Базовые знания CI/CD Опыт в EdTech или продуктовой разработке Мы ищем человека, который Умеет доводить задачи до результата, а не просто писать код Готов работать в условиях быстро меняющегося продукта Думает не только как разработчик, но и как продуктовый специалист Умеет самостоятельно принимать решения и предлагать улучшения Условия Офис в Астане Формат: full-time Конкурентная заработная плата (обсуждается по результатам собеседования) Возможность влиять на продукт и архитектуру Рост до ведущего разработчика / mobile lead Работа в быстрорастущем EdTech-проекте",,,1–3 года,,https://almaty.hh.kz/vacancy/132803228
Mobile Developer (Kotlin / Android),,Алматы,ТОО Agile Soft,,"— Уверенные знания Kotlin и Android SDK — Опыт разработки production-приложений — Понимание архитектур MVVM/MVI, Clean Architecture — Навыки работы с Git, CI/CD, Figma — Опыт работы с безопасностью, JWT, OAuth — Английский — на уровне чтения документации Будет плюсом: — Опыт работы в финтехе — Знание Jetpack Compose — Владение английским на уровне разговорного общения","— Разработка и поддержка мобильного приложения на Kotlin — Работа с REST API, push-уведомлениями, безопасностью и авторизацией — Участие в архитектуре и улучшении UI/UX — Интеграция с внутренними и внешними сервисами — Работа в команде с QA и backend-разработчиками",,3–6 лет,,https://almaty.hh.kz/vacancy/132049218
Android-разработчик во Freedom Business (middle/middle+),,Алматы,ТОО Globerce Inc.,,"Привет! Мы IT-компания Globerce Capital. Рады знакомству! IT-холдинг Globerce Capital – это команда молодых и амбициозных профессионалов. Мы проводим полный цикл разработки продукта (fintech, e-commerce, telecom), включая консалтинг, проектирование, внедрение и поддержку комплексных IT-решений для бизнеса. Команда Freedom Business (суперапп для ИП и ТОО) в поиске android developer'а грейда middle/middle+. По задачам: Участие в разработке и развитии Android-приложения. Реализация нового функционала и поддержка существующего. Создание современного интерфейса с использованием Jetpack Compose. Интеграция с backend-сервисами. Участие в code-review и командных обсуждениях. Hard Skills: — Опыт коммерческой Android-разработки от 3-х лет. — Опыт работы с Kotlin и Android SDK. — Опыт работы с Ktor, Compose, AndroidNav. Будет плюсом: Опыт работы с Compose Multiplatform. Понимание CI/CD процессов и опыт их настройки. Опыт публикации приложений в Google Play. Наши бенефиты: Удобный гибкий график работы (начинать рабочий день в 9:00 или в 10:00 - выбираешь сам). Трудоустройство по ТК РК. ДМС для сотрудников и их близких. Материальная помощь в различных жизненных ситуациях (рождение ребенка, свадьба, утрата близкого и тому подобное). Прозрачная система грейдирования. Скидки на спортивные абонементы в ведущих фитнес-клубах, комплименты от популярных заведений (десерты & кофе), подарки и бонусы от ряда наших партнеров, English Club внутри компании. Корпоративная техника (ноутбуки/мониторы). Технологичный офис в центре Алматы. See u!",,,3–6 лет,,https://almaty.hh.kz/vacancy/131923626
