title,salary,city,job,publish_date,requirements,responsibilities,schedule,experience,employment,url
Android Developer,,Алматы,АО Нурбанк,,"Опыт работы от 3х лет. Kotlin, Coroutines, Flow. Jetpack Compose / XML. MVVM / MVI, Clean Architecture. Работа с Room, DataStore, Retrofit/OkHttp. Знание принципов безопасной авторизации: OAuth2, JWT, PKCE (как преимущество). Навыки оптимизации UI и работы с Firebase/Sentry. Готовность разбираться в бизнес-логике банка. Знание принципов CI/CD (желательно). Понимание принципов безопасности и шифрования данных. Навык самостоятельного решения нетиповых задач. Опыт взаимодействия с другими командами разработки.","Разработка новых функций мобильного приложения. Участие в проектировании клиентской архитектуры. Реализация экранов и пользовательских сценариев по макетам Figma. Интеграция с backend-сервисами (REST, OAuth2). Работа с биометрией (Fingerprint/FaceID), KYC, загрузкой фото/документов. Оптимизация производительности приложения, устранение ошибок. Участие в code review, взаимодействие с аналитиками и дизайнерами. Участие в разработке архитектуры мобильных модулей. Подготовка технической документации (Wiki/Confluence). Участие в оценке задач, планировании, анализе требований. Взаимодействие с аналитиками и дизайнерами для уточнения UX-логики. Участие в смежных проектах банка при необходимости.",,3–6 лет,,https://almaty.hh.kz/vacancy/131866788
UI/UX Designer (Fintech / Crypto / Web + Mobile),от 3 000 $ за месяц,Алматы,"WTS Co.,Ltd",,"Привет! Мы ищем UI/UX-дизайнера в команду WTP Technology. Не просто «нарисуй экраны», а человека, который думает, строит и предлагает и получает удовольствие от того, что его работа реально влияет на продукт. Кто мы такие? Мы — международный финтех-сервис, предлагающий современные платёжные решения с поддержкой криптовалюты и мультивалютных пополнений. Наш продукт создан на каждый день — от обычных онлайн-покупок до повседневных трат офлайн в путешествиях и по всему миру. Мы помогаем пользователям из 170+ стран легко и быстро платить. Это инструмент, с которым человек платит легко и без боли: за кофе в Барселоне, подписку в Штатах, отель в Таиланде или просто в магазине у дома. Кого мы ищем Нам нужен дизайнер, который думает как продакт: понимает пользователя, работает с метриками и осознаёт, что красивый интерфейс — это тот, который приносит ценность пользователю и влияет на бизнес-результаты. Задачи Проектировать UX-флоу: onboarding, KYC, выпуск карт, пополнение счёта — продумывать каждый шаг пользователя Создавать интерфейсы для Web, Telegram Mini App, iOS и Android Анализировать пользовательское поведение, находить точки drop-off и устранять их Участвовать в growth-инициативах и A/B-тестах, напрямую влиять на конверсию и LTV Работать в связке с продактом, разработкой и аналитикой — без бюрократии и долгих согласований Мониторить тренды в финтехе и мобильных интерфейсах, предлагать инициативы Требования 5+ лет опыта в UI/UX дизайне Figma — уверенно, без оговорок Сильное продуктовое мышление, умение работать с задачами, а не только с экранами Понимание пользовательского поведения и UX-паттернов Опыт работы с аналитикой: метрики, воронки, поведенческие данные Хорошая насмотренность — понимание, что делает дизайн качественным Английский от Intermediate (читать документацию, общаться с командой) Будет плюсом Опыт в финтехе или крипто-проектах Работа с Telegram Mini Apps Знание iOS Human Interface Guidelines и Android Material Design Базовое понимание фронтенда — что реально реализуемо в разработке Отслеживание трендов финтех-индустрии Тестовое задание Мы не верим в многочасовые испытания и бесконечные этапы. Тестовое — компактное и по делу. Вы получите реальную продуктовую задачу из нашей области, по которой нужно будет предложить UX-решение и обосновать его. Мы оцениваем мышление, структуру подачи и умение думать про пользователя — а не количество экранов. Задание оплачивается и занимает не более 3–4 часов. Условия Зарплата: от $3 000 + бонусы в месяц в зависимости от уровня и скиллов кандидата + бонусы за результат Формат: удалённо или офис в Алматы — на ваш выбор. Команда: дружная, без лишней бюрократии, с прямым влиянием на продукт Проекты: реальные финтех-продукты с живыми пользователями из 170+ стран Рост: возможность влиять на продуктовые решения и видеть результат своей работы Если что-то откликнулось — отправляй резюме и пару слов о себе. Можно без официоза. WTP Technology",,,более 6 лет,,https://almaty.hh.kz/vacancy/132530805
Manual QA Engineer (Junior),от 400 € за месяц,,TownLive Games,,"Мы создаём захватывающие мобильные игры! Нами движет стремление разрабатывать и развивать классные проекты и выводить их в топы Google Play! Приглашаем в команду амбициозного Manual QA Engineer (Junior) для участия в разработке нашего проекта. Жанр - ситибилдер/ферма/экспедиция Почему мы? Удаленка навсегда, без перехода в офис; Команда профи и система онбординга - убедишься лично; Гибкое начало рабочего дня; Отпуск 28 дней, а также оплата больничного 100 %; Подарки в день рождения и денежные бонусы по случаю важных событий в жизни; Sick Days - 10 дней в год; Демократичная среда и психологически здоровая атмосфера внутри команды, где важен каждый; Возможность вносить свои изменения в процессы, коллеги, которые слышат и понимают Чем предстоит заниматься? Ручное тестирование мобильных игр: функциональное, smoke, регрессионное тестирование; Документирование обнаруженных ошибок и контроль их исправления (ревью багов); Работа с ТЗ - проверка на соответствие требованиям, взаимодействие с гейм-дизайнерами по возникающим вопросам; Планирование проверок: составление чек-листов и тест-планов, оценка времени на проведение тестирования; Взаимодействие с командой на всех этапах разработки; Составление инструкций по инструментам тестирования и работа с тестовой документацией; Работа с отзывами пользователей и поиск багов по заявленным проблемам игроков Мы идеально друг другу подходим, если у тебя есть: Наличие 1-2 устройств на ОС Android для тестирования; Богатый игровой опыт на мобильных девайсах и любовь к играм; Опыт тестирования мобильных Игр/приложений от полугода; Понимание методологий разработки ПО и видов тестирования; Опыт работы с таск-трекинговой системой; Развитые аналитические навыки, внимательность; Коммуникабельность, умение излагать свои мысли; +100 к карме, если имеется: Техническое образование; Опыт тестирования игр в жанре Farm Adventure; Опыт тестирования на различных платформах: Android, iOS; Опыт работы с Unity (понимание основ); Опыт работы с Git. Ждем Ваших откликов, будем рады знакомству!",,,1–3 года,,https://almaty.hh.kz/vacancy/132168179
Руководитель продукта,,Астана,ТОО DAMUMED (Дамумед),,"Для развития казахстанского медицинского цифрового облачного сервиса требуются требуются руководители продукта. Мы рады видеть в своей команде целеустремленных людей, готовых расти и развиваться вместе с нами. Мы разрабатываем продукт собственными силами. Мы также разрабатываем мобильные приложения для популярных платформ iOS и Android. Мы постоянно обсуждаем и реализуем новые идеи. Если вы хотите каждый день делать что-то важное и полезное для людей, для общества - приходите к нам, мы обещаем – будет интересно. Делаем медицину ближе и доступнее и приглашаем всех, кто готов делать это вместе с нами. Задачи и зона ответственности Реализация утверждённой продуктовой стратегии и roadmap Управление продуктовым бэклогом (приоритизация, актуализация, контроль исполнения) Постановка задач команде разработки (user stories, требования, критерии приёмки) Контроль сроков, качества и полноты реализации функционала Взаимодействие с бизнес-заказчиками и сбор требований Декомпозиция бизнес-требований в понятные задачи для разработки Участие в планировании (sprint planning, grooming, demo) Контроль соответствия реализуемого функционала бизнес-целям Анализ результатов внедрения фич (метрики, обратная связь пользователей) Управление продуктовой/функциональной командой (при наличии) Требования Опыт работы в роли Product Manager / Product Owner / системного аналитика от 3–5 лет Практический опыт управления бэклогом и взаимодействия с разработкой Умение формализовать требования (user stories, use cases, BPMN/диаграммы — желательно) Понимание процессов разработки (Agile/Scrum/Kanban) Сильные коммуникативные навыки (работа с бизнесом и IT) Системное мышление и внимание к деталям Будет преимуществом: Опыт в сложных доменных продуктах (например, здравоохранение, гос. системы) Опыт работы с интеграциями Навыки работы с метриками продукта Мы предлагаем Работа над значимым продуктом с высокой нагрузкой и сложной логикой Влияние на качество и развитие продукта Профессиональную команду разработки и аналитики Конкурентную оплату труда Гибкие условия работы",,,3–6 лет,,https://almaty.hh.kz/vacancy/131919666
QA Engineer Junior (Mobile),,,Adviva,,"Аналитический склад ума. Опыт тестирования API(JSON, REST API). Понимание процессов QA. Умение находить и читать логи на базовом уровне. Опыт работы с Postman, MySQL. Опыт тестирования мобильных приложений Android, iOS. Составление лаконичных баг-репортов и тест-кейсов. Будет плюсом опыт работы с платформами для управления логами(graylog/kibana) Наличие любых собственных устройств Android и iOS. Наличие Mac будет плюсом","Проводить функциональное, интеграционное, регрессионное тестирование и UI тестирование. Проводить тестирование на проде интеграций по чеклистам. Локализация, регистрация и проверка фикса дефектов на production окружении. Взаимодействие с командой поддержки по обращениям пользователей, валидация проблемы и определение причины неисправности, постановка задач на разработку. Взаимодействие с проектной командой (разработчики, аналитики, менеджеры, devops-инженеры, поддержка) по планируемым релизам, проверка нового продуктового функционала на проде. Проверка функционала по автоматическим отчетам об ошибках. Локализация ошибок и передача баг-репортов в команды разработки. Мониторинг ошибок на production.",,1–3 года,,https://almaty.hh.kz/vacancy/131985226
"Android-разработчик (Java), Алматы",,Алматы,ООО Центр корпоративных технологий,,"M4bank является одним из ведущих разработчиков в СНГ инновационных IT-решений для банковского и финансового сектора. Мы работаем на рынке с 2011 года. Наши клиенты - крупные банки и ритейл СНГ и России В нашу яркую команду мы ищем Android-разработчика, который хочет расти и развиваться вместе с нами. Что нужно будет делать: - Разрабатывать мобильные приложения и библиотеки для платформ Android/JVM. - Активно участвовать в процессе разработки, от начала проектирования до запуска продукта. - Активно общаться с коллегами, обсуждать варианты реализации функциональных возможностей и дизайн продукта. - Оптимизировать приложения. - Выявлять и устранять узкие места ПО. - Разбирать инциденты, связанные с дефектами ПО. Ты справишься если у тебя есть: - Хорошее знание и опыт разработки под платформу Android. - Хорошее знание Java, Kotlin и Kotlin stdlib. - Хорошая алгоритмическая подготовка. - Опыт работы с Java, Kotlin Coroutines, опыт многопоточного программирования. - Опыт работы с Jetpack Compose. - Опыт разработки сетевых приложений. - Минимум средний английский (intermediate). Плюсом будет: - Опыт работы в команде. - Опыт работы в сфере финансовых технологий. - Знание Java. - С терминалами или другим железом. - Знание гибких методологий разработки. - Опыт работы с git, jira, confluence. Условия: - График работы с 10.00 до 19.00 (офисный формат работы) - 5-ти дневная рабочая неделя. - Уютный офис с террасой в районе Мега Парка (Сейфуллина) Работа в офисе компании Испытательный срок 3 месяца",,,3–6 лет,,https://almaty.hh.kz/vacancy/131961284
Android-разработчик (Middle/Senior),,,ТОО TECHNO PARTNERS,,"О компании Edoox.com — ведущая образовательная платформа Казахстана для учащихся, учителей и школ. Более 1 млн пользователей и 2000 школ используют наш сервис для подготовки к экзаменам и контроля знаний. Технические требования Обязательные навыки Языки разработки Уверенное владение Kotlin (основной язык разработки). Знание Java для поддержки и развития существующего кода. Понимание ООП, SOLID, паттернов проектирования (MVVM, MVI, Clean Architecture). Android SDK и UI Глубокие знания Android SDK, жизненного цикла Activity/Fragment. Опыт работы с Jetpack Compose и классической XML-вёрсткой (Views). Jetpack-компоненты: ViewModel, LiveData, Navigation, Room, WorkManager. Опыт разработки адаптивных интерфейсов под планшеты и большие экраны (responsive layouts, ConstraintLayout, WindowSizeClass). Material Design 3. Асинхронность и многопоточность Kotlin Coroutines, Flow. Понимание принципов реактивного программирования. Сетевое взаимодействие Работа с REST API (Retrofit, OkHttp). Парсинг JSON (Gson, Moshi, kotlinx.serialization). Понимание принципов работы WebSocket (плюсом). Хранение данных Room, SQLite — локальные БД. SharedPreferences / DataStore. Кеширование данных и работа в офлайн-режиме. Dependency Injection Hilt или Koin. Инструменты Система контроля версий Git. Gradle (Kotlin DSL приветствуется). Android Studio, Profiler, Layout Inspector. Firebase (Crashlytics, Analytics, Push-уведомления). Тестирование Unit-тесты (JUnit, MockK). UI-тесты (Espresso, Compose Testing) — желательно. Публикация Опыт публикации приложений в Google Play. Понимание процесса подписи APK/AAB, работы с Play Console. Дополнительные плюсы Опыт работы с CI/CD (GitHub Actions, GitLab CI, Bitrise, Fastlane). Опыт работы с медиа-контентом (ExoPlayer, видео/аудио воспроизведение). Опыт с Kotlin Multiplatform (KMP). Опыт интеграции платежных систем. Опыт работы в EdTech-проектах. Базовые знания backend (REST API, понимание серверной части). Личные качества Умение быстро анализировать чужой код. Внимание к качеству UX и деталям интерфейса. Ответственность и соблюдение сроков. Готовность к работе в образовательном проекте с социальной миссией.",,,3–6 лет,,https://almaty.hh.kz/vacancy/132729555
"Бизнес / Системный аналитик, г.Астана",,Астана,ТОО DAMUMED (Дамумед),,"Опыт работы системным / бизнес-аналитиком в IT Понимание процессов разработки ПО Умение описывать требования в структурированном виде Навыки декомпозиции сложных задач Опыт работы с макетами интерфейсов (Figma или аналоги) Умение говорить с бизнесом и с разработкой «на одном языке» Если Вы обладаете более глубокими знаниями и опытом, чем перечислено выше, то мы будем рады предложить Вам более высокую категорию или вакансию. Приходите на собеседование. В ходе него мы сможем больше узнать о Вас и сделать Вам альтернативные предложения.","Анализ и формализация требований от бизнеса и внутренних заказчиков Декомпозиция требований на задачи для разработки Подготовка постановок задач (user stories, acceptance criteria) Проработка пользовательских сценариев Создание макетов интерфейсов (wireframes, прототипы) Взаимодействие с разработчиками, уточнение требований в процессе реализации",,3–6 лет,,https://almaty.hh.kz/vacancy/131895800
